,created_at,user_id,username,tweet,english
229,2021-04-12 12:01:34 SE Asia Standard Time,2940371460,mobitekno,"Bantu Percepatan Mitigasi dan Pemulihan Infrastruktur Jaringan di NTT, Telkomsel Terjunkan Tim Siaga Bencana TERRA: Mobitekno – Telkomsel menjalankan upaya maksimal dalam pemulihan layanan telekomunikasi akibat bencana banjir […]  https://t.co/PE7q0P3FFp  https://t.co/hKN7gMv7nF","Help Accelerate Mitigation and Recovery Infrastructure Network in NTT, Telkomsel terjunkan Disaster Preparedness Team TERRA: Mobitekno - Telkomsel run maximum efforts in restoration of telecommunication services due to floods [...] https://t.co/PE7q0P3FFp https://t.co/ hKN7gMv7nF"
230,2021-04-12 11:32:51 SE Asia Standard Time,2873071274,schmucklovin,"@Telkomsel halo telkomsel, saya skrg menggunakan layanan hyvrid halo dengan limit 50.000. apakah saya bisa menambah limit menjadi 70.000? karena dengan limit ini saya tidak bisa daftar mbanking. terima kasih.","@Telkomsel telkomsel hello, I skrg use hyvrid services halo with a limit of 50,000. if I can add a limit to 70,000? because with this limit I can not list mBanking. Thank you."
231,2021-04-12 07:13:46 SE Asia Standard Time,113203143,midnightbreakie,@Telkomsel semua layanan sms/RBT dan lain-lain yg nomor saya berlangganan. soalnya saya mau matikan semua langganan tersebut,@Telkomsel all sms services / RBT and others who subscribe to my number. because I want to turn off all subscriptions
232,2021-04-12 07:07:37 SE Asia Standard Time,113203143,midnightbreakie,"@Telkomsel min, terkait layanan-layanan yang saya gunakan (seperti Auto reply text) itu bisa dicek di mana ya? trims","@Telkomsel min, related services that I use (such as Auto reply text) that can be checked where ya? trims"
233,2021-04-11 17:35:38 SE Asia Standard Time,917687442030813184,bacotinterus,"@razor_rahendra Bg pernah ip nya tiada layanan ga? Hp aku dari luar, trus tiada layanan udh 2 hari, providernya telkomsel, imeinya ada tapi ga kedaftar di kemenperin, tau cara balikin jaringannya ga?","Bg @razor_rahendra ip ever gone ga service? Hp me from the outside, then no service UDH 2 days, the provider Telkomsel, IMEInya there but ga kedaftar in the Ministry of Industry, know how to network balikin ga?"
234,2021-04-11 14:20:59 SE Asia Standard Time,135815019,detikinet,Telkomsel kebut memulihkan layanan telekomunikasi pasca banjir bandang yang menerjang wilayah Provinsi Nusa Tenggara Timur (NTT).  https://t.co/StDM9XYnIE,Telkomsel racing restore telecommunications service after flash floods that hit the province of East Nusa Tenggara (NTT). https://t.co/StDM9XYnIE
235,2021-04-11 13:42:15 SE Asia Standard Time,100682135,imbams,"@Telkomsel halo, ini tadi saya chat cs via WA blm ada solusi utk nonaktifkan layanan sedot pulsa  https://t.co/BHshawyOVW","@Telkomsel hello, this is my last chat via WA p cs no solution For suction pulses disable services https://t.co/BHshawyOVW"
236,2021-04-11 11:12:57 SE Asia Standard Time,539079050,bukanenjoykeun,"@Telkomsel hallo kak, kenapa nomer saya tidak bisa cek pulsa/kuota ya? Setiap cek pulsa/kuota, otomatis langsung tiada layanan. Mohon bantuannya🙏🏻","@Telkomsel hallo kak, why my numbers can not check pulse / quota huh? Each check pulse / quotas, no direct automated service. please bantuannya🙏🏻"
237,2021-04-11 06:47:09 SE Asia Standard Time,2251383210,ahmadnormaulana,"Bantu Pelanggan yang Terdampak Bencana, Telkomsel Gratiskan Layanan Telepon dan SMS di NTT  https://t.co/uDwGuHMCo7  https://t.co/B3ga7oXGUQ","Assist Customers Affected Disaster, Telkomsel gratiskan Phone and SMS services at NTT https://t.co/uDwGuHMCo7 https://t.co/B3ga7oXGUQ"
238,2021-04-11 05:53:46 SE Asia Standard Time,77928999,hestybudiharti,"Hi @Telkomsel ! 👋🏻 Terima kasih untuk peningkatan layanan dan fitur di My Telkomsel. I really appreciate it, seneng banget udah didengerin. That’s cool! Sekarang perpanjang paket kuota keluarga NO drama! Super easy! ❤️  Btw makin seneng kalo perpanjangan bisa otomatis. 🥰✨","Hi @Telkomsel! 👋🏻 Thanks to improved services and features in My Telkomsel. I really appreciate it, very happy already didengerin. That's cool! Now extend the quota package NO family drama! Super easy! Btw ❤️ more happy if an extension can be automated. 🥰✨"
239,2021-04-10 23:15:55 SE Asia Standard Time,924970105,mfhaikall,"kemaren sore tiba tiba di telf 188nya telkomsel, nawarin layanan spesial karna sudah jadi pelanggan lama, nah sikat dong, mbak operator nya ngomong cepat banget, sampai akhirnya minta rincian via email aja, eh malah di wa, kan jadi chat wkw","Yesterday afternoon in the locked phone suddenly 188nya telkomsel, nawarin special services because customers already so long, now brush dong, its operator ya really fast way, until finally asked for details via email wrote, even in the wa eh, right so chat WKW"
240,2021-04-10 23:07:34 SE Asia Standard Time,564951196,idnpublic,Telkomsel Pulihkan Layanan Telekomunikasi di NTT  https://t.co/vZyvxcEe3c #Terbaru #berita #lifestyle #live,Restore Telkomsel Telecommunications Services in NTT https://t.co/vZyvxcEe3c #Terbaru #berita #lifestyle #live
241,2021-04-10 19:40:06 SE Asia Standard Time,1269927857989574656,techbizid,Baca selengkapnya: Telkomsel Pulihkan Layanan Telekomunikasi di NTT  https://t.co/GOLbAk1O5y #Telkomsel,Read more: Restore Telkomsel Telecommunications Services in NTT https://t.co/GOLbAk1O5y #Telkomsel
242,2021-04-10 14:23:41 SE Asia Standard Time,1090009992709558272,juniestrwbry18,Telkomsel napa seeeh😭😭😭 semalem tidak ada layanan sekarang lemot🥺,Telkomsel napa seeeh😭😭😭 semalem no service now lemot🥺
243,2021-04-10 13:13:53 SE Asia Standard Time,1073819705314406400,ibnukautsar06,@Telkomsel kok pulsa telkomsel saya tersedot terus ya padahal tidak ada layanan yang aktif,@Telkomsel telkomsel pulse why I sucked keep ya when no service is active
244,2021-04-09 22:25:58 SE Asia Standard Time,159051057,herrysw,Pengguna Telkomsel di NTT yang terdampak bencana silakan memanfaatkan layanan Rp0 ini.  https://t.co/TV64EVVqAD,Telkomsel users in the province affected by the disaster please take advantage of this service is $ 0. https://t.co/TV64EVVqAD
245,2021-04-09 21:36:34 SE Asia Standard Time,109478188,restitiyuliana,@Telkomsel solusi yang tepat udah berbulan2 cuma omongan harapan palsu. solusinya ya cuma perbaiki &amp; tingkatkan layanan. sinyal ditingkatkan. tambah pemancar. tambah fasilitas. bukan MAAF. muak lama2 emosi trs sama tsel ni.,@Telkomsel appropriate solutions already berbulan2 just waffle false expectations. yes only correct solution & amp; improve service. enhanced signal. plus transmitter. added facilities. not SORRY. lama2 fed trs same emotions TSEL ni.
246,2021-04-09 20:48:05 SE Asia Standard Time,620977821,halobca,"@vanilumangkun Operator yang dapat digunakan dalam layanan m-BCA pada aplikasi BCA mobile yaitu XL, Telkomsel, Indosat, Axis, Three. :) Tks ^Adin","Operator @vanilumangkun which can be used in m-BCA on the BCA mobile application that is XL, Telkomsel, Indosat, Axis, Three. Tks :) ^ Adin"
247,2021-04-09 18:39:24 SE Asia Standard Time,109478188,restitiyuliana,"tiap hari begini @Telkomsel  status signal baik, tapi ga bisa ngapa2in. ga ada perbaikan &amp; peningkatan layanan tah??  https://t.co/dGM1aDADPR","every day so @Telkomsel signal status is good, but can not ngapa2in. ga repair & amp; improved service tah ?? https://t.co/dGM1aDADPR"
248,2021-04-09 13:03:14 SE Asia Standard Time,1288496856,antaramakassar,Bencana alam menyebabkan penurunan kualitas layanan Telkomsel di NTT  https://t.co/gZqhfEt3Qj,The disasters caused a decrease in the quality of service Telkomsel in NTT https://t.co/gZqhfEt3Qj
249,2021-04-09 12:16:06 SE Asia Standard Time,2183428226,wahyudiimuhtar_,"@Telkomsel selamat siang, sudah 2 hari kok jaringan telkomsel di daerah saya lelet ya? apakah ada perbaikan layanan? saya sudah pindahin data ke 3G, 4G, turn off on mode pesawat tetep aja lelet.","@Telkomsel afternoon, already 2 days kok Telkomsel network in my area lelet huh? is there a repair service? I've pindahin data to the 3G, 4G, turn off airplane mode on slow tetep wrote."
250,2021-04-09 10:43:40 SE Asia Standard Time,143318459,edi_twit,"@Telkomsel saya urungkan daftar kartu Halo, semua layanan daftar online di web, aplikasi mytelkomsel semua gagal proses, bahkan tinggal bayar saja proses berhenti. Pilihan no di grapari terbatas, jadi musti jalur apalagi?","I @Telkomsel undo Hello card list, all services online listings on the web, application mytelkomsel all failed process, even live pay only the process stops. No options in GraPARI limited, so must track than anything else?"
251,2021-04-09 09:47:16 SE Asia Standard Time,143318459,edi_twit,"@Telkomsel fitur daftar kartu Halo di website dan di aplikasi mytelkomsel kenapa gagal proses terus ya, sudah ke grapari petugas juga nyerah, perbaiki dong layanan online nya","@Telkomsel features Hello card list on the website and in the application process keeps failing mytelkomsel why yes, it is to GraPARI officers also give up, fix his dong online services"
252,2021-04-09 06:44:45 SE Asia Standard Time,39853285,fajriyuneldi,"@TuankuNanSati Dalam 2 minggu kemarin ada hari2 tidak ada sinyal @Telkomsel, padahal saya sedang berada di Ibukota. Layanan pasca bayar kok gitu","In 2 weeks @TuankuNanSati day2 yesterday there was no signal @Telkomsel, when I was in the Capital. Postpaid why so"
253,2021-04-08 21:38:31 SE Asia Standard Time,725288155,rizapasha_,@irraOCTAVIA @NetflixID Komplain ke @Telkomsel yg membolehkan layanan SMS Masking,Complaints @NetflixID @irraOCTAVIA @Telkomsel to SMS services that allow Masking
254,2021-04-08 20:24:01 SE Asia Standard Time,1075673058931806208,indihome,"@aliefsukma @Telkomsel Hai, Kak Alief. Bondan cek nomor layanan **13 sudah tidak aktif. Perihal laporan jaringannya, untuk menjaga kerahasiaan data silakan informasikan nomor internet, atas nama dan nomor HP aktif melalui DM kami @IndiHomeCare, ya, Kak. Guna dapat kami bantu ce(1/2)","@aliefsukma @Telkomsel Hi, Kak Alief. Bondan check service number ** 13 are inactive. Statements regarding its network, to maintain the confidentiality of the data please inform Internet number, the name and mobile number is active through our DM @IndiHomeCare, yes, brother. In order that we can help ce (1/2)"
255,2021-04-08 19:44:05 SE Asia Standard Time,863173898,zeefachri,"@Telkomsel malem min, klo status gprs off itu jd ga bisa pake data kah? Mau di on via 3636 katanya layanan semetara ditiadakan","@Telkomsel malem min, Klo status jd gprs off it can not use the data kah? Want in on semetara services via 3636 he abolished"
256,2021-04-08 18:15:19 SE Asia Standard Time,620977821,halobca,"@katrinee127 dan perusahaan) Rupiah - BCA Dollar Provider yang bisa didaftarkan yaitu Telkomsel, Indosat, XL, 3, Smartfren Dokumen yang diperlukan untuk pendaftaran, perubahan, dan penutupan layanan Push Notification di cabang: 1. Kartu identitas asli (3/8) ^wandi","@ Katrinee127 and companies) Rupiah - BCA Dollar Provider that can be registered, namely Telkomsel, Indosat, XL, 3, Smartfren Documents required for registration, changes, and closing Push Notification service in branches: 1. The original identity card (3/8) ^ wandi"
257,2021-04-08 17:50:53 SE Asia Standard Time,171486042,umang__umang,"@IndiHome, @Telkomsel  Hari ini lemoot Menggunakan layanan Google, Ytb, Browsing info, Ilmu, Google Form, Email   lemoot.","@IndiHome, @Telkomsel Today lemoot Using a Google service, YTB, Browsing info, Science, Google Forms, Email lemoot."
258,2021-04-08 17:31:04 SE Asia Standard Time,3274358376,aylmhrn,"@Telkomsel ayo dong ini server telkomsel kenapa sih sama layanan google khususnya youtube ? Entar bisa, entar enggak. Gak jelas banget. Pake operator lain lancar-lancar aja","@Telkomsel come on this server why the hell same telkomsel particularly youtube google services? Could later, entar baseball. Not clear really. Pake other operators run smoothly aja"
259,2021-04-08 15:52:33 SE Asia Standard Time,1222344615677714433,myorbitid,"@Arif92Sherif Hai, untuk saat ini layanan Customer Care bisa diakses melalui DM Instagram @myorbitid, WhatsApp 08111776706 dan email cs@myorbit.id. Telkomsel Orbit akan terus mengembangkan untuk membuka channel layanan Customer Care lainnya. Terima kasih.","@ Arif92Sherif Hi, this time Customer Care service can be accessed via DM @myorbitid Instagram, WhatsApp 08,111,776,706 and email cs@myorbit.id. Orbit Telkomsel will continue to develop to open other channels Customer Care services. Thank you."
260,2021-04-08 15:11:11 SE Asia Standard Time,1113028266657382401,yourauroraaaaa,@rempongbgtt waktu pertama aku pke telkomsel lancar jaya trus tiba” tidak ada layanan udh di diemin 1 minggu akhirnya bisa lagi tpi tiba” suka 3g jaringanya akhirnya pindah indosaat lancar si allhamdulilah,"@rempongbgtt first time I pke telkomsel then arrive smoothly victorious ""no service UDH in diemin 1 week longer TPI finally arrived"" Like its network 3g eventually moved smoothly indosaat the allhamdulilah"
261,2021-04-08 13:42:04 SE Asia Standard Time,3274358376,aylmhrn,@Telkomsel Min ini kayaknya telkomsel bermasalah deh dengan layanan google. Saya akses pakai operator kuning normal-normal saja tidak ada gangguan,Min @Telkomsel this seems problematic telkomsel deh with google services. I use the access provider's normal yellow no interference
262,2021-04-08 10:44:33 SE Asia Standard Time,1075673058931806208,indihome,"@syounqt @Telkomsel Hai Sobat, maaf ya sdh mengganggu aktifitasnya. Perihal layanan internet yg kurang stabil bisa disebabkan krn banyaknya device yg terhubung yuk informasikan no internet dan no HP via DM ke @IndiHomeCare guna kami bantu pengecekan lebih lanjut. Ditunggu ko(1/2)","@syounqt @Telkomsel Hi buddy, I'm sorry SDH intrusive activities. Regarding internet services which are less stable may be caused krn number of devices that are connected yuk inform no internet and mobile phone number via DM to @IndiHomeCare we help to further checks. Anticipated ko (1/2)"
263,2021-04-08 08:01:22 SE Asia Standard Time,811897280563290112,koranbumn,Layanan TelkomGroup di NTT Sudah Kembali Normal  https://t.co/iOayS17d10 @TelkomIndonesia @Telkomsel @IndiHome @KemenBUMN @kemkominfo @IDX_BEI @KemensosRI @BNPB_Indonesia,TelkomGroup services at NTT Already Back to Normal https://t.co/iOayS17d10 @TelkomIndonesia @Telkomsel @IndiHome @KemenBUMN @kemkominfo @IDX_BEI @KemensosRI @BNPB_Indonesia
264,2021-04-08 00:17:29 SE Asia Standard Time,1075673058931806208,indihome,"@ArFajaro @Telkomsel Malam, Kak Fajar.  mohon maaf nih jadi kurang nyaman, Racka bantu cek dan di daerah rumah Kakak sedang dilakukan pemeliharaan jaringan yang berdampak pada penggunaan layanan internetnya tidak bisa diakses sementara.  berkenan menunggu proses perbaikannya (1/2)","@ArFajaro @Telkomsel Night, Sister Dawn. sorry ya feel so uncomfortable, Racka aids and area checks being performed maintenance Brother house network impact on the use of internet services can not be accessed while. deign to wait the process of repair (1/2)"
265,2021-04-07 21:10:31 SE Asia Standard Time,1105077287777558528,hyash47,@025FSX egk dloe ah aku mau kamu kasih telah berpartisipasi seputar produk dan layanan Telkomsel 😱😍🤩,@ 025FSX egk dloe ah I want you for participating the products and services Telkomsel 😱😍🤩
266,2021-04-07 20:20:57 SE Asia Standard Time,1133688995479580672,hahahiihiw,@nmnyajgush @Telkomsel Selamat datang di layanan telkomsel,@nmnyajgush @Telkomsel welcome service telkomsel
267,2021-04-07 18:59:43 SE Asia Standard Time,1298775626120171521,honeybe38064164,@Telkomsel Nomor lain kartu As masih ada layanan internet...,Other number aces @Telkomsel still no internet service ...
268,2021-04-07 18:53:05 SE Asia Standard Time,1298775626120171521,honeybe38064164,"@Telkomsel Atau mungkinkah ada kerusakan fisik di kartu Telkomsel, menyebabkan layanan internet tidak ada? Kalo cek *888# masih tersedia paket data.","@Telkomsel Or did no physical damage on the card Telkomsel, causing no internet service? If the check * 888 # is still available packet data."
269,2021-04-07 17:42:45 SE Asia Standard Time,48338392,astrindaa,"Ngent juga ni telkomsel. Giliran sms spam pinjaman online, santet online, kredit KTA aja cepet banget masuknya, giliran sms kode verifikasi layanan dia lamanya seanjing-anjing.","Ngent also ni Telkomsel. Rota spam sms loans online, online witchcraft, credit KTA cepet really wrote the entry, turn sms verification code he ever seanjing service-dog."
270,2021-04-07 17:01:44 SE Asia Standard Time,135815019,detikinet,Telkomsel sedang memulihkan layanan seluler di NTT usai Siklon Tropis Seroja. Inilah daftar daerah yang terdampak.  https://t.co/FNM6lppQc6,Telkomsel is restoring cellular services in the province after Tropical Cyclone Seroja. Here's a list of the affected area. https://t.co/FNM6lppQc6
271,2021-04-07 16:30:45 SE Asia Standard Time,620977821,halobca,"@hopeparkeer TKI - TAPRES - Rekening Giro (individu dan perusahaan) Rupiah - BCA Dollar. Provider yang bisa didaftarkan yaitu Telkomsel, Indosat, XL, 3, Smartfren Dokumen yang diperlukan untuk pendaftaran, perubahan, dan penutupan layanan Push Notification di (3/8) ^Leo","@hopeparkeer TKI - TAPRES - Demand Deposit Account (individuals and companies) Rupiah - BCA Dollar. Providers that can be registered, namely Telkomsel, Indosat, XL, 3, Smartfren Documents required for registration, changes, and closing Push Notification Service at (3/8) ^ Leo"
272,2021-04-07 14:38:48 SE Asia Standard Time,38757284,diantama,"Jujur layanan telkomsel udah terganggu sejak 2019, tp paling terasa parah mulai november 2020 yang lalu sampe skrg (tanpa bencana) pun masih belum baik @Telkomsel  https://t.co/4gzRhOyWN3","Honest services already disturbed Telkomsel since 2019, most noticeably worse tp start of November 2020 and until skrg (without disaster) is still not well @Telkomsel https://t.co/4gzRhOyWN3"
273,2021-04-07 13:42:35 SE Asia Standard Time,1006830254910988288,nayngin,@subtanyarl When i see you again and again then aku start dari posisi yang tergolong dalam kelas sejarah tapi aku waktu itu masih wajar jika kita tidak pernah gagal dalam hidup ini terlalu singkat jika hanya menyesal pun tidak ada yang bisa dibantu seputar produk dan layanan Telkomsel   Lah,@subtanyarl When i see you again and again then I start from the position that is classified in history classes but I was still reasonable if we never fail in life is too short if only regret nothing is to be assisted by the products and services Telkomsel Lah
274,2021-04-07 12:14:16 SE Asia Standard Time,135815019,detikinet,Banjir bandang dan bencana alam akibat Siklon Seroja di NTT ikut merusak layanan telekomunikasi. Telkomsel pun berupaya memulihkan BTS yang terdampak.  https://t.co/QAF0sThWl0,Flash floods and natural disasters due to cyclone damage Seroja joined NTT telecommunications services. Telkomsel also seeks to restore the affected base stations. https://t.co/QAF0sThWl0
275,2021-04-07 12:09:14 SE Asia Standard Time,891883949571457024,m17522147,SAYA AKAN TERUS UPDATE INFO TTG BUSUKNYA PELAYANAN DARI PERUSAHAAN @KemenBUMN !!! SAMPAI ADA TANGGAPAN DARI KEMENTERIAN TERKAIT!! KASIAN WARGA DAERAH.. MEREKA JUGA KURANG PAHAM HARUS MENGADU KEMANA?? MEREKA JUGA BAYAR LAYANAN YG SAMA KOK!!  @kemkominfo  @Kemendag  @Telkomsel,I WILL CONTINUE TO UPDATE INFO SERVICE COMPANY TTG rotten @KemenBUMN !!! NO RESPONSE FROM MINISTRY TO RELATED !! Kasian REGIONAL CITIZENS LESS .. THEY ALSO UNDERSTAND WHERE to complain ?? SERVICE WHICH THEY ALSO PAY THE SAME KOK !! @kemkominfo @Kemendag @Telkomsel
276,2021-04-07 12:03:24 SE Asia Standard Time,69183155,detikcom,Banjir bandang dan bencana alam akibat Siklon Seroja di NTT ikut merusak layanan telekomunikasi. Telkomsel pun berupaya memulihkan BTS yang terdampak.  https://t.co/CbPMgpv97d,Flash floods and natural disasters due to cyclone damage Seroja joined NTT telecommunications services. Telkomsel also seeks to restore the affected base stations. https://t.co/CbPMgpv97d
277,2021-04-07 11:33:16 SE Asia Standard Time,891883949571457024,m17522147,"GAK ADA 1 KM SINYAL @Telkomsel BUSUK!!! KAMI MENGGUNAKAN LAYANAN BAYAR PAKAI UANG..GAK GRATIS!! KALAU LAYANAN SINYALNYA BUSUK,APAKAH ADIL BUAT KONSUMEN??!!  DIMANA KONSUMEN BISA MENCARI KEADILAN??!!  TOLONG DI JAWAB PAK MENTERI..  @kemkominfo  @Kemendag  @Kemenkumham_RI  https://t.co/oKFDvPl5dk","GAK ADA 1 KM SIGNAL @Telkomsel STINKS !!! WE USE THE SERVICES TO PAY TO USE UANG..GAK FREE !! IF signal ROTTEN SERVICE, IS JUST FOR CONSUMER ?? !! WHERE CONSUMERS CAN FIND JUSTICE ?? !! PLEASE ANSWER IN PAK MINISTER .. @kemkominfo @Kemendag @Kemenkumham_RI https://t.co/oKFDvPl5dk"
278,2021-04-07 11:23:19 SE Asia Standard Time,765035200896118789,indihomecare,"@aullliac Hallo, Kak Aulia. Maaf ya, tapi biar bisa dicek lebih lanjut koneksi jaringan IndiHome-nya, coba deh informasikan dulu nomor layanan internet/telepon-nya di DM. Kalau buat laporan providernya akan dibantu oleh rekan kami di akun @Telkomsel ya. -Meika","@aullliac Hallo, Kak Aulia. Excuse me, but let me be checked more IndiHome its network connection, try deh first inform the internet service number / phone her at DM. If for providernya report will be assisted by our colleagues in the account @Telkomsel yes. -Meika"
279,2021-04-07 10:10:35 SE Asia Standard Time,765035200896118789,indihomecare,"@kuliproyeck Hai, Sobat. Maaf ya, tapi biar bisa dicek lebih lanjut koneksi jaringan IndiHome-nya, coba deh informasikan dulu nomor layanan internet/telepon-nya di DM. Kalau buat laporan providernya akan dibantu oleh rekan kami di akun @Telkomsel ya. -Meika","@kuliproyeck Hi, buddy. Excuse me, but let me be checked more IndiHome its network connection, try deh first inform the internet service number / phone her at DM. If for providernya report will be assisted by our colleagues in the account @Telkomsel yes. -Meika"
280,2021-04-07 10:05:25 SE Asia Standard Time,765035200896118789,indihomecare,"@ubi_yakiimo Hai, Kak Ubi. Maaf ya, tapi biar bisa dicek lebih lanjut koneksi jaringan IndiHome-nya, coba deh informasikan dulu nomor layanan internet/telepon-nya di DM. Kalau buat laporan providernya akan dibantu oleh rekan kami di akun @Telkomsel ya. -Meika","@ubi_yakiimo Hi, Kak Yam. Excuse me, but let me be checked more IndiHome its network connection, try deh first inform the internet service number / phone her at DM. If for providernya report will be assisted by our colleagues in the account @Telkomsel yes. -Meika"
281,2021-04-07 09:43:54 SE Asia Standard Time,1129446743806922753,squ33nz,"@Telkomsel Halo, saya mau tanya, jika saya berlangganan disney + hotstar via telkomsel, jika saya mau inputkan ke TV android bisa kah? atau layanan ini khusus di mobile (HP saja) dengan jaringan telkomsel, karena pasti di rumah menggunakan wifi untuk TV andorid .","@Telkomsel Hello, I want to ask, if I subscribe disney + Hotstar via Telkomsel, if I want to be fed to the TV android kah? or a special service in the mobile (HP only) with the Telkomsel network, because surely at home using the wifi for andorid TV."
282,2021-04-07 09:34:49 SE Asia Standard Time,765035200896118789,indihomecare,"@dhankeycoy Hallo, Kak Predi. Maaf ya, tapi biar bisa dicek lebih lanjut koneksi jaringan IndiHome-nya, coba deh informasikan dulu nomor layanan internet/telepon-nya di DM. Kalau buat laporan providernya akan dibantu oleh rekan kami di akun @Telkomsel ya. -Meika","@dhankeycoy Hallo, Kak Predi. Excuse me, but let me be checked more IndiHome its network connection, try deh first inform the internet service number / phone her at DM. If for providernya report will be assisted by our colleagues in the account @Telkomsel yes. -Meika"
283,2021-04-07 09:05:10 SE Asia Standard Time,765035200896118789,indihomecare,"@rnrzhr Hai, Kak Rid. Maaf ya, tapi biar bisa dicek lebih lanjut koneksi jaringan IndiHome-nya, coba deh informasikan dulu nomor layanan internet/telepon-nya di DM. Kalau buat laporan providernya akan dibantu oleh rekan kami di akun @Telkomsel ya. -Meika","@rnrzhr Hi, Kak Rid. Excuse me, but let me be checked more IndiHome its network connection, try deh first inform the internet service number / phone her at DM. If for providernya report will be assisted by our colleagues in the account @Telkomsel yes. -Meika"
284,2021-04-07 06:37:38 SE Asia Standard Time,1304118436532948993,m99lion,@haecodes veeskut kadang suka nusuk dari belakang kita curang dekat kau jugak ke tu bukan makanan pertamanya setelah lahir di kota ini memiliki tubuh yang berpori dan permukaan yang bisa dibantu seputar produk dan layanan Telkomsel silakan mention of the point where you are not to the,@haecodes veeskut sometimes like stabbing from behind us cheaters near you jugak to tu not his first meal after birth in this city has a porous body and a surface that can help Telkomsel about products and services please mention of the point where you are not to the
285,2021-04-07 01:01:04 SE Asia Standard Time,1260262351221080064,dell66962737,"@Telkomsel jaringannya kenapa ya, dari pagi lemot Mulu, gak WiFi gak layanan data sama aja lemot","Network @Telkomsel why yes, of slow morning Mulu, WiFi gak gak just the same data service is slow"
286,2021-04-06 18:46:59 SE Asia Standard Time,1370647689797373952,clariss40426114,min @Telkomsel maaf mau tanya saya mau ganti kartu ke 4g tapi ada layanan nya kalau ke grapari bawa apa aj ya. makasih,min @Telkomsel want to ask my forgiveness would replace existing cards to 4g but his services if GraPARI to take what ya aj. thanks
