,created_at,user_id,username,tweet,english
167,2020-12-18 12:44:28 SE Asia Standard Time,1339111812575313922,jokerpragmatic,"Slot Pragmatic Online Resmi  Seiring kemajuan teknologi di Indonesia yang berkembang sangat pesat, saat ini YoubetCash menyediakan layanan deposit dengan menggunakan pulsa XL dan Telkomsel    https://t.co/OUoVQBHDSV #youbetcash  https://t.co/VJCUyFkzlA","Official Pragmatic Online Slot As technology advances in Indonesia that is growing very rapidly, this time YoubetCash provide deposit services by using pulses XL and Telkomsel https://t.co/OUoVQBHDSV #youbetcash https://t.co/VJCUyFkzlA"
168,2020-12-18 11:42:57 SE Asia Standard Time,1112381850318561280,iniguehehehe,"Halo @Telkomsel, sudah seminggu ini sinyal saya tidak stabil, sign tetap 4g+ tapi semua layanan lemot, itu kenapa yaa, terima kasihh :((((","Hello @Telkomsel, already this week I signal is not stable, permanent sign 4g + but all the service is slow, it's why ya, thank kasihh: (((("
169,2020-12-17 23:18:51 SE Asia Standard Time,401960154,kama26elap,"@Telkomsel Dua minggu yg lalu ""sedang ada peningkatan sistem layanan"" jawabnya.. sekarang sama. Beresnya kapan? -Kama","@Telkomsel Two weeks ago ""was no increase in the service system"" he said .. now the same. Beresnya when? -Kama"
170,2020-12-17 22:41:26 SE Asia Standard Time,2425870004,tomistarky,Jadikan kecerian menikmati internetan dg layanan dari @Telkomsel seperti gambar berikut 👎👎👎👎👎  https://t.co/78ZJ6skkMT,Make cheerfulness enjoy accessing internet services from @Telkomsel dg as shown below 👎👎👎👎👎 https://t.co/78ZJ6skkMT
171,2020-12-17 22:34:54 SE Asia Standard Time,1339594081048006656,damaipuspita251,@Telkomsel Bagai mana cara berhenti layanan 95799,@Telkomsel How where and how to stop the service 95 799
172,2020-12-17 21:40:01 SE Asia Standard Time,1086224330285973505,nandagustiann,"@Telkomsel Masa peningkatan layanan gak kelar"" udah beberapa Minggu Kadang normal, kadang hancur, gak stabil koneksinya bahkan buat ngirim text aja pending","@Telkomsel future service improvement not finished ""already some sun sometimes normal, sometimes broken, do not create a stable connection even sent me a text aja pending"
173,2020-12-17 21:06:08 SE Asia Standard Time,882549228144279552,jjescrl,@Telkomsel kak aku beli kartu tsel baru kok tiada layanan yaa?,@Telkomsel kak I bought a new TSEL card yaa really no service?
174,2020-12-17 17:39:35 SE Asia Standard Time,95207664,micmac_7,@Telkomsel Terserah bad layanan,Whatever bad @Telkomsel service
175,2020-12-17 17:28:15 SE Asia Standard Time,95207664,micmac_7,@Telkomsel Ini ga bisa?sudah 4 kali dan sekarang 5 kali. Jadi kenapa? Sudah 2 minggu layanan jadi seperti ini?,@Telkomsel It can not? Already 4 times and is now 5 times. So what? Already two weeks of service like this?
176,2020-12-17 14:40:24 SE Asia Standard Time,1184956088,mcflurryorey0,"@Telkomsel Lemot nya dah dari kemaren2 min, emang peningkatan sistem layanan nya tiap hari?","Her Lemot @Telkomsel dah of kemaren2 min, weve increase its service system every day?"
177,2020-12-17 14:02:40 SE Asia Standard Time,1339111812575313922,jokerpragmatic,"Situs Slot Pragmatic  Seiring kemajuan teknologi di Indonesia yang berkembang sangat pesat, saat ini YoubetCash menyediakan layanan deposit dengan menggunakan pulsa XL dan Telkomsel    https://t.co/Icam9FA6N6 #youbetcash  https://t.co/ZWqt8AikbL","Slot Site Pragmatic As technology advances in Indonesia that is growing very rapidly, this time YoubetCash provide deposit services by using pulses XL and Telkomsel https://t.co/Icam9FA6N6 #youbetcash https://t.co/ZWqt8AikbL"
178,2020-12-17 12:11:40 SE Asia Standard Time,168590064,infopku,Telkomsel juga memastikan ketersediaan produk dan layanan berkolaborasi dengan 60.000 mitra strategis.  https://t.co/fIYVn1d64r,"Telkomsel also ensure the availability of products and services 60,000 collaborate with strategic partners. https://t.co/fIYVn1d64r"
179,2020-12-17 10:23:54 SE Asia Standard Time,228258860,nvamustofa,Halo @Telkomsel perihal permintaan layanan yang selalu muncul tiba2 disetiap waktu ini sangat mengganggunya saya. Tolong ditindaklanjuti 🙏🏻 Ini udah lebih dari 3 hari lho  https://t.co/0gpWPbRGSA,"Hello @Telkomsel regarding service requests tiba2 always appear every time it bothered me. Please actionable 🙏🏻 It is already more than 3 days, you know https://t.co/0gpWPbRGSA"
180,2020-12-17 00:37:36 SE Asia Standard Time,1213431359735128064,sobipwr10010623,@Elzzzishere @Telkomsel Sama iihh aku pake by.U yg mana dia juga pake sinyal telkom juga tiba” tiada layanan :((,"Same @Telkomsel @Elzzzishere iihh I use by.U according to which he also use telecom signals also arrive ""no service: (("
181,2020-12-17 00:31:41 SE Asia Standard Time,391190401,mueez_mmc,Gue mau beli pake Telkomsel kok ilang ya layanan nya? What happen?,I want to buy anyway ilang ya Telkomsel use his services? What happen?
182,2020-12-17 00:28:24 SE Asia Standard Time,926258093951995905,fixnohoax,"@Telkomsel Gini geng, ini tiba2 indihome + layanan telkomsel ilang tiba2. Ada apa ya geng? Posisi satelit berubah?","Gini @Telkomsel gang, this tiba2 telkomsel indihome + services ilang tiba2. There is what ya gang? Satellite positions change?"
183,2020-12-17 00:22:30 SE Asia Standard Time,1140478291041648640,bibobbibib,Telkomsel tiada layanan ada yg sama?,Telkomsel is not there the same service?
184,2020-12-16 23:43:12 SE Asia Standard Time,2794141723,illuminajong,"@Telkomsel Kayanya stlh berbulan2 merasakan layanan buruk Telkomsel dgn sinyal yg seumur hidup saya pake gak pernah sampai 5 bar. Sisa 10GB ini akan saya sudahi dgn mengganti Telkomsel dgn kartu XL. Selamat Tinggal Telkomsel sang Makelar Internet, bisa jualan kuota tapi gak bisa melayani..  https://t.co/r46I8P1HCk","Rich @Telkomsel timeout Telkomsel berbulan2 feel bad service with lifetime signals that I use not ever to 5 bar. The rest of the 10GB will I sudahi with Telkomsel to replace the card with XL. Goodbye Telkomsel the Realtor Internet, can sales quota but can not serve .. https://t.co/r46I8P1HCk"
185,2020-12-16 22:43:09 SE Asia Standard Time,31321363,donchaaaa,@Telkomsel anjing !!! Baru nyoba main dota setelah lama ga main eh internet HALO bapuk Harus airplane terus matiin airplane baru bagus Tiap 2 menit begini terus Anjing emang layanan HALO,@Telkomsel dog !!! New long tried to play dota after playing ga eh bapuk HALO internet continues to turn the airplane Had a great new airplane Every 2 minutes so continue Dogs weve HALO service
186,2020-12-16 22:33:01 SE Asia Standard Time,1075673058931806208,indihome,"@prahastiaj @Telkomsel Hallo Sobat, terkait hal tersebut mohon maaf. Berkenan informasikan atas nama, nomor HP aktif, dan 12 digit nomor layanan internetnya melalui DM untuk Uray cek lebih lanjutnya. -Uray","@prahastiaj @Telkomsel Hello Friend, related to it are sorry. Is pleased to inform the name, mobile phone number is active, and the 12-digit number of internet services via DM to be more added Uray checks. -Uray"
187,2020-12-16 22:32:38 SE Asia Standard Time,129459587,bonar_tarihoran,"@Telkomsel min, layanan yg 2323 komunitas saya kok GK bsa lagi?","@Telkomsel min, my community service in 2323 that GK kok bsa again?"
188,2020-12-16 21:28:49 SE Asia Standard Time,61419567,desymory,"Padahal saya sebagai pelanggan selalu membayarkan kewajiban terlebih dahulu. Dengan sistem prabayar, pulsa semuanya harus dipotong terlebih dahulu baru bisa mendapatkan layanan, bukan kebalikannya. Telkomsel terima hak terlebih dahulu tapi tidak menjalankan kewajibannya.","And I as a customer always pays the obligation in advance. With prepaid systems, pulse everything should be cut first and be able to get the service and not the opposite. Telkomsel received the right to advance but do not perform their duties."
189,2020-12-16 20:38:15 SE Asia Standard Time,52003112,duddyrs,Semangat untuk Semua: Telkomsel Menjamin Layanan Akhir Tahun  https://t.co/pdCeiGpmqr,Excitement for All: Ensuring Telkomsel Year-End Service https://t.co/pdCeiGpmqr
190,2020-12-16 20:36:18 SE Asia Standard Time,61419567,desymory,"Pertama kalinya dalam seumur hidup mengalami pelayanan yang sangat buruk dari  @Telkomsel. Anda memang salah satu provider layanan telepon dan internet terbesar di Indonesia, tetapi ternyata sungguh bobrok untuk pelayanannya. Mengecewakan.","First time in a lifetime experience very bad service from @Telkomsel. You are indeed one of the telephone and internet service provider in Indonesia, but it turned out really dilapidated for ministry. Disappointing."
191,2020-12-16 19:02:02 SE Asia Standard Time,91785775,widiantoro_d,@Telkomsel Sebenarnya nomor saya itu simpati tapi menggunakan layanan halo. Kemudian saya ingin kembali ke layanan simpati tapi tidak bisa sehingga saya memilih tidak bayar tagihan agar diblokir.,"@Telkomsel Actually my number was sympathy but to use the services halo, Then I want to go back to the service sympathy but could not so I chose not to pay the bill to be blocked."
192,2020-12-16 16:00:34 SE Asia Standard Time,79957943,the_marketeers,"Pada NARU tahun ini, Telkomsel memprediksi trafik layanan data akan mengalami peningkatan sebesar 10,19% dibandingkan dengan hari biasa tahun ini.   https://t.co/1wGxMQp6a3","In Naru this year, Telkomsel predict traffic data service will increase by 10.19% compared with normal days this year. https://t.co/1wGxMQp6a3"
193,2020-12-16 11:03:30 SE Asia Standard Time,2989556305,posmetro_padang,"Momen Natal dan Tahun Baru 2021, Telkomsel Prediksi Layanan Data Naik 10,19 Persen  https://t.co/Z0tP44OpqR","The moment of Christmas and New Year 2021, Telkomsel Prediction Data Service Up 10.19 Percent https://t.co/Z0tP44OpqR"
194,2020-12-16 10:14:00 SE Asia Standard Time,1268445968036290560,harianbatampos,"Maksimalkan Kualitas Layanan, Telkomsel Uji Jaringan Jelang Natal &amp; Tahun Baru, Baca Selengkapnya...   https://t.co/TCVvzvJ9EC via @harianbatampos","Maximize Quality of Service, Network Test Ahead Telkomsel Christmas & amp; New Year Read more ... https://t.co/TCVvzvJ9EC via @harianbatampos"
195,2020-12-16 08:48:08 SE Asia Standard Time,1075673058931806208,indihome,@Anggoro_Irvan_S Pagi Kak Anggoro. Nami informasikan untuk Disney+ Hotstar belum bekerja sama dengan layanan kami. Namun untuk berlangganannya bisa dengan provider Telkomsel. Terima kasih -Nami,"Morning @Anggoro_Irvan_S Kak Anggoro. Nami informed to Disney + Hotstar not cooperate with our services. However, for the subscription to the provider Telkomsel. Thanks -Nami"
196,2020-12-16 08:24:36 SE Asia Standard Time,1075673058931806208,indihome,"@awlituy Hai, Kak Lita. Maaf ya, tapi biar bisa dicek lebih lanjut koneksi jaringan IndiHome-nya, coba deh informasikan dulu nomor layanan internet/telepon-nya di DM. Kalau buat laporan providernya akan dibantu oleh rekan kami di akun @Telkomsel ya. -Meika","@awlituy Hi, Sister Lita. Excuse me, but let me be checked more IndiHome its network connection, try deh first inform the internet service number / phone her at DM. If for providernya report will be assisted by our colleagues in the account @Telkomsel yes. -Meika"
197,2020-12-15 23:40:54 SE Asia Standard Time,1335799639736340480,rhmdta_,@s0erga Selamat datang di layanan kartu telkomsel,@ S0erga Welcome telkomsel card services
198,2020-12-15 22:38:07 SE Asia Standard Time,202614326,ady_baryadi,"@Telkomsel Hai, Kak Barzagli. Maaf ya, silakan infokan lebih detail pertanyaan atau keluhan seputar produk dan layanan Telkomsel, agar dapat mimin bantu lebih lanjut. Makasih :)   djancok","@Telkomsel Hi, Kak Barzagli. Excuse me, please infokan more detailed questions or complaints about products and services Telkomsel, in order to help further mimin. Thanks :) djancok"
199,2020-12-15 19:40:32 SE Asia Standard Time,118646322,bisniscom,"Pita Frekuensi Bertambah, Layanan Telkomsel Diyakini Makin Perkasa  https://t.co/YeXJg2R3NE","Increased Frequency Band, Makin believed Telkomsel Service Perkasa https://t.co/YeXJg2R3NE"
200,2020-12-15 17:48:29 SE Asia Standard Time,177118964,muotan,"Gimana ga ngamuk gue udah 1 pekan jaringan internet telkomsel lemot nauzubillah  Mana gue punya 2 hp yang dua2nya telkomsel. Temen2 gue yg pake telkomsel juga ngeluhin hal yang sama. Udahlah mahal, tapi layanan tetep aja mediocare.  https://t.co/Y0IG6YC4ga","Ga how furious I've 1 week telkomsel slow internet network nauzubillah Where I have 2 hp dua2nya Telkomsel. I temen2 who use Telkomsel also ngeluhin the same thing. Udahlah expensive, but the service tetep wrote mediocare. https://t.co/Y0IG6YC4ga"
201,2020-12-15 17:26:21 SE Asia Standard Time,1675707294,uzoneindonesia,"1. By.U Telkomsel  By.U jadi layanan sim digital pertama di Indonesia, rilis Oktober 2019.  Tapi otomatis semakin banyak dikenal di tahun 2020. By.U juga bisa dibilang jadi yang menginspirasi operator lain merilis layanan serupa di sepanjang tahun 2020.  https://t.co/oBNWy1yUud","1. By.U Telkomsel By.U so service digital sim first in Indonesia, released in October 2019. But the more known automated in 2020. By.U also arguably be an inspiring other operators released similar services throughout 2020. https : //t.co/oBNWy1yUud"
202,2020-12-15 16:21:25 SE Asia Standard Time,1075673058931806208,indihome,"@EndyaAtrisa @Telkomsel Hai Kak Atrisa, bisa informasikan detail yang ingin ditanyakan seputar layanan IndiHome-nya? Terima kasih -Ruth","@EndyaAtrisa @Telkomsel Hi Kak Atrisa, can inform the detail you want to ask about his IndiHome services? Thanks -Ruth"
203,2020-12-15 15:16:00 SE Asia Standard Time,2714869507,newsmerahputih,Telkomsel prediksi trafik layanan data saat perayaan Natal dan tahun baru 2021 mengalami peningkatan.  #merahputihcom #telkomsel #nataru #meningkat  https://t.co/KR3ni9hZHl,Telkomsel predictive traffic data service during the celebration of Christmas and New Year 2021 has increased. #merahputihcom #telkomsel #nataru #meningkat https://t.co/KR3ni9hZHl
204,2020-12-15 13:56:18 SE Asia Standard Time,1222344615677714433,myorbitid,"@RidwanMN1 @Telkomsel Hai, terima kasih atas antusiasme Anda terhadap layanan kami. Saat ini modem Orbit Max sedang dalam proses produksi dan pengiriman. Untuk mendapatkan info terbaru tentang ketersediaan modem Orbit Max, silakan klik tombol Notify Me pada website kami di  https://t.co/QL9Shko6h2.","@ RidwanMN1 @Telkomsel Hi, thank you for your enthusiasm for our services. Max Orbit modem is currently in the process of production and delivery. To get the latest info on the availability of modems Orbit Max, please click Notify Me button on our website at https://t.co/QL9Shko6h2."
205,2020-12-15 12:18:29 SE Asia Standard Time,1096698228,hannakartika,"Klo anda lg mempertimbanhkan menggunakan / baru akan membeli layanan @Telkomsel gue saranin JANGAN, BERAT, MEREKA TIDAK TAU CARA MENGHARGAI CUSTOMER LOYAL ! ANDA HANYA AKAN TERIMA MAHAL, KESEL, DAN KECEWA SETELAH BERTAHUN2 MEMAKAI TELKOMSEL.","Mempertimbanhkan lg klo you use / will buy the service @Telkomsel saranin I DO NOT, HEAVY, HOW THEY DO NOT TAU LOYAL CUSTOMER RESPECT! THANK YOU ONLY BE EXPENSIVE, upset, AND DISAPPOINTED AFTER USE bertahun2 TELKOMSEL."
206,2020-12-15 12:16:54 SE Asia Standard Time,1274364897778778117,crobeluz1,@Telkomsel Hello Saya tidak bisa me non aktifkan layanan roaming Bisa dibantu?,@Telkomsel me Hello I can not disable the roaming service can be helped?
207,2020-12-15 11:15:00 SE Asia Standard Time,1268445968036290560,harianbatampos,"Telkomsel Perkuat Network, Produk, dan Layanan  https://t.co/guHWoPXVJH via @Batam Pos   #telkomsel","Telkomsel Strengthen Network, Products and Services https://t.co/guHWoPXVJH via @Batam Post #telkomsel"
208,2020-12-15 10:44:12 SE Asia Standard Time,18129942,tempodotco,"Telkomsel memprediksi trafik layanan data saat perayaan Natal dan Tahun Baru 2021 mengalami peningkatan sebesar 10,19 persen dibandingkan dengan hari. #TempoBisnis  https://t.co/4Xe2hJI9na",Telkomsel predict traffic data service during the celebration of Christmas and New Year in 2021 increased by 10.19 percent compared to today. #TempoBisnis https://t.co/4Xe2hJI9na
209,2020-12-15 10:07:32 SE Asia Standard Time,811897280563290112,koranbumn,Telkomsel Tambah 17 Titik Strategis Perkuat Layanan saat Nataru  https://t.co/t8xa8xnuHu @Telkomsel @TelkomIndonesia @KemenBUMN @kemkominfo,Telkomsel Added 17 Strengthen Strategic Point of Service when Nataru https://t.co/t8xa8xnuHu @Telkomsel @TelkomIndonesia @KemenBUMN @kemkominfo
210,2020-12-15 09:56:49 SE Asia Standard Time,207854679,borneonews,"Natal-Tahun Baru, Layanan Data Telkomsel Diprediksi Naik 49,3 Persen   https://t.co/Ho6BjBKoYE","Christmas-New Year, Service Data Predicted to Rise 49.3 Percent Telkomsel https://t.co/Ho6BjBKoYE"
211,2020-12-15 09:32:31 SE Asia Standard Time,3250224038,idnnews_id,Telkomsel Optimalisasi Saluran Digital untuk Jaminan Ketersediaan Produk dan Layanan  https://t.co/I0HCX6Mpab,Telkomsel Optimizing Digital Channels for Security Products and Services Availability https://t.co/I0HCX6Mpab
212,2020-12-15 07:33:02 SE Asia Standard Time,91941244,antaranews_bali,"Natal 2020-Tahun Baru 2021, layanan data Telkomsel diprediksi naik 49,3 persen: Operator telekomunikasi Telkomsel memprediksi trafik layanan data saat perayaan Natal dan Tahun Baru 2021 mengalami peningkatan sebesar 10,19 persen dibandingkan dengan hari…  https://t.co/9SCqsSL6fz  https://t.co/vlAXboJuD1","Christmas 2020 New Year 2021, Telkomsel data services predicted to rise 49.3 percent: The telecom operator Telkomsel to predict traffic data service during the celebration of Christmas and New Year in 2021 increased by 10.19 percent compared to today ... https://t.co/ 9SCqsSL6fz https://t.co/vlAXboJuD1"
213,2020-12-15 07:30:17 SE Asia Standard Time,57223495,selularid,Program dan Layanan Digital Telkomsel Temani Pelanggan di Momen Akhir Tahun  #Telkomsel  https://t.co/KRANAYu4B9 lewat @selularid,Programs and Services Digital Telkomsel Accompany Customers End of Year #Telkomsel https://t.co/KRANAYu4B9 moment through @selularid
214,2020-12-15 07:09:56 SE Asia Standard Time,205287653,elshintadotcom,"Natal-Tahun Baru, layanan data Telkomsel diprediksi naik 49,3 persen -  https://t.co/zw2FBz2gqK  https://t.co/15EgbZrZcy","Christmas-New Year, Telkomsel data services predicted to rise 49.3 percent - https://t.co/zw2FBz2gqK https://t.co/15EgbZrZcy"
215,2020-12-15 03:43:02 SE Asia Standard Time,18129942,tempodotco,"Telkomsel memprediksi trafik layanan data saat perayaan Natal dan Tahun Baru 2021 mengalami peningkatan sebesar 10,19 persen dibandingkan dengan hari  https://t.co/WS0q8mKIMg #TempoBisnis",Telkomsel predict traffic data service during the celebration of Christmas and New Year in 2021 increased by 10.19 percent compared to the https://t.co/WS0q8mKIMg #TempoBisnis
216,2020-12-15 03:22:11 SE Asia Standard Time,68930552,mediaindonesia,"Operator telekomunikasi Telkomsel memprediksi trafik layanan data saat perayaan Natal dan Tahun Baru 2021 dibandingkan 2020  akan terjadi lonjakan sebesar 49,3 persen.   https://t.co/PxvwXkmzIw",The telecom operator Telkomsel to predict traffic data service during the celebration of Christmas and New Year in 2021 compared to 2020 will be a surge of 49.3 percent. https://t.co/PxvwXkmzIw
217,2020-12-15 02:50:01 SE Asia Standard Time,1186946650595418116,voidotid,"Telkomsel, Tri Indonesia dan Smartfren terus berkompetisi untuk mendapatkan frekuensi 2,3 GHz bagi layanan 5G di Indonesia  https://t.co/1uGDVIx13F","Telkomsel, Indonesia and Smartfren Tri continued to compete for the 2.3 GHz frequency for 5G service in Indonesia https://t.co/1uGDVIx13F"
218,2020-12-15 02:45:42 SE Asia Standard Time,262026799,msnindonesia,Telkomsel Prediksi Layanan Digital Meningkat 49 Persen di Akhir Tahun  https://t.co/lx0LxgWx4I,Prediction Telkomsel Digital Services Rises 49 Percent on Year-End https://t.co/lx0LxgWx4I
219,2020-12-15 01:24:57 SE Asia Standard Time,1075673058931806208,indihome,"@QadhayifAlriys @Telkomsel Halo Kak Qadhay, maaf atas ketidaknyamanannya, terkait kendalanya silahkan Kakak informasikan terlebih dahulu nomor layanan internet serta nomor ponsel aktif melalui DM kami agar kerahasiaan data Kakak dapat terjaga, ditunggu konfirmasi selanjutnya ya Kak(1/2)","@QadhayifAlriys @Telkomsel Hello Kak Qadhay, sorry for the inconvenience, related obstacles brother please inform in advance the number of internet service as well as the active phone number via DM us that Sister data confidentiality can be maintained, waiting for further confirmation Kak ya (1/2)"
220,2020-12-14 23:24:33 SE Asia Standard Time,4315097832,pelitabantencom,"✅  TANGERANG,  https://t.co/WyGTDLIwxe – Telkomsel memprediksi trafik layanan data akan mengalami peningkatan sebesar 10,19 persen dibandingkan dengan hari biasa 2020 pada Natal 2020 dan…  https://t.co/Jtvly9vYNR #Lifestyle #Tekno #Jaringanbroadband #Telkomsel Selengkapnya ⬇⬇⬇  https://t.co/5pdISjccbG","✅ TANGERANG, https://t.co/WyGTDLIwxe - Telkomsel predict traffic data services will be increased by 10.19 percent as compared to a normal day in 2020 on Christmas 2020 and ... https://t.co/Jtvly9vYNR #Lifestyle #Tekno # Jaringanbroadband #Telkomsel More ⬇⬇⬇ https://t.co/5pdISjccbG"
221,2020-12-14 23:22:24 SE Asia Standard Time,832546242,rizal_roesli,Dear @Telkomsel tolong perbaiki layanan kalian karna aktivasi paket combo Sakti 32GB sy sukses dan saldo terpotong namun paket tidak aktif. Ditunggu secepatnya. Terima kasih.  https://t.co/UhT5cionEi,Dear @Telkomsel correct it because you service activation combo pack 32GB Way sy success and balance truncated but packages are not active. Awaited soon. Thank you. https://t.co/UhT5cionEi
222,2020-12-14 22:45:01 SE Asia Standard Time,135815019,detikinet,"Disampaikan Direktur Utama Telkomsel Setyanto Hantoro, Telkomsel berupaya untuk menghadirkan produk dan layanan yang dibutuhkan masyarakat  https://t.co/gojoxnK6OH","President Director of Telkomsel Setyanto Hantoro, Telkomsel strives to deliver products and services that people need https://t.co/gojoxnK6OH"
223,2020-12-14 22:13:29 SE Asia Standard Time,240339151,mikaelism,"@lutfiburhananda @sulthonilmiawan @Telkomsel Peningkatan layanan kok bikin layanan yang ada jadi ngadat, logika yang aneh.","@lutfiburhananda @sulthonilmiawan @Telkomsel kok Service upgrades make the existing services so crashed, strange logic."
224,2020-12-14 22:11:57 SE Asia Standard Time,240339151,mikaelism,"@sulthonilmiawan @Telkomsel Sama bos, komplain berkali-kali, tapi respon @telkomsel gitu gitu doang. Makin parah layanan telkomsel sekarang.","@sulthonilmiawan @Telkomsel Same boss, complained many times, but the response so so doang @telkomsel. Telkomsel service is getting worse now."
225,2020-12-14 22:06:45 SE Asia Standard Time,1236356576417468416,semarakredaksi,"Sambut Momen Natal dan Tahun Baru, Telkomsel Optimalisasi Kesiapan Jaringan dengan Beragam Layanan Digital  https://t.co/uydP2MkL11","Moment Welcomes Christmas and New Year, Telkomsel Network Readiness Optimization with Multi-Service Digital https://t.co/uydP2MkL11"
226,2020-12-14 22:03:52 SE Asia Standard Time,842693038216372224,harian_momentum,"Sambut Nataru, Telkomsel Pastikan Kualitas Layanan | Harian Momentum  https://t.co/MhdsV8HWVv","Welcomes Nataru, Telkomsel Ensure Quality of Service | Daily Momentum https://t.co/MhdsV8HWVv"
227,2020-12-14 21:43:00 SE Asia Standard Time,4885698139,dien2x,"@Telkomsel Yg ambyar itu layanan kalian. 3 hari masih gagal juga beli ekstra kuota harian, solusinya hanya menunggu dan jelas menunggu itu bukan solusi.","@Telkomsel ambyar clincher was the service guys. 3 days still fail also purchase extra daily quota, the solution is just to wait and obviously the wait was not a solution."
228,2020-12-14 21:37:01 SE Asia Standard Time,2794141723,illuminajong,"@Telkomsel Yg Ambyar itu ya layanan internetmu. Seumur saya pake Telkomsel buat Internet blm pernah tercapai 5 bar. Paling maksimal Telkomsel cuma mampu 3 bar, itupun gak stabil dan masih bisa turun. Jadi sebenarnya Telkomsel itu Operator Selular atau Makelar Internet?  https://t.co/JiKxTzcdCc","@Telkomsel clincher ya Ambyar your internet service. I use Telkomsel lifetime pp create Internet never reached 5 bar. Telkomsel is only capable of maximum 3 bars, and even then not stable and could still go down. So it's actually Telkomsel Mobile Operator or Broker Internet? https://t.co/JiKxTzcdCc"
229,2020-12-14 21:06:18 SE Asia Standard Time,9679102,mrbambang,"Natal dan Tahun Baru 2021, Telkomsel Prediksi Layanan Data Tumbuh 49,3%  https://t.co/mb6f4xXDit","Christmas and New Year 2021, Telkomsel Prediction Data Services Grow 49.3% https://t.co/mb6f4xXDit"
230,2020-12-14 20:59:16 SE Asia Standard Time,842693038216372224,harian_momentum,"Sambut Nataru, Telkomsel Pastikan Kualitas Layanan | Harian Momentum  https://t.co/dtmuUfAmLw","Welcomes Nataru, Telkomsel Ensure Quality of Service | Daily Momentum https://t.co/dtmuUfAmLw"
231,2020-12-14 20:42:55 SE Asia Standard Time,3570716532,gizmologi,"Telkomsel Prediksi Layanan Data Tumbuh 49,3%  https://t.co/z1FcLB7ayk",Telkomsel Prediction Data Services Grow 49.3% https://t.co/z1FcLB7ayk
232,2020-12-14 20:40:48 SE Asia Standard Time,1282720635144167424,banteninsight,"Telkomsel Prediksi Trafik Layanan Data Naik 10,19 Persen  https://t.co/DtvVfO6aEC",Prediction Telkomsel Traffic Data Service Up 10.19 Percent https://t.co/DtvVfO6aEC
233,2020-12-14 20:20:42 SE Asia Standard Time,256650697,dedysuwadha,Telkomsel Optimalisasi Jaringan dengan Beragam Program dan Layanan untuk Pelanggan di Momen Akhir Tahun 2020  https://t.co/f347SJYs5d lewat @WartaKepri,Telkomsel Network Optimization with Various Programs and Services to Customers in Final Moment 2020 https://t.co/f347SJYs5d through @WartaKepri
