,created_at,user_id,username,tweet,english
234,2020-12-14 19:10:29 SE Asia Standard Time,586466604,wulanfbr,"@aditya_prapra @Telkomsel Hai, kak Aditya. Mohon maaf, terkait kendala akses internet lambat, mimin infokan saat ini sedang ada peningkatan sistem layanan kami. Diupayakan dapat selesai secepatnya ya. Makasih untuk tetap menjadi pelanggan setia Telkomsel :) -Okta","@aditya_prapra @Telkomsel Hi, sis Aditya. Sorry, related constraints slow internet access, mimin infokan nowadays there is an increase in our service system. Attempts can be completed as soon as possible yes. Thanks to remain a loyal customer :) Telkomsel -Okta"
235,2020-12-14 19:09:09 SE Asia Standard Time,240339151,mikaelism,"Balasannya itu itu mulu, bosen gua, gak ada solusi yang lebih baik lagi apa?  mana sekarang mytelkomsel di iOs gak bisa login lagi, makin kacau layanan @telkomsel sekarang","In return it was mulu, bored cave, there is not a better solution again what? Where now mytelkomsel in IOS can not log in again, the more chaotic @telkomsel now"
236,2020-12-14 18:11:54 SE Asia Standard Time,3250224038,idnnews_id,"Jelang NARU 2021, Telkomsel Optimalisasi Ketersediaan Produk dan Layanan  https://t.co/2AjnO9UyHD","Coming Naru 2021, Telkomsel Optimizing Availability of Products and Services https://t.co/2AjnO9UyHD"
237,2020-12-14 17:39:32 SE Asia Standard Time,46693036,inilahdotcom,Layanan VoLTE Telkomsel Sudah Sambangi 48 Kota  https://t.co/rfv0LawXed,VoLTE Service Telkomsel It Sambangi 48 City https://t.co/rfv0LawXed
238,2020-12-14 17:38:00 SE Asia Standard Time,847372542830444544,cnbcindonesia,Strategi Baru Telkomsel Siapkan Layanan 5G di Indonesia  https://t.co/2w3nQc1Fpe,Prepares New Strategy Telkomsel in Indonesia 5G Service https://t.co/2w3nQc1Fpe
239,2020-12-14 17:17:41 SE Asia Standard Time,3250224038,idnnews_id,"Diprediksi Layanan Data Naik hingga 10,19 Persen, Telkomsel Fokus Peningkatan Kualitas Jaringan di Ratusan POI - medianesia  https://t.co/92ajIMTIou","Predicted Data Services Up to 10.19 Percent, Telkomsel Focus on Quality Improvement Network Hundreds of POI - medianesia https://t.co/92ajIMTIou"
240,2020-12-14 16:59:24 SE Asia Standard Time,4676959050,youngsterid_,Telkomsel Perkuat Kualitas Layanan Sambut Libur Akhir Tahun 2020  https://t.co/MDILyXtZwO,Telkomsel Strengthens End Quality of Service Welcome Break 2020 https://t.co/MDILyXtZwO
241,2020-12-14 16:47:22 SE Asia Standard Time,2857878662,toniharfa,"@10gku_ Banyak pengguna Telkomsel yg ngerasa penurunan kualitas layanan, karena jaringan ga stabil terus kecepatan internet nya juga lemah","@ 10gku_ Many Telkomsel users who feel a decrease in quality of service, because the network is not stable continues its internet speed too weak"
242,2020-12-14 16:30:20 SE Asia Standard Time,154102750,beritasatu,"Natal dan Tahun Baru, Trafik Layanan Data Telkomsel Diprediksi Naik 49,3%  https://t.co/J3xRzI1aBf  https://t.co/3bL7Z6WPGw","Christmas and New Year, Traffic Data Service Telkomsel Predicted to Rise 49.3% https://t.co/J3xRzI1aBf https://t.co/3bL7Z6WPGw"
243,2020-12-14 15:32:53 SE Asia Standard Time,1313144567277867008,craspediarose,@thaiifess Nanon Korapat ada yang bisa dibantu seputar produk dan layanan Telkomsel silakan mention it again and again and again and tata cara shalat subuh berjamaah di tempat lembab jugak ke tu bukan maknanya,Nanon @thaiifess Korapat there that can help Telkomsel about products and services please mention it again and again and again and procedure for the dawn prayer in congregation in a humid place jugak to tu no meaning
244,2020-12-14 15:25:48 SE Asia Standard Time,3250224038,idnnews_id,"Diprediksi Layanan Data Naik hingga 10,19 Persen, Telkomsel Fokus Peningkatan Kualitas Jaringan di Ratusan POI  https://t.co/92ajINbjN4","Predicted Data Services Up to 10.19 Percent, Telkomsel Focus on Quality Improvement Network Hundreds of POI https://t.co/92ajINbjN4"
245,2020-12-14 15:10:32 SE Asia Standard Time,118646322,bisniscom,"Telkomsel Perkuat Layanan saat Nataru, Tambah 17 Titik Strategis  https://t.co/u87CgCCy1d","Telkomsel Strengthens Service at Nataru, Add 17 points Strategic https://t.co/u87CgCCy1d"
246,2020-12-14 12:37:21 SE Asia Standard Time,64924675,smartfrenworld,"@Awink_Jeka01 @Telkomsel @sayang_banged  Tenang kak, mimin siap bantu cek biar kakak bisa isi kuota terus dan ngerasaian layanan internet cepat dari Smartfren :) Yuk infokan via DM, nomor Smartfren dan titik koordinat lokasi kakak saat ini? . Terima kasih - Unova","@ Awink_Jeka01 @Telkomsel @sayang_banged Quiet kak, mimin ready to help check the contents of the quota so that big brother could go on and ngerasaian fast Internet service from Smartfren :) Yuk infokan via DM, Smartfren number and location coordinates point sister today? , Thanks - Unova"
247,2020-12-14 12:23:56 SE Asia Standard Time,1141028258269421568,mashi_yun,@ateezmfs hongjoong itu yang terbaik untuk kita semua sudah tidak ada yang bisa dibantu seputar produk dan layanan Telkomsel silakan tunggu konfirmasi selanjutnya via DM agar dibantu   Ketika operator telkmsl naksir kim hongjoong,@ateezmfs hongjoong it is best for all of us is not there that can help Telkomsel about products and services please wait for further confirmation via DM to be assisted When the operator has a crush on Kim hongjoong telkmsl
248,2020-12-14 11:24:56 SE Asia Standard Time,1072806770572054529,sushitrashhh___,"@Telkomsel Percuma, paling tar bales nya ""Sedang ada peningkatan layanan""","@Telkomsel useless, most of his bales tar ""While there is an increase in service"""
249,2020-12-14 10:48:23 SE Asia Standard Time,4885698139,dien2x,@MediaKonsumenID daftar ekstra kuota @Telkomsel selalu gagal. Solusi hanya menunggu. Dan menunggu itu bukan solusi. Jd niat pindah provider. Paket mahal tp layanan after salesnya gak sepadan.,@MediaKonsumenID extra quota list @Telkomsel always fail. The solution just waiting. And the wait was not a solution. Jd intent to move provider. Tp expensive package service after salesnya not worth it.
250,2020-12-13 21:58:41 SE Asia Standard Time,623573162,mendokusai_594,"@Telkomsel lagi enak2 main jaringan tiba2 jelek padahal sinyal 4G. Sering bgt sinyal bengong pas main game. Kena banned gara2 sinyal kek gebetan, ilang2an. Paket mahal tapi kok layanan gini amat.  https://t.co/8esuHLlCYq","@Telkomsel again enak2 play ugly tiba2 network when the 4G signal. Often filmed signal pas bgt play the game. Got banned gara2 kek signal gebetan, ilang2an. Package expensive but very gini kok services. https://t.co/8esuHLlCYq"
251,2020-12-13 21:34:48 SE Asia Standard Time,525718055,ridwanrezha,@Telkomsel Ngga usah deh terima jadi aja udh biasa di Indonesia layanan ga sebanding yg dikeluarkan thx u,Guns @Telkomsel need deh received so unusual in Indonesia aja udh ga service comparable to that issued thx u
252,2020-12-13 20:32:08 SE Asia Standard Time,522971599,maspaeng,"@marialifah Hai, Kak Maria. Maaf ya. Jika memiliki pertanyaan, permintaan atau keluhannya terhadap produk dan layanan Telkomsel, silakan infokan detailnya secara jelas agar memudahkan mimin dalam membantu dengan solusi yang tepat ya. Makasih :) -Calvin","@marialifah Hi, Sister Maria. Forgive me. If you have any questions, requests or complaints against Telkomsel's products and services, please infokan clearly the details to make it easier mimin in assisting with the right solutions yes. Thanks :) -Calvin"
253,2020-12-13 19:19:53 SE Asia Standard Time,240339151,mikaelism,"Buka aplikasi yang notabene punya @telkomsel seperti #maxstream aja leletnya minta ampun, kalian maunya apa sih sebenarnya? Niat gak sih ngasih layanan.","Open the application that in fact has @telkomsel like #maxstream wrote leletnya ask for forgiveness, you wants what is it? Intention does not give the service."
254,2020-12-13 16:39:06 SE Asia Standard Time,1075673058931806208,indihome,"@IrmaMustafidah @Telkomsel Halo Kak Irma, jika jaringannya berkendala silakan informasikan nomor layanan, atas nama dan nomor HP aktifnya melalui DM guna pengecekan selanjutnya dan menghindari penyalahgunaan data oleh oknum tidak bertanggung jawab. Terima kasih -Agra","@IrmaMustafidah @Telkomsel Hello Sister Irma, if the network berkendala please inform service number, the name and mobile number of active via DM to further checks and to avoid misuse of the data by irresponsible elements. Thanks -Agra"
255,2020-12-13 15:47:40 SE Asia Standard Time,623503485,beny_vicky,@Telkomsel mohon info apakah layanan my telkomsel trouble saya melakukan pengisian pulsa kok masa aktif nya kok gak bertambah dr bulan lalu ya? Terus saya mau melakukan pembelian paket data eror terus ya?,@Telkomsel request information whether my services telkomsel trouble I did really recharging its active period why not grow dr month ago huh? I continue to make purchases error data packets continue huh?
256,2020-12-13 07:34:00 SE Asia Standard Time,1213670352380809216,jessica47644448,"Saldo Bank Lagi Kosong?  Deposit Via Pulsa Saja Di Mejaoke,net  Tersedia Layanan Deposit Via Pulsa Telkomsel   Contct info :  Line : Mejaqq_official  Whatsapp : +855882308459   #AgenBandarQOnline #BandarQOnline #AgenBandarQ #Mejaoke #MEJAQQ  https://t.co/KIbLTvaRO1","Again Blank Bank Balance? Deposit Via Toll Only In Mejaoke, net Available Via Toll Telkomsel Deposit Service contct info: Line: Mejaqq_official Whatsapp: +855882308459 #AgenBandarQOnline #BandarQOnline #AgenBandarQ #Mejaoke #MEJAQQ https://t.co/KIbLTvaRO1"
257,2020-12-13 07:33:52 SE Asia Standard Time,1213751689141837824,carollinegeby,"Saldo Bank Lagi Kosong?  Deposit Via Pulsa Saja Di Mejaoke,net  Tersedia Layanan Deposit Via Pulsa Telkomsel   Contct info :  Line : Mejaqq_official  Whatsapp : +855882308459   #AgenBandarQOnline #BandarQOnline #AgenBandarQ #Mejaoke #MEJAQQ  https://t.co/Gy734EWhuq","Again Blank Bank Balance? Deposit Via Toll Only In Mejaoke, net Available Via Toll Telkomsel Deposit Service contct info: Line: Mejaqq_official Whatsapp: +855882308459 #AgenBandarQOnline #BandarQOnline #AgenBandarQ #Mejaoke #MEJAQQ https://t.co/Gy734EWhuq"
258,2020-12-13 06:22:50 SE Asia Standard Time,1075673058931806208,indihome,"@ReadyIman @Telkomsel keluarga Kakak. SMOOA menyediakan koneksi terbaik untuk keluarga, baik di rumah maupun via seluler. Saat di rumah, Kakak dapat menikmati layanan telepon rumah, internet, dan hiburan dari IndiHome. Kakak juga bisa mendapatkan layanan SMS, telepon, dan int(2/3)","@ReadyIman family @Telkomsel brother. SMOOA provide the best connection to the family, both at home and via mobile. At home, brother can enjoy home phone service, internet, and entertainment from IndiHome. Sister can also get SMS, telephone, and int (2/3)"
259,2020-12-13 01:10:04 SE Asia Standard Time,1184143812135833600,syarif20502481,Layanan #Telkomsel semangkin hari semangkin memburuk,#Telkomsel Service semangkin day semangkin deteriorate
260,2020-12-13 00:51:12 SE Asia Standard Time,1207483795303104512,fubitj,"@Telkomsel malam min, mau stop layanan ini nih min, setiap 30 detik sekali muncul push notif kayak gini, sangat ganggu banget, tolong follow up nya thanks  https://t.co/Ca0VSnJs69","@Telkomsel night min, want to stop this service nih min, every 30 seconds once appeared push notif like this, it's really disturbing, please follow up its thanks https://t.co/Ca0VSnJs69"
261,2020-12-12 22:47:09 SE Asia Standard Time,3125108297,ph0spheneus,"@Telkomsel Coba dong lebih kreatif alasan nya jangan peningkatan sistem layanan terus, dipikir gua pake telkomsel baru seminggu apa? Kayanya dari gua belum lulus smp sampe sekarang alasannya itu mulu","Try dong more creative @Telkomsel his reasons do not increase service system continues, think of cave use new telkomsel week what? Richness of the cave has not yet passed smp until now the reason it mulu"
262,2020-12-12 21:09:45 SE Asia Standard Time,1263692797082652672,escekekfav,"@Telkomsel always jawabnnya ada peningkatan sistem layanan, halah bikin emosi aja.","@Telkomsel always jawabnnya no increase in system service, make gak aja emotion."
263,2020-12-12 20:53:17 SE Asia Standard Time,1295518505731727363,rizzhh,@akuimen jadilah yang terbaik untuk kita semua sudah tidak ada yang bisa dibantu seputar produk dan layanan Telkomsel silakan mention kembali apabila ada yang bisa dibantu.,@akuimen be the best for all of us is not there that can help Telkomsel about products and services please mention back if anyone can help.
264,2020-12-12 18:50:24 SE Asia Standard Time,1190565136693526528,responbet,deposit telkomsel tanpa potongan dari RESPONBET.. menyediakan layanan deposit via pulsa Telkomsel.Xl dan Axis tanpa potongan. Responbet menyediakan layanan deposit via pulsa telkomsel tanpa potongan minimal deposit 10rb..   #judimesinslot #gameslotonlineterbaik #daftarslotonline  https://t.co/kjcNyuW2wk,telkomsel deposit without deduction of RESPONBET .. provide deposit services via toll Telkomsel.Xl and Axis without deductions. Responbet provide deposit services via toll telkomsel without a minimum deposit of 10K pieces .. #judimesinslot #gameslotonlineterbaik #daftarslotonline https://t.co/kjcNyuW2wk
265,2020-12-12 17:57:54 SE Asia Standard Time,174563624,smirnoffcpt,@Telkomsel Apakah tidak ada upaya pencegahan turunnya kualitas layanan yg diberikan kepada pelanggan yg diakibatkan listrik mati kak?,@Telkomsel Is there no effort to prevent the decline in the quality of service given to customers resultant blackouts kak?
266,2020-12-12 13:47:28 SE Asia Standard Time,353569976,duniamaya_29,"Nyari cara cek kartu telkomsel apa sdh teregistrasi atau belum, se google raya ngmg nya ke  https://t.co/mkAWRGPwuA tp setiap diakses, ""halaman ini tidak dpt diakses"" PAYO BEBENER OIIII LAYANAN TU, KAMPANG.","Nyari way telkomsel card check what sdh registered or not, google se his ngmg highway to https://t.co/mkAWRGPwuA tp every accessible, ""this page can not be accessed verifiable"" Payo BEBENER OIIII SERVICES TU, KAMPANG."
267,2020-12-12 12:09:02 SE Asia Standard Time,64378589,awyatno,"@Telkomsel Serem ama pandemi, kaka...ntar kalo tertular, kasihan yg dirumah....@Telkomsel, ini sih udah masuk layanan cso.... ruangannya ketutup gini, enggak Ada sirkulasi yg memadai dan banyak org antri...","Serem @Telkomsel ama pandemic, kaka ... ntar if infected, pity that at home .... @ Telkomsel, it does already entered service office ketutup cso .... Look, baseball There is adequate circulation and many who queued org ..."
268,2020-12-12 10:02:12 SE Asia Standard Time,89941176,risyadts,11 desember 2020  22.48 dapet notif sms kalo sisa pulsa dibilang gak cukup untuk beli paket kuota ketengan whatsapp  nih @Telkomsel liat nih. Pulsa Rp9000 gak bisa aktifin paket layanan seharga Rp3000  3/n  https://t.co/K84mtNLruh,11 December 2020 22:48 sms dapet notif remaining balance if arguably not enough to buy a package of quota ketengan whatsapp @Telkomsel clay ya ya. Rp9000 pulse can not aktifin service pack for Rp3000 3 / n https://t.co/K84mtNLruh
269,2020-12-12 09:59:21 SE Asia Standard Time,89941176,risyadts,11 desember 2020  22.47 cek pulsa. sisa pulsa Rp9.059 22.48 beli kuota ketengan whatsapp 22.48 permintaan diproses (tapi yang whatsapp gagal)  nih @Telkomsel liat nih. Pulsa Rp9000 gak bisa aktifin paket layanan seharga Rp3000  2/n  https://t.co/TNO6UCaSA4,11 December 2020 22:47 pulse checks. remaining balance Rp9.059 22:48 22:48 whatsapp ketengan purchasing quota request is being processed (but which whatsapp failed) clay @Telkomsel ya ya. Rp9000 pulse can not aktifin service pack for Rp3000 2 / n https://t.co/TNO6UCaSA4
270,2020-12-12 04:58:49 SE Asia Standard Time,576007382,agungsetiob,"@Telkomsel pulsa saya sering tiba2 jd 0 pdhal saya tidak merasa langganan layanan premium apapun, sering dpt sms ini, sepertinya ada layanan yg saya ga sadar berlangganan, mohon bantuan untuk stop  https://t.co/hopwIs2UW4","My pulse @Telkomsel often tiba2 jd 0 pdhal I do not feel any premium service subscription, sms is often interchangeable, there seems to be the service that I did not notice subscribe, please help to stop https://t.co/hopwIs2UW4"
271,2020-12-11 21:05:41 SE Asia Standard Time,1254322180373884930,riurizkiutomo_,"Jangan kok @JNE_ID , sekelas telkomsel saja kita lawan kalau nyata mengakomodir kepentingan orang ini.  Bukti kita #ProNKRI alihkan menggunakan layanan jasa penguriman kita ke selain @JNE_ID   #JNECoret  https://t.co/6QXuIfj1eR","Do not really @JNE_ID, classmates telkomsel real course we opposed that accommodate the interests of these people. Evidence we #ProNKRI switch penguriman use our services in addition to @JNE_ID #JNECoret https://t.co/6QXuIfj1eR"
272,2020-12-11 20:47:20 SE Asia Standard Time,3285232194,gunawan_zabdiel,@Telkomsel Min mau nanya beli signal Telkomsel dimana ya?udah ya..jgn terus2an alasan peningkatan sistem layanan terus ya?sistem yg mana ya Min yg ditingkatkan?alasan teknis apalagi Min? Tertulis : 4G Terlihat : 4G Terbaca : 4G Terima : None  https://t.co/cO9DMFMtaK,Min @Telkomsel buy signal Telkomsel want to ask where you? Ve ya..jgn terus2an reasons for increased service system continues huh? Where ya mouth Min system that can be improved? Technical reasons moreover Min? Written: 4G Visible: Legible 4G: 4G Thanks: None https://t.co/cO9DMFMtaK
273,2020-12-11 19:01:43 SE Asia Standard Time,1138754044497780736,mykittensoul,@Telkomsel Kalau mau update sistem layanan. Aku usulin spy bisa login yang via sosmed bisa lebih mudah. Tanpa konfirmasi ke no hp. Soalnya no hp nya d modem. Modem ga bisa terima sms. Thanks,@Telkomsel If you want to update the service system. I spy usulin can login via sosmed could be easier. Without confirmation to no hp. Because his phone no d modem. The modem can not receive sms. Thanks
274,2020-12-11 18:31:13 SE Asia Standard Time,88890408,desianb,"@Telkomsel min saya abis ganti layanan ke halo pasca bayar dari prabayar, sekarang saya kok ga bisa akses mbanking ya?","@Telkomsel min I Abis locker service to postpaid than prepaid halo, now I really can not access mBanking huh?"
275,2020-12-11 18:01:47 SE Asia Standard Time,170493000,hugessn,"Komplain layanan produk indihome dan telkomsel Smooa (dulu Moodah), cuma diberi nomor tiket pendaftaran komplain ajah... Hmm.. Mengecewakan.. sdh 6 hari nggak ada yg tlp ataupun sms ngabarin bahwa kasus sdh selesai..","Indihome product and service complaints telkomsel Smooa (formerly Moodah), just given the number of complaints registration tickets ajah ... Hmm .. Disappointing .. sdh 6 days there's no phone or sms reply ngabarin that case SDH completed .."
276,2020-12-11 14:47:43 SE Asia Standard Time,52065824,okva,"@Telkomsel saya udah setuju langganan,  eh masa udah coba masuk aplikasi smooa utk login,  tp nomor tidak terdaftar.  Udah diburu2 sama CS, tp layanan belum sempurna. digunakan aja belum, tp langsung ada kendala. Mohon TL segera","@Telkomsel I've agreed subscription, uh've tried entering the application period smooa For login, tp unlisted numbers. Diburu2 already at CS, tp service is not perfect. use just yet, there is a direct tp constraints. Please TL soon"
277,2020-12-11 07:20:21 SE Asia Standard Time,914235619,amoretamyrila,Knp yo telkomsel dari kemarin tiada layanan terus hmm,Knp yo telkomsel of yesterday no service continues to hmm
278,2020-12-11 02:38:44 SE Asia Standard Time,1268710178590949377,wongkit0,Ini terjadi saat ini kepada layanan @Telkomsel goblok tolol tukang nerror erotin isi dompet pelanggannya👎👊👊👊  https://t.co/Tz760JhuVl,It happened at this time to fool fool handyman services nThis error @Telkomsel wallet erotin pelanggannya👎👊👊👊 https://t.co/Tz760JhuVl
279,2020-12-10 23:46:00 SE Asia Standard Time,1232279801513144326,imajinasiliarmu,Paket mahal bos harusnya layanan jg stabil @Telkomsel masa bgini terus.. apa harus di atas 20gb paket data baru stabil ?  https://t.co/DZZS2hib0e,Expensive packages boss jg services should be stable @Telkomsel bgini period continues .. what should be on top of new data packets stable 20gb? https://t.co/DZZS2hib0e
280,2020-12-10 20:50:20 SE Asia Standard Time,809342398962667520,hateuforbeingu,@chenlebase Chenle sayang sama kamu akan selalu ada untuk kita semua sudah tidak ada yang bisa dibantu seputar produk dan layanan Telkomsel,@chenlebase Chenle love you will always be there for us all is no one can help about products and services Telkomsel
281,2020-12-10 20:49:29 SE Asia Standard Time,607038513,shirohana00,"Halo @Telkomsel apakah tidak ada niatan untuk optimasi bts daerah Glodogan, Klaten Selatan? Capek gan layanan data ngadat mulu  https://t.co/0D2mBQMX2R","Hello @Telkomsel if there was no intention to bts optimization Glodogan area, South Klaten? Tired gan crash data services mulu https://t.co/0D2mBQMX2R"
282,2020-12-10 20:14:08 SE Asia Standard Time,118919683,april_hamsa,"Yuhuuu pengguna Telkomsel, udah tahu belum kalau Telkomsel punya CloudX yang bisa digunakan utk layanan video conference gitu.Bisa sampai 100 org online meeting.Biayanya murah pula. Baca di postingan bu @duniaeni ini yaa infonya  #KamisManis #KamisOptimis   https://t.co/CduzFO1g5n","Yuhuuu Telkomsel users, already knows yet if Telkomsel has CloudX that can be used for video conferencing services to 100 org gitu.Bisa meeting.Biayanya online cheap anyway. Read in this @duniaeni yaa bu posting the info #KamisManis #KamisOptimis https://t.co/CduzFO1g5n"
283,2020-12-10 19:45:43 SE Asia Standard Time,310304969,usmangintingjk,"@Telkomsel Mungkin masih butuh puluhan tahun lagi ya Min utk peningkatannya ?  Hahahaa..  Dari bulan April, alasan peningkatan layanan. Realita dilapangan, malah tambah hari tambah lelet..  Kasih kompensasi buat pelangganmu. Harga mahal layanan bobrok, itu namanya ga adil boss","@Telkomsel It may still take decades longer yes Min For improvement? Hahahaa .. From April, the reason for the increase in services. Reality in the field, even added the added slow .. Love compensation for your customers. Prices are expensive services dilapidated, it's called fair ga boss"
284,2020-12-10 19:42:47 SE Asia Standard Time,310304969,usmangintingjk,"@Telkomsel Butuh waktu lama juga ya untuk peningkatan layanan.. Karena dari Bulan April kemaren, alasannya sedang melakukan penigkatan pelayanan.  Tapi realita di lapangan, malah TAMBAH LELET..  MUNGKIN butuh puluhan Tahun meningkatkan layanannya ya   hahahaahhaahahhah","@Telkomsel took a long time also yes for the improvement of service .. As of April yesterday, the reason is conducting care improvement. But the reality on the ground, even slow .. MAY BE ADDED takes tens of years improving its services so hahahaahhaahahhah"
285,2020-12-10 14:58:40 SE Asia Standard Time,2558181786,omenk_hendry,"Jadi spt ini ya layanan dari @Telkomsel . Ketika ada transaksi pulsa gagal, yg jelas2 isinya melalu aplikasi My Telkomsel, uang 100.000 nya tdk kembali di saldo GoPay @gojekindonesia . Ini sudah dari  hari Senin, 30 November. Dan saya sdh compain tgl 1 des. Kecewa bgt.","So yeah services such as these from @Telkomsel. When there is a failure toll transactions, which jelas2 contents through the application My Telkomsel, its 100,000 morbidly money back in balance GoPay @gojekindonesia. It has been from the day Monday, November 30th. And I sdh compain date 1 des. Bgt disappointed."
286,2020-12-10 13:59:32 SE Asia Standard Time,70901647,kaoshitam,@gadtorade @alfaridi Wkwkwkwkw cc @Telkomsel dan layanan beriklan menggunakan layanan sms....,@gadtorade @alfaridi Wkwkwkwkw cc @Telkomsel and advertising services using sms service ....
287,2020-12-10 13:30:21 SE Asia Standard Time,1307639690254786560,squishybunnn,@brightwin_fess Brightwin win do ya Allah aku harap aku bukan jenis yang akan datang bila ada yang bisa dibantu seputar produk dan layanan Telkomsel silakan mention kembali apabila ada yang mau di follow rt aja jfb tapi ya Allah aku berlindung kepada-Mu dari perbuatan yang haram E-KTP ke anggota,@brightwin_fess Brightwin win do ya God I hope I'm not the type that will come when no one can help Telkomsel about products and services please mention back when no one wants to follow rt wrote in JFB but O Allah I seek refuge in You from the unlawful actions E -KTP to members
288,2020-12-10 09:23:30 SE Asia Standard Time,1222344615677714433,myorbitid,"@RiZvAnE Hai, untuk saat ini layanan Customer Care bisa diakses melalui DM Instagram @myorbitid dan email cs@myorbit.id. Telkomsel Orbit akan terus mengembangkan untuk membuka channel layanan Customer Care lainnya. Terima kasih.","@RiZvAnE Hi, this time Customer Care service can be accessed via Instagram @myorbitid DM and email cs@myorbit.id. Orbit Telkomsel will continue to develop to open other channels Customer Care services. Thank you."
289,2020-12-09 22:57:23 SE Asia Standard Time,202614326,ady_baryadi,"@Telkomsel cs lu cuma minta maaf   atas sinyal ga stabil karena peningkatan layanan sistem tapi pas ditanyain sampai kapan cuma jawab secepatnya, udah 1 bulan jawabnya secepatnya terus !!!","Lu cs @Telkomsel only apologize for the signal is not stable due to improved services but fitting ditanyain system until when the only answer as soon as possible, as soon as possible its already 1 month continues !!!"
290,2020-12-09 22:42:33 SE Asia Standard Time,2794141723,illuminajong,"@Telkomsel Dari tgl 5 Desember alesannya begitu melulu. Kalo memang layanan internetmu gak siap, gak usah promo macam2 lah.. Kayak Jualan pepesan kosong aja kau Telkomsel. Apakah Telkomsel dengan sengaja tega mengecoh konsumen???","@Telkomsel From December 5 th alesannya so exclusively. If your internet service does not ready, not have promo macam2 lah .. Kayak Sale empty pepesan wrote you Telkomsel. Do Telkomsel deliberately mislead consumers bear ???"
