,created_at,user_id,username,tweet,english
104,2021-04-24 22:14:56 SE Asia Standard Time,1304333532576116738,jb89340358,"@Telkomsel mohon maaf ini saya kok jaringan telkomsel saya tuh sering bengong sama tiba"" tidak ada layanan padhl Tkp saya sudah di daerah yg signal telkomnya banyak,ini gimana ya ngatasinya?","@Telkomsel I'm really sorry I Telkomsel network tuh often stare at arrival ""no service padhl my scene already in the area that signal telkomnya many, this is how ya ngatasinya?"
105,2021-04-24 21:24:55 SE Asia Standard Time,2286453492,evik_cs,"@Telkomsel sebagai pelanggan setia Telkomsel saya merasa kecewa dengan layanan, terakhir bulan ini untuk mengikuti Telkomsel. .🤬","Telkomsel @Telkomsel as a loyal customer I was disappointed with the service, the latest this month to follow Telkomsel. .🤬"
106,2021-04-24 17:10:37 SE Asia Standard Time,19955534,ariyanto89,"Mohon maaf, pulsa anda tidak mencukupi untuk layanan CloudMAX. CS :  https://t.co/XpjVAwrzYJ  Beberapa kali @Telkomsel berusaha mencuri pulsa untuk layanan yang tidak ingin saya gunakan. Sebobrok itu kah? Kasian.","Sorry, your pulse is insufficient to service CloudMAX. CS: https://t.co/XpjVAwrzYJ Several times @Telkomsel trying to steal credit for a service that does not want me to use. Sebobrok it kah? Kasian."
107,2021-04-24 13:10:33 SE Asia Standard Time,1222344615677714433,myorbitid,"@RumahBudi @Telkomsel Hai, untuk saat ini layanan Customer Care bisa diakses melalui DM Instagram @myorbitid, WhatsApp 08111776706 dan email cs@myorbit.id. Telkomsel Orbit akan terus mengembangkan untuk membuka channel layanan Customer Care lainnya. Terima kasih.","@RumahBudi @Telkomsel Hi, this time Customer Care service can be accessed via DM @myorbitid Instagram, WhatsApp 08111776706 and email cs@myorbit.id. Orbit Telkomsel will continue to develop to open other channels Customer Care services. Thank you."
108,2021-04-24 10:18:01 SE Asia Standard Time,1168718119,zzzahraf,"@Telkomsel bener ga si ini layanan online telkomsel? karena katanya aku pake kartu prabayar aku dapet point banyak dan belom pernah dipake, dan nnti malem point akan dikosongkan jd ditawarin buat tukar point pake free 3 bulan pembayaran kedepan dan voucher belanja?  https://t.co/8GbaCumbBR","@Telkomsel Bener ga telkomsel the online service? because he says I use a prepaid card point I am currently a lot and have not been using that, and nnti malem point will be emptied jd ditawarin exchange point for 3 months free use next payment and shopping vouchers? https://t.co/8GbaCumbBR"
109,2021-04-24 07:46:23 SE Asia Standard Time,3292668764,nanademisa,"Ni berarti @Telkomsel  udh gada layanan unlimited sebulan ni?? Min?? Serius?, @Telkomsel  https://t.co/p6o67WPQQl","Ni means @Telkomsel UDH a month unlimited service mace ni ?? Min ?? Seriously ?, @Telkomsel https://t.co/p6o67WPQQl"
110,2021-04-24 04:19:52 SE Asia Standard Time,4100257752,carlburry,"@Telkomsel myn, tiada layanan mulu itu kenapa, ya? Udah di mulai ulang, tetep aja.","@Telkomsel myn, no mulu services it why, huh? Already at the restart, tetep wrote."
111,2021-04-24 02:46:24 SE Asia Standard Time,2794141723,illuminajong,"@Telkomsel Operator Bhangsad! Lu keseringan hilang koneksi, 0 Kbps itu berarti Offline Monyong!!! Lokasi gw di kota sebelah DKI. Lu Operator apa Calo Internet? Koq gak bisa berbuat banyak sama layanan lu sendiri???","Operator @Telkomsel Bhangsad! Lu frequency of lost connections, 0 Kbps it means Offline Monyong !!! Gw locations in the city next to the city. Lu been what Calo Internet? Koq can not do much at the service lu itself ???"
112,2021-04-23 23:40:43 SE Asia Standard Time,63980919,bramoke,Gangguan layanan @MNCPlayID...??? Makanya koq lemot.  Untung masih punya data internet TELKOMSEL  https://t.co/kU5hYnahbM,"@MNCPlayID service interruption ... ??? So koq slow. Fortunately, they have internet data TELKOMSEL https://t.co/kU5hYnahbM"
113,2021-04-23 23:36:15 SE Asia Standard Time,1381366730,miichan85936049,"hai min @Telkomsel, kenapa pulsa telkomsel saya cepat habis ya padahal cumn aktivasi Mobile banking saja melalui SMS.  Cara menghentikan layanan penyebab tersedotnya pulsa bagaimana ya min?",hi min @Telkomsel why I telkomsel pulse quickly depleted when cumn activation yes Mobile banking only via SMS. How to stop the service causes the pulse tersedotnya how ya min?
114,2021-04-23 21:25:11 SE Asia Standard Time,80244223,ayahfia,"@detikinet Mugo"" iso dadi sebab peningkatan kualitas layanan jaringan 4g @Telkomsel  ro @kartuHalo","@detikinet Mugo ""dadi iso cause 4g network service quality improvement @Telkomsel ro @kartuHalo"
115,2021-04-23 21:19:51 SE Asia Standard Time,135815019,detikinet,"Telkomsel dan Smartfren menang lelang frekuensi 2,3 Ghz. Menkominfo Johnny G Plate meminta mereka mengoptimalkan layanan 4G.  https://t.co/4BaKL0t2pQ",Telkomsel and Smartfren win the auction frequency of 2.3 GHz. MCIT Johnny G Plate ask them to optimize 4G services. https://t.co/4BaKL0t2pQ
116,2021-04-23 18:08:18 SE Asia Standard Time,872048314807533568,diepwebs,@Telkomsel halo telkomsel sinyal saya tiada layanan nih gimana?,@Telkomsel hello my signal telkomsel no services ya how?
117,2021-04-23 16:29:02 SE Asia Standard Time,765035200896118789,indihomecare,"@winsalute @Telkomsel @IndiHome Hai, Kak Winda. Mengenai pelaporannya, agar Rikaf dapat bantu pengecekan lebih lanjut, silakan informasikan nomor layanan dan nomor HP aktif ke DM Twitter terbaru kami @IndiHomeCare  https://t.co/LeisBDNdPx guna mendapat pelayanan terbaik dan menjaga (1/2)","@winsalute @Telkomsel @IndiHome Hi, Kak Winda. Regarding reporting, in order to help Rikaf further checking, please inform the service number and mobile number is active to our latest Twitter DM @IndiHomeCare https://t.co/LeisBDNdPx in order to get the best services and maintain (1/2)"
118,2021-04-23 15:45:02 SE Asia Standard Time,552523769,katadatacoid,"Kominfo mengumumkan, Telkomsel dan Smartfren selangkah lagi akan memenangkan lelang frekuensi 2,3 GHz. Smartfren berencana memanfaatkan ini untuk memperluas layanan ke daerah.   https://t.co/TeI5OyWR1S",Communications and Information Technology announced that Telkomsel and Smartfren step again will win the auction frequency of 2.3 GHz. Smartfren plans to use to expand the service to the area. https://t.co/TeI5OyWR1S
119,2021-04-23 14:00:33 SE Asia Standard Time,138006494,ryantiisanders,"Ini layanan telkomsel udah 1 minggu ditempat gue bangsat banget. Udah  bolak balik telp Cs, jawabannya klise mulu. Kesel.","This service is already 1 week telkomsel bastard really my place. Already alternating tel Cs, mulu cliche answer. Kesel."
120,2021-04-23 12:00:13 SE Asia Standard Time,23046757,dailysocial,Awal tahun ini layanan Telkomsel MyAds terintegrasi ke aplikasi mitra usaha GoBiz  https://t.co/MNeCauQ9bi,Earlier this year MyAds Telkomsel services integrated into business partner applications GoBiz https://t.co/MNeCauQ9bi
121,2021-04-23 11:09:08 SE Asia Standard Time,78657029,alvnjade,@Telkomsel halo min mau tanya untuk layanan menu *363*20# kok sudah dari semalam saya coba tapi system selalu sibuk ya tulisannya? Bakal normal lagi kapan ya?,@Telkomsel min hello want to ask for the service menu * 363 * 20 # kok already from last night I tried but the system is always busy ya say? Will normally again when ya?
122,2021-04-23 08:27:34 SE Asia Standard Time,1228981475799781376,beritasiber,"Gandeng Lookout Inc, Telkomsel Kenalkan Layanan Keamanan Siber TEMS, Apa Itu?  https://t.co/RV02HQQJcX","Cooperate Lookout Inc., Telkomsel Recommend TEMS Siber Security Service, What's That? https://t.co/RV02HQQJcX"
123,2021-04-23 04:52:34 SE Asia Standard Time,1217630259769565184,prbekasiraya,"Berkolaborasi dengan Mitra Lookout Inc, Telkomsel Luncurkan Layanan TEMS  https://t.co/866QSxernB","Collaborate with Partners Lookout Inc., Telkomsel launches TEMS https://t.co/866QSxernB"
124,2021-04-23 04:37:34 SE Asia Standard Time,1217630259769565184,prbekasiraya,"Berkolaborasi dengan Mitra Lookout Inc, Telkomsel Luncurkan Layanan TEMS  https://t.co/J7mcsxLzPJ","Collaborate with Partners Lookout Inc., Telkomsel launches TEMS https://t.co/J7mcsxLzPJ"
125,2021-04-23 04:34:13 SE Asia Standard Time,1220032683805265920,nash07130317,"@IndiHome @IndiHomeCare @TelkomSolution @TelkomCare @TelkomIndonesia @Telkomsel @kemkominfo , setiap gangguan pada layanan indihome kami laporkan, tetapi jawaban masih dalam perbaikan, bagaimana ini pelayanan Indihome, mohon pelayanannya kepada konsumen.","@IndiHome @IndiHomeCare @TelkomSolution @TelkomCare @TelkomIndonesia @Telkomsel @kemkominfo, any interruption in service indihome we reported, but the answer is still under repair, how these services Indihome, ask the service to consumers."
126,2021-04-23 04:29:05 SE Asia Standard Time,1220032683805265920,nash07130317,"@IndiHome @IndiHomeCare @TelkomSolution @TelkomCare @TelkomIndonesia @Telkomsel @kemkominfo, mohon kiranya fihak terkait bisa membantu perbaikan gangguan pada layanan internet Indihome, setiap bulan selalu ada gangguan, iuran kami selalu tepat waktu, bagaimana ini Indihome.","@IndiHome @IndiHomeCare @TelkomSolution @TelkomCare @TelkomIndonesia @Telkomsel @kemkominfo, please kindly relevant parties could help repair disruption in Internet service Indihome, every month there is always a nuisance, our dues are always on time, how this Indihome."
127,2021-04-23 04:27:40 SE Asia Standard Time,99650254,kunciterumbu,"@IndiHomeCare hi, ada gangguan layanan telkom/telkomsel kah didaerah depok 2, Mekarjaya? Gak ada internet sama sekali","@IndiHomeCare hi, there is a service disruption telecoms / telkomsel kah Depok area 2, Mekarjaya? No internet at all"
128,2021-04-23 04:18:12 SE Asia Standard Time,159095749,ivelatio,Selamat pagi Kak @myorbitid  Layanan home wireless orbit memakai simdcard khusus? (Beda dng simcard telkomsel simpati / kartu as / loop) Bisa kah saya beli kartu perdana orbit saja tanpa modem? Terima kasih.,Good morning @myorbitid Kak home wireless service simdcard orbit wear special? (Different DNG simcard telkomsel sympathy / ace / loop) Can I buy a starter pack kah orbit without a modem? Thank you.
129,2021-04-23 04:00:03 SE Asia Standard Time,1226377109402030083,dioalfarel,ya telkomsel tiada layanan,yes telkomsel no service
130,2021-04-22 21:26:09 SE Asia Standard Time,869042069490155520,yourphlanets,Menghentikan layanan ini gimana ya min? @Telkomsel  https://t.co/CCumvc8ZNm,Stopping these services how ya min? @Telkomsel https://t.co/CCumvc8ZNm
131,2021-04-22 21:15:35 SE Asia Standard Time,391071785,alloramba,selamat malam @Telkomsel kartu hape saya terblokir setelah diupgrade dari 3G ke 4G disalah satu outlet/konter yang menyediakan layanan upgrade kartu ke 4G. apakah ada solusi agar kartu saya ini bisa berfungsi normal kembali?,goodnight @Telkomsel my phone card is blocked after an upgrade from 3G to 4G in one of the outlets / counters that provide services card upgrade to 4G. is there a solution that my card could function normally again?
132,2021-04-22 18:51:09 SE Asia Standard Time,1081443047441784832,mhdrepi,"@kapiaaang Hai, Kak. Ada yang bisa Mimin bantu? Silakan infokan detail pertanyaan atau keluhan seputar produk dan layanan Telkomsel ya, agar dapat Mimin bantu dengan solusi yang tepat. Makasih :) -Re","@kapiaaang Hi, brother. Can anybody help Mimi? Please infokan detail with questions or complaints about products and services Telkomsel yes, so that Mimi can help with proper solutions. Thanks :) -Re"
133,2021-04-22 18:29:48 SE Asia Standard Time,1243152104492904449,senjakotajogja,"@izy_bensa Mungkin bisa ke YLKI, ato ke Layanan Aspirasi dan Pengaduan Online Rakyat (LAPOR!):  https://t.co/YbYS6HDTCg, SMS 1708 (Telkomsel, Indosat, Three), Twitter @lapor1708 serta aplikasi mobile (Android dan iOS). 🙂","@izy_bensa might be to YLKI, ato to Service and Complaints Online People's Aspiration (REPORT!): https://t.co/YbYS6HDTCg, SMS 1708 (Telkomsel, Indosat, Three), Twitter @ lapor1708 and mobile applications (Android and iOS ). 🙂"
134,2021-04-22 16:28:56 SE Asia Standard Time,64635651,serambinews,#Telkomsel |  Telkomsel meluncurkan layanan Telkomsel Enterprise Mobile Security (TEMS) yang menghadirkan dua solusi keamanan untuk memastikan pelanggannya untuk terhindar dari ancaman siber yang terus berkembang.  https://t.co/WgCGay7slR,#Telkomsel | Telkomsel Telkomsel launched its Enterprise Mobile Security (TEMs) which presents two security solutions to ensure its customers to avoid cyber threats are constantly evolving. https://t.co/WgCGay7slR
135,2021-04-22 16:25:41 SE Asia Standard Time,260043508,simpati,Mari #BukaPintuKebaikan dengan Telkomsel Siaga!  Beli dan aktifkan Paket Combo (kuota 10GB + 100 menit telponan + 100 SMS) melalui layanan perbankan favoritmu di  https://t.co/3yFVedTkRQ &amp; #GoDicover Ekstra pulsa Rp10 ribu!*  *S&amp;K berlaku  https://t.co/H8gCsKNuG5,Let #BukaPintuKebaikan with Telkomsel Alert! Buy and activate Combo Package (10GB quota telponan + 100 minutes + 100 SMS) banking services through favorites in https://t.co/3yFVedTkRQ & amp; Extra #GoDicover pulse Rp10 thousand! * * S & amp; K applies https://t.co/H8gCsKNuG5
136,2021-04-22 15:39:06 SE Asia Standard Time,765035200896118789,indihomecare,"@null Halo, Kak Vlezya. Celio cek koneksi di nomor dengan ujung 47 terpantau normal dan ada pemakaian. Terkait layanan Telkomsel, silakan hubungi rekan kami di  https://t.co/NGvHgOMHwb. -Celio","@null Hello, brother Vlezya. Celio checks in connection with the end of the 47 observed number of normal and no usage. Telkomsel related services, please contact our colleagues in https://t.co/NGvHgOMHwb. -Celio"
137,2021-04-22 15:24:52 SE Asia Standard Time,100120878,samuelmantiri,"Pandemi ini banyak aktivitas bergantung layanan internet, @Telkomsel justru akrobat dg berbagai skema tarif yg berbeda (plus jebakan bila tdk teliti baca S&amp;K). Inikah nasionalisme mu? Ingat hasil usaha @Telkomsel itu pun dinikmati @Singtel ! Damn !!! Cc: @LAPOR1708 @jokowi (1/2)","This pandemic many internet services rely activity, @Telkomsel actually stunt dg a different tariff schemes (plus trap when morbidly carefully read the S & amp; K). Is this your nationalism? Remember that @Telkomsel operating results also enjoyed @Singtel! Damn !!! Cc: @ LAPOR1708 @jokowi (1/2)"
138,2021-04-22 15:21:06 SE Asia Standard Time,498237435,kabarsiang,"Gandeng Lookout Inc, Telkomsel Kenalkan Layanan Keamanan Siber TEMS, Apa Itu?  https://t.co/tsMx1D6ZOx","Cooperate Lookout Inc., Telkomsel Recommend TEMS Siber Security Service, What's That? https://t.co/tsMx1D6ZOx"
139,2021-04-22 13:51:10 SE Asia Standard Time,78813980,nurdiansyahdian,@Telkomsel Beberapa hari belakangan ini saya tidak bisa mengakses layanan aplikasi MyTelkomsel.  https://t.co/A4LxHcVVrl,@Telkomsel last few days I could not access the application services MyTelkomsel. https://t.co/A4LxHcVVrl
140,2021-04-22 13:47:47 SE Asia Standard Time,1580026040,heyiceman,"@Telkomsel siang. Min, aku mau mengeluhkan layanan MyTelkomsel. Jadi nih ya, Ibu ku udah meng klaim kuota 4GB dari hasil every day check in. Udh diambil 10 Rp. Tp kok ga dikasih kuota nya?? Kan lumayan tuh 4GB 2 hari..  Please fix this.","@Telkomsel afternoon. Min, I want to complain MyTelkomsel services. So ya ya, my mother already clicking claim 4GB quota of the results of the check in every day. UDH taken 10 USD. Tp kok ga given his quota ?? Kan passable tuh 4GB 2 days .. Please fix this."
141,2021-04-22 11:54:57 SE Asia Standard Time,151378779,dimandikan,"@Telkomsel Terdapat layanan perbankan m-banking, e-banking di nomor ini, harap kunjungi Grapari untuk ganti kartu. Kalau ke Grapari syaratnya apa aja?","There @Telkomsel banking services m-banking, e-banking in this number, please visit Grapari to replace the card. If Grapari to the conditions of any kind?"
142,2021-04-22 11:34:56 SE Asia Standard Time,996826469400629248,kopitoba,Om @erickthohir Telkomsel @Telkomsel itu masih milik BUMN ngak sih?? Kok makin Bapuk aja udah mahal layanan kayak manajemen Metro Mini.,Om @erickthohir Telkomsel @Telkomsel it still belongs to SOEs ngak anyway ?? Aja kok Bapuk increasingly expensive services like Mini Metro management.
143,2021-04-22 10:39:00 SE Asia Standard Time,1365017558173110272,mario22384219,Dari jam 8 pagi kurang jaringan telkomsel down padahal harga kuota nya paling mahal. Tolong pihak telkomsel perbaiki kualitas layanan nya serta kerugian kami sebagai konsumen tanggung jawab nya telkomsel sebagai penyedia layanan bagaimana? #telkomsel,From 8 am less network telkomsel down while the price of its most expensive quota. Please correct the telkomsel its service quality as well as our losses as consumers of its responsibility as a service provider Telkomsel how? #telkomsel
144,2021-04-22 10:20:33 SE Asia Standard Time,1675707294,uzoneindonesia,CEO Telkomsel: Kami Siapkan Layanan Prima untuk Silahturahmi Digital #uzoneID   https://t.co/RAdR1uFbJw,CEO Telkomsel: We Prepare Prima Service for Digital silahturahmi #uzoneID https://t.co/RAdR1uFbJw
145,2021-04-22 09:11:34 SE Asia Standard Time,62736810,indahyuwelie,CEO Message: Saling Terhubung dengan Layanan Prima dari Telkomsel  https://t.co/alvYuNoPd9 via @YouTube @Telkomsel #bukapintukebaikan,CEO Message: Interconnecting with Prima Service from Telkomsel https://t.co/alvYuNoPd9 via @YouTube @Telkomsel #bukapintukebaikan
146,2021-04-22 08:45:45 SE Asia Standard Time,2392460208,jawapos,"Telkomsel Buka Layanan TEMS, Garap Bisnis Keamanan Siber  https://t.co/LafnryyUu0","Telkomsel Open TEMS Service, Security Business Working Siber https://t.co/LafnryyUu0"
147,2021-04-22 03:43:54 SE Asia Standard Time,2227684368,hatta_wildan,Hey @Telkomsel ini layanan maxstream kenapa?,Hey @Telkomsel maxstream why this service?
148,2021-04-21 13:33:33 SE Asia Standard Time,2940371460,mobitekno,"Gandeng Lookout, Telkomsel Suguhkan Solusi Keamanan Terpadu bagi Para Pelaku Bisnis dan Pelanggannya: Mobitekno – Menggandeng perusahaan keamanan siber terkemuka, Lookout, Inc., Telkomsel baru saja meluncurkan layanan […]  https://t.co/kS78jMCGEH  https://t.co/uHUykuufNy","Lookout trailer, Telkomsel Feature Integrated Security Solutions for Business and clientele Actors: Mobitekno - Holding a leading cyber security company, Lookout, Inc., Telkomsel has just launched a service [...] https://t.co/kS78jMCGEH https: // t .co / uHUykuufNy"
149,2021-04-21 10:28:51 SE Asia Standard Time,824786539,achmadsyariefha,"hi, @Telkomsel kok di area saya kadang jaringannya suka hilang ya ? kadang kadang ga ada layanan gitu. Area Tenggarong, terima kasih","hi, @Telkomsel kok area network like sometimes I lost it? ga sometimes no service so. Area Tenggarong, thanks"
150,2021-04-21 09:53:04 SE Asia Standard Time,1222344615677714433,myorbitid,"@justlookpab @YLKI_ID @Telkomsel Hai, mohon maaf atas ketidaknyamanannya. Kami akan terus meningkatkan layanan kami agar lebih baik lagi. Saat ini laporan Anda masih dalam proses oleh tim terkait, mohon kesediaannya untuk menunggu sampai tim kami memberikan info dan penanganan lebih lanjut. Terima kasih.","@justlookpab @YLKI_ID @Telkomsel Hi, sorry for the inconvenience. We will continue to improve our services so much better. Your reports are still in the process by the relevant team, please willingness to wait until our team provides information and further handling. Thank you."
151,2021-04-21 05:56:47 SE Asia Standard Time,1152892298079813633,arvansyach,"komplain lewat aplikasi lu suruh nunggu 3,5 jam komplain lewat twiter ngga lu gubris DM? apalagi  pelayanan macam apa ini?   peranakan @Telkomsel kok gini amat?   ga salah cari mitra apa?   benerin lah layanan dan jaringan nya",complaints through the application lu told to wait for 3.5 hours complaints through twiter guns lu gubris DM? let alone the service is this? Peranakan @Telkomsel kok gini so? ga find any partners? benerin was the service and its network
152,2021-04-21 05:36:09 SE Asia Standard Time,1374005501780848643,rantnyamino,"apaan si anjir, jadi mau jawab gimana? ""selamat pagi siang sore malam dengan layanan telkomsel disini dengan siapa disana ada yang bisa dibantu? ketik 3 untuk meminta pertolongan, terimakasih"" ??  https://t.co/nqC8HDAPhd","fuck the Anjir, so want to answer how? ""Good morning afternoon evening lunch with Telkomsel service here with who is there anyone can help? Type 3 to ask for help, thank you"" ?? https://t.co/nqC8HDAPhd"
153,2021-04-21 04:09:29 SE Asia Standard Time,1199156811913236480,aktwentyfive_,@Telkomsel apakah telkomsel sedang maintenance jaringan ? semua hp yang ada dirumah tidak ada layanan untuk kartu telkomsel,@Telkomsel whether telkomsel being network maintenance? all hp was at home no service to Telkomsel card
154,2021-04-21 03:49:54 SE Asia Standard Time,99182762,bayuagni_,"@Polansski Hai, Kak Polan. Ada yang bisa dibantu seputar produk dan layanan Telkomsel? Kalo iya, yuk infokan detail pertanyaannya ya, agar dap","@Polansski Hi, Kak Polan. Can I help about products and services Telkomsel? If yes, let infokan detail the question yes, so dap"
155,2021-04-20 23:33:19 SE Asia Standard Time,3570716532,gizmologi,Telkomsel Gandeng Lookout Hadirkan Layanan Enterprise Mobile Security  https://t.co/88VYv8U0dr,Hold Telkomsel Presents Lookout Mobile Security Enterprise Service https://t.co/88VYv8U0dr
156,2021-04-20 21:24:10 SE Asia Standard Time,1335944225519673344,yosherlock1,"@Telkomsel saya harus menghidupkan dan mematikan data setiap 10 detik sekali baru bisa menggunakan layanan Anda. Jual kuota mahal banyak pemakai harusnya untung, tapi keuntungannya tidak Anda pakai untuk meningkatkan kualitas pelayanan 👎","@Telkomsel I had to turn on and off every 10 seconds once the data can only be using your services. Sell ​​quota considering many users should benefit, but the benefits do not spend to improve service quality 👎"
157,2021-04-20 21:03:45 SE Asia Standard Time,2794141723,illuminajong,"@Telkomsel Apa pantas saya yg tinggal di ibukota sebelah DKI dapet sinyal Telkomsel cuma 3 bar??? kalian Direksi sama Komisaris @Telkomsel jgn cuma numpang makan doang di @Telkomsel, kalian pikirin dong cara tingkatkan kualitas layanan. Jangan kaya kebo kekenyangan... NGEHE lu pada!!!  https://t.co/al6Nw5BvAn","@Telkomsel What I deserve that live in the capital next to the city dapet Telkomsel signal only 3 bar ??? Directors at Commissioner @Telkomsel you just ride jgn eat doang in @Telkomsel, you pikirin dong ways to increase the quality of service. Do not rich kebo glut ... NGEHE lu !!! https://t.co/al6Nw5BvAn"
158,2021-04-20 15:14:28 SE Asia Standard Time,1189741956,nabirenet,Layanan Data Telkomsel di Distrik Wanggar Nabire Normal Kembali Pasca Penanganan  https://t.co/e2bytLHq0M #nabire #papua,Telkomsel Data Services District Nabire Wanggar Normal Back Post Handling https://t.co/e2bytLHq0M #nabire #papua
159,2021-04-20 13:25:03 SE Asia Standard Time,80204488,telkomindonesia,Kartu AS 2in1 adalah produk sinergi antara Telkom Taiwan dan Telkomsel yang memiliki pengalaman 20 tahun dalam melayani layanan seluler di Indonesia.,US Card 2in1 is the product of synergy between Telkom and Telkomsel Taiwan which has 20 years experience in serving mobile services in Indonesia.
160,2021-04-20 11:38:51 SE Asia Standard Time,500391885,d_d_kurniawan,"@DOKUid Pulsa saya belum masuk sampai sekarang, tapi di keterangannya sukses bisa cek di 188 telkomsel lalu tanyakan apakah sudah ada kiriman pulsa senilai 300.000  tolong saya merasa kecewa dengan layanan Doku padahal saya sudah sering transaksi dengan doku","Toll @DOKUid I have not signed until now, but in his statement could successfully check in 188 telkomsel then ask whether there is a pulse of items worth 300.000 help me feel disappointed with the service Doku though I've often deal with doku"
161,2021-04-20 10:28:43 SE Asia Standard Time,98862183,faristoteles,@Telkomsel kok layanan disney hotstar di telkomsel apps kalau dibeli selalu gagal sih pakde?! Hmmmm,@Telkomsel why disney Hotstar services in telkomsel apps if purchased pakde always fail anyway ?! Hmmmm
162,2021-04-20 09:42:36 SE Asia Standard Time,1189741956,nabirenet,"Warga Bumi Wonorejo Nabire Keluhkan Lambatnya Layanan Data, Ini Penjelasan Telkomsel  https://t.co/GGOHWHz4fZ #nabire #papua","Residents Complain Earth Wonorejo Nabire Slow Data Services, this explanation #nabire Telkomsel https://t.co/GGOHWHz4fZ #papua"
163,2021-04-20 09:15:28 SE Asia Standard Time,1189741956,nabirenet,Telkomsel Benarkan Ada Gangguan Layanan di Distrik Wanggar Nabire  https://t.co/VddCUzxZbi #nabire #papua,Telkomsel Justify There is disturbance in the district of Nabire https://t.co/VddCUzxZbi Wanggar #nabire #papua
164,2021-04-20 04:31:39 SE Asia Standard Time,112629581,meriindaa,Peningkatan sistem layanan mulu lu tapi gak ningkat-ningkat. Mau beli kuota aja pake ngemis-ngemis dulu @Telkomsel,Improved service system mulu lu but not ningkat-ningkat. Want to buy quota beg-beg just use first @Telkomsel
165,2021-04-19 21:37:08 SE Asia Standard Time,589600174,mandiricare,"@ditaranin Halo Ibu Dita, utk by.u blm dpt didaftarakan layanan Livin' by Mandiri, perihal tsb Ibu dpt menggunakan Telkomsel, XL, Indosat, Smartfreen dan Tri. Tks ~ Theo","@ditaranin Hello Mrs. Dita, to by.u p interchangeable been registered service Livin 'by Independent, concerning TSB Capital retrievable using Telkomsel, XL, Indosat, Smartfreen and Tri. Tks ~ Theo"
166,2021-04-19 21:16:34 SE Asia Standard Time,1369279864902086659,raj_tompul07,"@Telkomsel Katanya ditunggu 2 jam, kartu akan langsung imigrasi ke kartu halo dan layanan yg diberikan bisa digunakan. Ini udah 2 jam tak ada hasil dan kejelasan. Klau memang di tolak imigrasi ya di beritahukan. 🙏","Said @Telkomsel wait 2 hours, a card will direct the immigration card given halo and services can be used. It's already 2 hours no output and clarity. Klau was rejected immigration tell ya. 🙏"
