,created_at,user_id,username,tweet,english
111,2020-12-21 21:12:17 SE Asia Standard Time,2500555663,te_beee,@Telkomsel Semoga lekas selesai ya ka peningkatan sistem layanannya supaya kami yg pengguna layanan tidak kerepotan krn jaringan ilang2an 🙏🏻,Hopefully @Telkomsel quickly finished ya ka increase its service system so that users of the service we do not hassle krn ilang2an network 🙏🏻
112,2020-12-21 19:44:43 SE Asia Standard Time,1075673058931806208,indihome,"@zulfadlanm eluarga, baik di rumah maupun seluler. Saat di rumah, Kakak dapat menikmati layanan telepon rumah, internet, dan hiburan dari IndiHome. Kakak juga akan mendapatkan layanan SMS, telepon, dan internet seluler dari Telkomsel. Informasi lebih lanjut silahkan (2/3)","@zulfadlanm eluarga, either at home or mobile. At home, brother can enjoy home phone service, internet, and entertainment from IndiHome. Sister will also get SMS, telephone, and mobile internet from Telkomsel. For further information please (2/3)"
113,2020-12-21 18:00:41 SE Asia Standard Time,142994966,angge_maniez,"Minta tolong dong layanan di plaza telkom bsd..... lama sekali..!!!, bayang kan untuk proses perubahan paket hampir 3 jam blm selesai juga..!!! Belum lagi jaringan net indi home ilang timbul...!!!hampir semua customer punya keluhan yang sama..!!!@TelkomCare , @Telkomsel","Ask for help dong telecom services in the plaza bsd .. !!! ..... a long time, the shadow of right to process changes almost 3 hour package blm finished well .. !!! Not to mention the home network ilang raised net indi ... !!! nearly all customers have the same complaint .. !!! @ TelkomCare, @Telkomsel"
114,2020-12-21 16:13:59 SE Asia Standard Time,2679681164,rarteandy,"@Telkomsel 1 tahun peningkatan sistem layanan tidak kelar2, parah","@Telkomsel 1 year increase kelar2 not care systems, severe"
115,2020-12-21 16:10:02 SE Asia Standard Time,966983910788759553,genpi_co,Telkomsel terus semangat memberikan produk dan layanan untuk memenuhi kebutuhan pelanggan di mana pun dan situasi apa pun. #Telkomsel  https://t.co/p6CD09MdoN,Telkomsel will continue the spirit of delivering products and services to meet customer needs anywhere and any situation. #Telkomsel https://t.co/p6CD09MdoN
116,2020-12-21 15:53:21 SE Asia Standard Time,57223495,selularid,Produk dan Layanan Telkomsel Jadi Pilihan Masyarakat Indonesia  #telkomsel  https://t.co/sS0iIUf4DF lewat @selularid,Products and Services Public Option Indonesia Telkomsel So #telkomsel https://t.co/sS0iIUf4DF through @selularid
117,2020-12-21 15:21:26 SE Asia Standard Time,1340577386287439879,agenmesin,"Game Daftar Slot Habanero Hadiah Pulsa  Seiring kemajuan teknologi di Indonesia yang berkembang sangat pesat, saat ini YoubetCash menyediakan layanan deposit dengan menggunakan pulsa XL dan Telkomsel.  https://t.co/jjjImKGHte  #youbetcash #slot #playtech #SG #PP #IDN #IDNLive  https://t.co/hw3qjlbd2a","Habanero Slot Game List Gift Voucher As technology advances in Indonesia that is growing very rapidly, this time YoubetCash provide deposit services by using pulses XL and Telkomsel. https://t.co/jjjImKGHte #youbetcash #slot #playtech #SG #PP #IDN #IDNLive https://t.co/hw3qjlbd2a"
118,2020-12-21 12:37:19 SE Asia Standard Time,1340577386287439879,agenmesin,"Daftar Slot Habanero Online Android  Seiring kemajuan teknologi di Indonesia yang berkembang sangat pesat, saat ini YoubetCash menyediakan layanan deposit dengan menggunakan pulsa XL dan Telkomsel.  https://t.co/qplSa3a35A  #youbetcash #slot #playtech #SG #PP #IDN #IDNLive  https://t.co/P6rciUKVDg","Online Habanero Slot list Android As technology advances in Indonesia that is growing very rapidly, this time YoubetCash provide deposit services by using pulses XL and Telkomsel. https://t.co/qplSa3a35A #youbetcash #slot #playtech #SG #PP #IDN #IDNLive https://t.co/P6rciUKVDg"
119,2020-12-21 08:51:28 SE Asia Standard Time,1340835577638256640,arioprabangkoro,"@Telkomsel masalahnya kita sudah bayar mahal utk layanan internetnya, dan multimedia sudah sepaket, secara “terpaksa” kita dpt layanan itu, lha kok begitu dinikmati, quota yg gede itu malah sering bermasalah.","@Telkomsel the problem we've paid dearly For internet services, and Multimedia package, are ""forced"" us dependable service that, LHA why so enjoyed, the quotas big it actually is often problematic."
120,2020-12-21 08:49:50 SE Asia Standard Time,1340835577638256640,arioprabangkoro,"@Telkomsel tolong dong layanan maxstream nya diperbaiki, sering logout sendiri, jadi tanpa sadar makan quota utama, suka muter2 ngk jelas, suka keluar notif “hanya bisa dinikmati di indonesia”, lha emang gw di indo, suka freeze trus ngulang lg filmnya, pokoknya parah banget","@Telkomsel please his maxstream service dong repaired, often logout itself, so unknowingly eat the main quota, like muter2 NGK obvious, like out notif ""can only be enjoyed in Indonesia"", LHA emang gw in indo, then freeze ngulang lg Like the movie, anyway really bad"
121,2020-12-21 08:07:26 SE Asia Standard Time,1283297114970157056,zhafiraash1,"@Telkomsel @ikasyafitr Halo telkomsel, mau nanya. Untuk layanan internet multimedia. Layanan app ap saja ya? Benar bisa buat whatsapp, instagram, line, dll?","@Telkomsel @ikasyafitr Halo Telkomsel, want to ask. For multimedia internet services. Ap app service, yes? Really can make whatsapp, instagram, line, etc.?"
122,2020-12-21 07:51:25 SE Asia Standard Time,128882774,schkyu,"@Telkomsel min, tsel udh ada layanan esim belum ya??","@Telkomsel min, TSEL UDH no service ESIM not ya ??"
123,2020-12-21 07:41:27 SE Asia Standard Time,2284291628,rusdiantotim,"layanan @Telkomsel memang kurang memuaskan, Ayo @IndosatOoredoo, @myXL dan provider lainya... Silahkan masuk ke daerah kami.  https://t.co/KPKodawqS1","@Telkomsel service was less than satisfactory, Come @IndosatOoredoo, @myXL and other providers ... Please go to our area. https://t.co/KPKodawqS1"
124,2020-12-21 05:57:50 SE Asia Standard Time,53017872,chichacit,"@Telkomsel min,pulsa ibu saya berkurang terus padahal tidak pernah dibuat telepon atau sms, caranya untuk menghentikan semua layanan berbayar gimana ya?dari rbt,games,dan semua layanan berbayar yang membuat pulsa ibu saya tersedot habis.","@Telkomsel min, pulse decreases continuously whereas my mother never made a phone or sms, how to stop all services paid how? Of rbt, games, and all paid services that make my mother pulses sucked away."
125,2020-12-21 05:53:23 SE Asia Standard Time,384064486,nananmulyana2,"@Telkomsel Tidak bisa dipakai telp jawabannya"" .....pulsa anda tidak mencukupi"" dan SMS jawabannya ""periksa layanan operator""","Can not be used tel @Telkomsel answer ""..... your pulse is not sufficient"" and the SMS reply ""check operator services"""
126,2020-12-20 23:20:11 SE Asia Standard Time,1236356576417468416,semarakredaksi,Produk dan Inovasi Layanan Telkomsel Jadi Pilihan Terbaik Masyarakat di Indonesia Customer Experience Award 2020  https://t.co/LBvwzyfEt2,Product and Service Innovation Best Option So Telkomsel Indonesia Society in Customer Experience Award 2020 https://t.co/LBvwzyfEt2
127,2020-12-20 21:25:19 SE Asia Standard Time,1339950866996969476,freebetagen,"Situs Game Agen Habenero Online Terbaik  Seiring kemajuan teknologi di Indonesia yang berkembang sangat pesat, saat ini YoubetCash menyediakan layanan deposit dengan menggunakan pulsa XL dan Telkomsel    https://t.co/rniWjtHAMQ #youbetcash  https://t.co/ZSBVTLHcsK","Site Agent habenero Best Online Game As technology advances in Indonesia that is growing very rapidly, this time YoubetCash provide deposit services by using pulses XL and Telkomsel https://t.co/rniWjtHAMQ #youbetcash https://t.co/ZSBVTLHcsK"
128,2020-12-20 18:05:24 SE Asia Standard Time,1149170372870205441,ekbisbanten,Produk dan Inovasi Layanan Telkomsel Jadi Pilihan Masyarakat Indonesia    https://t.co/5sFUmdw5FB,Product and Service Innovation Society Picks Indonesia Telkomsel So https://t.co/5sFUmdw5FB
129,2020-12-20 16:48:04 SE Asia Standard Time,1339823765115424768,murahdeposit,"Judi Jackpot Online Terpercaya  Seiring kemajuan teknologi di Indonesia yang berkembang sangat pesat, saat ini YoubetCash menyediakan layanan deposit dengan menggunakan pulsa XL dan Telkomsel    https://t.co/TocCtBNZfl #youbetcash  https://t.co/3AR6ZRIu6C","Trusted Online Gambling Jackpot As technology advances in Indonesia that is growing very rapidly, this time YoubetCash provide deposit services by using pulses XL and Telkomsel https://t.co/TocCtBNZfl #youbetcash https://t.co/3AR6ZRIu6C"
130,2020-12-20 15:04:36 SE Asia Standard Time,1339950866996969476,freebetagen,"Situs Agen Habanero Mudah Menang  Seiring kemajuan teknologi di Indonesia yang berkembang sangat pesat, saat ini YoubetCash menyediakan layanan deposit dengan menggunakan pulsa XL dan Telkomsel    https://t.co/vCdsrutlUL #youbetcash  https://t.co/DvxFajpHnr","Site Agent Habanero Win Easy As technology advances in Indonesia that is growing very rapidly, this time YoubetCash provide deposit services by using pulses XL and Telkomsel https://t.co/vCdsrutlUL #youbetcash https://t.co/DvxFajpHnr"
131,2020-12-20 14:48:29 SE Asia Standard Time,1339823765115424768,murahdeposit,"Game Agen Habanero Berhadiah Pulsa  Seiring kemajuan teknologi di Indonesia yang berkembang sangat pesat, saat ini YoubetCash menyediakan layanan deposit dengan menggunakan pulsa XL dan Telkomsel    https://t.co/yQOWx9a4el #youbetcash  https://t.co/6vQp6OeES1","Game Agent Toll Habanero Prizes As technology advances in Indonesia that is growing very rapidly, this time YoubetCash provide deposit services by using pulses XL and Telkomsel https://t.co/yQOWx9a4el #youbetcash https://t.co/6vQp6OeES1"
132,2020-12-20 13:55:23 SE Asia Standard Time,78590632,vrizaa,"@Telkomsel kak mau tanya hal lain kk,boleh?belakangan ini saya sering dapat sms seperti ini, padahal saya ga pernah registrasi layanan apapun kecuali paket di my telkomsel, saya takut begitu isi pulsa malah kepotong dengan layanan ini!!!  https://t.co/uw983vYSWo","Kak @Telkomsel kk want to ask another thing, OK? Lately I often can sms like this, when I'm not ever register any services except the package in my Telkomsel, I'm afraid so instead kepotong pulse content with these services !!! https://t.co/uw983vYSWo"
133,2020-12-20 13:33:45 SE Asia Standard Time,1339959469896167427,judi_terbaik,"Agen Pragmatic Game Online Terpercaya  Seiring kemajuan teknologi di Indonesia yang berkembang sangat pesat, saat ini YoubetCash menyediakan layanan deposit dengan menggunakan pulsa XL dan Telkomsel.  https://t.co/k4OjLFc127  #youbetcash #slot #playtech #SG #PP #IDN #IDNLive  https://t.co/4HjJwDjcKA","Pragmatic Agent Trusted Online Game As technology advances in Indonesia that is growing very rapidly, this time YoubetCash provide deposit services by using pulses XL and Telkomsel. https://t.co/k4OjLFc127 #youbetcash #slot #playtech #SG #PP #IDN #IDNLive https://t.co/4HjJwDjcKA"
134,2020-12-20 13:00:44 SE Asia Standard Time,874806124146434048,puspadaryanavvv,@Telkomsel Saya telah bertahun2 menggunakan layanan Anda.,Bertahun2 @Telkomsel I have used your services.
135,2020-12-20 12:31:52 SE Asia Standard Time,1339823765115424768,murahdeposit,"Daftar Agen Habanero Online Terbaru  Seiring kemajuan teknologi di Indonesia yang berkembang sangat pesat, saat ini YoubetCash menyediakan layanan deposit dengan menggunakan pulsa XL dan Telkomsel    https://t.co/TocCtBNZfl #youbetcash  https://t.co/sDFAEfXTyh","List Agent Habanero Latest Online As technology advances in Indonesia that is growing very rapidly, this time YoubetCash provide deposit services by using pulses XL and Telkomsel https://t.co/TocCtBNZfl #youbetcash https://t.co/sDFAEfXTyh"
136,2020-12-20 09:07:35 SE Asia Standard Time,173769133,15_ahmady,@Telkomsel jaringan telkomsel lagi ada peningkatan layanan yah,Telkomsel network @Telkomsel again no increase in service well
137,2020-12-19 21:01:06 SE Asia Standard Time,3271056108,info_nanggroe,"DLHK3 Banda Aceh : Sosialisasi Kebersihan dan Informasi layanan Lingkungan Sistem Digital, DLHK3 Gandeng Telkomsel  https://t.co/0efE9SfX5z","DLHK3 Banda Aceh: Socializing Hygiene and Environment Service Information Digital Systems, DLHK3 Cooperate with Telkomsel https://t.co/0efE9SfX5z"
138,2020-12-19 20:27:56 SE Asia Standard Time,620977821,halobca,"@ignativsryan (individu dan perusahaan) Rupiah - BCA Dollar Provider yang bisa didaftarkan yaitu Telkomsel, Indosat, XL, 3, Smartfren Dokumen yang diperlukan untuk pendaftaran, perubahan, dan penutupan layanan Push Notification di cabang : 1. Kartu identitas (3/8) ^wandi","@ignativsryan (individuals and companies) Rupiah - BCA Dollar Provider that can be registered, namely Telkomsel, Indosat, XL, 3, Smartfren Documents required for registration, changes, and closing Push Notification service in branches: 1. The identity card (3/8) ^ wandi"
139,2020-12-19 20:25:35 SE Asia Standard Time,620977821,halobca,"@ignativsryan (individu dan perusahaan) Rupiah - BCA Dollar Provider yang bisa didaftarkan yaitu Telkomsel, Indosat, XL, 3, Smartfren Dokumen yang diperlukan untuk pendaftaran, perubahan, dan penutupan layanan Push Notification di cabang : 1. Kartu identitas asli (3/7) ^Adin","@ignativsryan (individuals and companies) Rupiah - BCA Dollar Provider that can be registered, namely Telkomsel, Indosat, XL, 3, Smartfren Documents required for registration, changes, and closing Push Notification service in branches: 1. the original identity card (3/7 ) ^ Adin"
140,2020-12-19 19:16:36 SE Asia Standard Time,260562153,rzbzr,"Min @Telkomsel, Grapari Depok besok minggu buka gak? Masih ada layanan beli nomor customized gak? terima kasih kalau jawab Min","Min @Telkomsel, Depok Grapari not open tomorrow week? There are still a number of customized purchasing services do not? thanks if liable Min"
141,2020-12-19 18:01:53 SE Asia Standard Time,1075673058931806208,indihome,"@aldoajiprbw Hai, Kak Aldo. Maaf ya, tapi biar bisa dicek lebih lanjut koneksi jaringan IndiHome-nya, coba deh informasikan dulu nomor layanan internet/telepon-nya di DM. Kalau buat laporan providernya akan dibantu oleh rekan kami di akun  @Telkomsel ya. -Joro","@aldoajiprbw Hi, brother Aldo. Excuse me, but let me be checked more IndiHome its network connection, try deh first inform the internet service number / phone her at DM. If for providernya report will be assisted by our colleagues in the account @Telkomsel yes. -Joro"
142,2020-12-19 18:01:03 SE Asia Standard Time,93011500,djoeee__,"8 thn pke @Telkomsel baru kali ini pulsa di bobol tanpa otorisasi dari saya, lah kok bisa? Sdh complain dan dpt no. tiket pengaduan, stlh 72 jam FU keluhan ke Grapari Telkomsel dgn gmpgnya case close tanpa ada solusi &amp; tanggung jawab. Emg pulsanya tdk sbrp tp layanan BURUK BANGET","8 yrs pke new @Telkomsel this time pulses in collapse without authorization from me, was how come? Sdh complain and retrievable no. complaints ticket, 72 hours FU timeout complaint to Grapari Telkomsel with gmpgnya case closed without any solution & amp; responsible. Emg pulse tp morbidly sbrp SO BAD service"
143,2020-12-19 17:46:11 SE Asia Standard Time,925213658,alfynt12,@Telkomsel min mau tanya kenapa tiba tiba kartu saya hanya panggilan darurat dan tidak ada layanan padahal sebelumnya baik baik saja.,@Telkomsel min suddenly want to ask why my card only emergency calls and no service whereas before alright.
144,2020-12-19 13:24:40 SE Asia Standard Time,297400127,perdhevi,@TelkomCare saya baru tahu kalau 147 layanan premium jika ditelpon dari @Telkomsel,@TelkomCare I just found out that 147 of the premium services if ditelpon of @Telkomsel
145,2020-12-19 12:57:23 SE Asia Standard Time,1339823765115424768,murahdeposit,"Judi Jackpot Online Terpercaya  Seiring kemajuan teknologi di Indonesia yang berkembang sangat pesat, saat ini YoubetCash menyediakan layanan deposit dengan menggunakan pulsa XL dan Telkomsel    https://t.co/gLuhYZLnbk #youbetcash  https://t.co/lnlLiOsI7y","Trusted Online Gambling Jackpot As technology advances in Indonesia that is growing very rapidly, this time YoubetCash provide deposit services by using pulses XL and Telkomsel https://t.co/gLuhYZLnbk #youbetcash https://t.co/lnlLiOsI7y"
146,2020-12-19 12:30:10 SE Asia Standard Time,589243532,rzkyspryd,ini peningkatan layanan sampe kapan si @Telkomsel sinyal ente lemot parah🙂,This increase in service until when the signal @Telkomsel ente slow parah🙂
147,2020-12-19 12:27:55 SE Asia Standard Time,1339950866996969476,freebetagen,"Semua Situs Agen Habanero  Seiring kemajuan teknologi di Indonesia yang berkembang sangat pesat, saat ini YoubetCash menyediakan layanan deposit dengan menggunakan pulsa XL dan Telkomsel    https://t.co/heLIhBd5P5 #youbetcash  https://t.co/z4WpvAauxj","All Sites Habanero As technology advances Agents in Indonesia that is growing very rapidly, this time YoubetCash provide deposit services by using pulses XL and Telkomsel https://t.co/heLIhBd5P5 #youbetcash https://t.co/z4WpvAauxj"
148,2020-12-19 12:09:52 SE Asia Standard Time,1222344615677714433,myorbitid,"@fuadfauzi @Telkomsel Hai, mohon maaf atas ketidaknyamanannya. Aplikasi kami masih terus dikembangkan untuk meningkatkan kualitas layanan Telkomsel Orbit. Pastikan aplikasi Anda adalah aplikasi yang ter-update, ya. Terima kasih.","@fuadfauzi @Telkomsel Hi, sorry for the inconvenience. Our application is still being developed to improve the quality of service Telkomsel Orbit. Make sure your application is an application that was updated, yes. Thank you."
149,2020-12-19 10:48:02 SE Asia Standard Time,1075673058931806208,indihome,"@azzamff @Telkomsel Hai Kak Azzam, apakah hanya aplikasi whatsapp saja yang tidak bisa? aplikasi lain bagaimana? dan apakah nomor layanan yang digunakan di nomor yang belakangnya 91? ditunggu konfirmasinya via DM ya, guna di bantu tindaklanjuti.  -Zulfa","@azzamff @Telkomsel Hi Kak Azzam, if only application whatsapp who can not? Another application how? and whether the number of services used at the numbers behind it 91? awaited confirmation via DM yes, in order to follow up on aid. -Zulfa"
150,2020-12-19 09:15:38 SE Asia Standard Time,1213751689141837824,carollinegeby,"Saldo Bank Lagi Kosong? Deposit Via Pulsa Saja Di Mejaoke,net Tersedia Layanan Deposit Via Pulsa Telkomsel  Contct info :  Line : Mejaqq_official Whatsapp : +855882308459  #AgenBandarQOnline #BandarQOnline #AgenBandarQ #Mejaoke #MEJAQQ  https://t.co/RSAQNMZwJO","Again Blank Bank Balance? Deposit Via Toll Only In Mejaoke, net Available Via Toll Telkomsel Deposit Service contct info: Line: Mejaqq_official Whatsapp: +855882308459 #AgenBandarQOnline #BandarQOnline #AgenBandarQ #Mejaoke #MEJAQQ https://t.co/RSAQNMZwJO"
151,2020-12-19 09:15:35 SE Asia Standard Time,1213670352380809216,jessica47644448,"Saldo Bank Lagi Kosong?  Deposit Via Pulsa Saja Di Mejaoke,net  Tersedia Layanan Deposit Via Pulsa Telkomsel   Contct info :  Line : Mejaqq_official  Whatsapp : +855882308459   #AgenBandarQOnline #BandarQOnline #AgenBandarQ #Mejaoke #MEJAQQ  https://t.co/QQTbKKYOCz","Again Blank Bank Balance? Deposit Via Toll Only In Mejaoke, net Available Via Toll Telkomsel Deposit Service contct info: Line: Mejaqq_official Whatsapp: +855882308459 #AgenBandarQOnline #BandarQOnline #AgenBandarQ #Mejaoke #MEJAQQ https://t.co/QQTbKKYOCz"
152,2020-12-19 08:55:52 SE Asia Standard Time,1293880136631111685,mariona7016,WOY INI LAYANAN INDIHOME GW KENAPA AKSES INSTAGRAM GAK BISA TAPI PAKAI PAKET DATA SIMPATI TELKOMSEL AKSES INSTAGRAM BISA ?!!! @IndiHome,Woy WHY THIS SERVICE ACCESS INDIHOME GW Instagram GAK BUT CAN USE PACKET DATA ACCESS SYMPATHY TELKOMSEL CAN Instagram? !!! @IndiHome
153,2020-12-19 00:03:08 SE Asia Standard Time,825288571418316801,takeawaydinein,"@Telkomsel kalau nomer telkomselnya tidak ada layanan, mungkin karena lupa mengisi pulsa untuk memperpanjang masa tenggang. Apakah bisa diaktifkan ke grapari lagi ?","@Telkomsel if the number telkomselnya no service, probably because of missing a pulse to extend the grace period. Can it be switched to GraPARI again?"
154,2020-12-18 22:54:42 SE Asia Standard Time,1075673058931806208,indihome,"@penunggukabar @Telkomsel Malam Kak, maaf atas kendalanya. Enaknya Rezky panggil apa nih ? jika dirasa ada kendala pada layanan IndiHome-nya, guna dilakukan pengecekan lebih lanjut serta tetap menjaga keamanan dan privasi data. Bisa diinformasikan terlebih dahulu nomor internet, a(1/2)","@penunggukabar @Telkomsel Night Sister, sorry for the obstacles. Ease Rezky What is this call? if it is felt there is a constraint on IndiHome its services, in order to do further checking and maintaining the security and privacy of data. Can be informed in advance Internet number, a (1/2)"
155,2020-12-18 21:12:30 SE Asia Standard Time,310304969,usmangintingjk,@Telkomsel sedang mempersembahkan layanan sampahnya selama vandemi covid ini.  Audah berkali kali dilaporkan. Ga pernah berubah..  Naikan tarifmu.. Biar puas kau..  Layanan jelekt Tarif mahal,@Telkomsel were offering their garbage service during this covid vandemi. Ouda repeatedly reported. Ga never change .. Raise your rate .. I'll settle for you .. Service jelekt Rates costly
156,2020-12-18 20:54:12 SE Asia Standard Time,310304969,usmangintingjk,Signal terbaik dari @Telkomsel persis kayak layanann perusahaaan sampah   Tarif mahal layanan taik,Signal @Telkomsel exactly like the best of rubbish Rates layanann expensive services firms taik
157,2020-12-18 20:18:02 SE Asia Standard Time,1222344615677714433,myorbitid,"@bagoes_elang @Viarielz Baik, dapat kami informasikan, untuk memaksimalkan layanan kami, penggunaan Telkomsel Orbit saat ini hanya bisa menggunakan kartu SIM yang sudah menjadi satu dengan modem ya. Terima kasih.","@bagoes_elang @Viarielz Well, we can inform you, to maximize our services, use Orbit Telkomsel currently can only use a SIM card that has become one with the modem yes. Thank you."
158,2020-12-18 19:36:10 SE Asia Standard Time,78763157,sandy_adi,@Telkomsel layanan ini masih valid ?  https://t.co/GAI8e2TC2R,@Telkomsel service is still valid? https://t.co/GAI8e2TC2R
159,2020-12-18 19:35:19 SE Asia Standard Time,78763157,sandy_adi,@Telkomsel apakah ada layanan pesan antar beli kartu pra bayar secara online?,@Telkomsel if no service messages between a prepaid card to buy online?
160,2020-12-18 19:30:02 SE Asia Standard Time,30617522,wartaekonomi,"Jelang Nataru, Telkomsel Prediksi Trafik Layanan Data Meningkat 10,19 Persen  https://t.co/id6xeUaWNR","Coming Nataru, Telkomsel Prediction Data Service Traffic Rises 10.19 Percent https://t.co/id6xeUaWNR"
161,2020-12-18 18:24:00 SE Asia Standard Time,1031843995,nona_abuabu,"@CharleS_PW @Telkomsel Emang mifi kaka locked by telkomsel aja ya? Wah aku pikir dengan  reputasi telkomsel yg waw itu, layanan mifi nya bagus..",Weve @Telkomsel @CharleS_PW MiFi kaka locked by Telkomsel wrote it? Gee I think with that waw telkomsel reputation that its MiFi good service ..
162,2020-12-18 15:54:48 SE Asia Standard Time,1054724988316643328,bramantya_l,@Telkomsel saya sudah 2 hari di Bali sinyalnya sama sekali kosong? Indikator LTE menyala tetapi sama sekali tidak ada koneksi.  Butuh penjelasan dan kompensasi dr Telkomsel. Saya &amp; istri pelanggan setia. Layanan kurang tapi tagihan tak boleh kurang. Kita byr 500rban/bln.,@Telkomsel I had 2 days in Bali signal is completely empty? LTE indicator lights up but there is absolutely no connection. Need an explanation and compensation dr Telkomsel. I & amp; wife of loyal customers. Service was lacking but the bill should not be less. We BYR 500rban / mo.
163,2020-12-18 15:25:39 SE Asia Standard Time,1339207998665760768,bonusterbaru,"Slot Pragmatic Via Pulsa Tanpa Potongan  Seiring kemajuan teknologi di Indonesia yang berkembang sangat pesat, saat ini YoubetCash menyediakan layanan deposit dengan menggunakan pulsa XL dan Telkomsel.  https://t.co/cIqZs2COA7  #youbetcash #slot #playtech #SG #PP #IDN #IDNLive  https://t.co/vUCyJDY5km","Slot Pragmatic Via Toll Without Pieces As technology advances in Indonesia that is growing very rapidly, this time YoubetCash provide deposit services by using pulses XL and Telkomsel. https://t.co/cIqZs2COA7 #youbetcash #slot #playtech #SG #PP #IDN #IDNLive https://t.co/vUCyJDY5km"
164,2020-12-18 14:12:55 SE Asia Standard Time,620977821,halobca,"@Rositakim97 Kami infokan operator yang dapat digunakan dalam layanan : m-BCA STK  : XL, Telkomsel dan Indosat BCA mobile : XL, Telkomsel, Indosat, Axis dan Three  :) Tks ^Ita","@ Rositakim97 We infokan operators that can be used in the service: m-BCA STK: XL, Telkomsel and Indosat mobile BCA: XL, Telkomsel, Indosat, Axis and Three :) Tks ^ Ita"
165,2020-12-18 13:52:33 SE Asia Standard Time,1339207998665760768,bonusterbaru,"Agen Habanero Pulsa Online  Seiring kemajuan teknologi di Indonesia yang berkembang sangat pesat, saat ini YoubetCash menyediakan layanan deposit dengan menggunakan pulsa XL dan Telkomsel.  https://t.co/QvkSlCUDlk  #youbetcash #slot #playtech #SG #PP #IDN #IDNLive #IDNPlay  https://t.co/tkSBlPQVkb","Habanero Agent Toll Online As technology advances in Indonesia that is growing very rapidly, this time YoubetCash provide deposit services by using pulses XL and Telkomsel. https://t.co/QvkSlCUDlk #youbetcash #slot #playtech #SG #PP #IDN #IDNLive #IDNPlay https://t.co/tkSBlPQVkb"
166,2020-12-18 13:24:06 SE Asia Standard Time,1075673058931806208,indihome,"@Anggoro_Irvan_S @DisneyPlusID Maaf, Kak Anggoro. Tara informasikan saat ini untuk Disney+ Hotstar belum bekerja sama dengan layanan kami. Namun, untuk berlangganannya Kakak bisa menggunakan provider @Telkomsel ya. Terima kasih -Tara","@Anggoro_Irvan_S @DisneyPlusID Sorry, brother Anggoro. Tara informed today for Disney + Hotstar not cooperate with our services. However, for the subscription brother could use a provider @Telkomsel yes. Thanks -Tara"
