,created_at,user_id,username,tweet,english
1017,2021-05-23 13:30:14 SE Asia Standard Time,41358712,ayupermata,Bisa yaaa di kota Bogor hilang sinyal. 😤😤😤 @Telkomsel katanya jaringan berkelas?,Can yaaa in Bogor city lost the signal. 😤😤😤 @Telkomsel said network classy?
1018,2021-05-23 12:28:47 SE Asia Standard Time,1138751962298458113,didispearbin,"@jojoobaaoil @Telkomsel Bener, jaringan telkomsel aku udah 4 harian ga lancar, semoga cepat di tindak lanjuti yah sel yah. Dah cukup sabar kami nih 😭😭😭","@jojoobaaoil @Telkomsel Bener, Telkomsel network I've already 4 ga day smoothly, hopefully quickly followed up yah yah cells. Dah patient enough we nih 😭😭😭"
1019,2021-05-23 12:24:45 SE Asia Standard Time,1140589246085914624,parjodick,"Tolong banget @Telkomsel  udah 2 hari gangguan ga bisa ngapa ngapain, mulai dari restart jaringan sampai hp nya direstart juga ga bisa bisa,","Can you really @Telkomsel already 2 days of disruption can not Ngapa doing, ranging from restarting its network until the phone also can not be restarted,"
1020,2021-05-23 12:15:18 SE Asia Standard Time,1057207359796260864,hitamoriginal,Mau tanya bagi yang pake kartu telkomsel. Apa bener akhir-akhir ini jaringan kalian bagus sampe 5bar full tapi sped nya buka gambar distory wasap pun nunggu 3mnt dulu.,Would like to ask those who use Telkomsel card. What Bener recently 5bar network until you nice but sped its full open distory picture was waiting 3mnt WASAP first.
1021,2021-05-23 12:08:02 SE Asia Standard Time,1192221470887313408,anjani25jk,"""telkomsel"" jaringan nya ngajak ribut mulu lih udah mau sebulan ""lemot"" 😭","""Telkomsel"" invites its network noisier like a month already mulu cf. ""slow"" 😭"
1022,2021-05-23 11:49:45 SE Asia Standard Time,1138751962298458113,didispearbin,@Telkomsel uda hampir 4 harian jaringan telkomsel ga jalan. Kenapa nih? Beli mahal2 percuma ga bisa dipakek. Telkomsel lagi down kah? Atau kenapa? Mohon cepat diperbaiki yahh. Kami yg daring susah nih jadinya ga pernah bisa masuk tepat waktu.,Uda almost daily @Telkomsel 4 ga telkomsel road network. Why did ya? Buy mahal2 useless can not dipakek. Telkomsel again down kah? Or why? We quickly corrected yahh. Our online that hard ya ga could never get finished on time.
1023,2021-05-23 11:20:00 SE Asia Standard Time,1299879815022088195,czxtrem,"@Telkomsel Bubarkan, kasih frekuensi ke swasta, bumn rata2 gk ngotak, malak duit iya, tapi kualitas 0 besar, akibat korupsi, udah kayak preman pasar anying, liat aja bpjs data bocor, telkomsel kualitas jaringan ancur, bri duit nasabah ilang, parah2.","@Telkomsel Disband, love frequencies to private, gk rata2 bumn ngotak, malak money yes, but great quality 0, because of corruption, because I'm like a thug market Anying, watch as BPJS of data leak, telkomsel ancur network quality, customer money bri ilang, parah2."
1024,2021-05-23 11:14:30 SE Asia Standard Time,1299879815022088195,czxtrem,"@Telkomsel Alah gaya 5G anying, ini 4G aja banyak yg ngeluh, jaringan kek siput, lelet, bubarkan telkomsel anying, profit gede, service 0 besar, keluhan pelanggan, di jawab cuma pake template anying, dugaan gw, telkomsel cuma jadi sapi perah pejabat, gk pernah di audit, bubarkan!!!","Alah @Telkomsel 5G style Anying, this 4G wrote many who lament, kek network snails, slow, disperse telkomsel Anying, big profit, service 0 is great, customer complaints, in charge just use the template Anying, the alleged gw, telkomsel just so the official dairy cows , gk been audited, dismiss !!!"
1025,2021-05-23 11:10:43 SE Asia Standard Time,547474271,ariesdianaan,Jaringan @Telkomsel kamu kenapa? Kok akhir² ini suka ngilang terus kek pakboi.,Network @Telkomsel you know why? This akhir² Kok like ngilang continue kek pakboi.
1026,2021-05-23 10:16:33 SE Asia Standard Time,2263988664,angelputri1997,Kecewa banget dengan jaringan telkomsel beberapa hari belakangan ini,Really disappointed with Telkomsel network last few days
1027,2021-05-23 10:08:27 SE Asia Standard Time,993294221183410177,alibsday,"Pengen ganti kartu tapi dirumah jaringan yang bagus cm indosat, telkomsel aja suka ilang","Want to replace the card but a nice home network cm Indosat, Telkomsel just like ilang"
1028,2021-05-23 09:56:31 SE Asia Standard Time,753914881926049792,jasujanbiru,"@Telkomsel Oke.jd begini aku di bln maret ngirim email ke cs@telkomsel.co.id eh sampai sekarang nggk ad balasan.ya heran aja kan,ini tentang layanan jaringan internet pd paket combo. Cuman sekarang udh bln mei, keluhannya udh lewat.Tapi mau nanya aja emailnya yg itu masih aktif nggak?","I like this Oke.jd @Telkomsel in March bln sent me a mail to cs@telkomsel.co.id eh until now nggk ad balasan.ya wonder wrote it, it's about internet network service pd combo package. Cuman now UDH bln mei, the complaint UDH lewat.Tapi want to ask just email which was still active not?"
1029,2021-05-23 09:48:54 SE Asia Standard Time,135815019,detikinet,Telkomsel bakal mengkomersialisasikan layanan 5G pada akhir Mei ini. Jaringan 5G ini sebelumnya sudah hadir di banyak negara lain. Di mana yang paling kencang?  https://t.co/pfB4O6geWr,Telkomsel will commercialize 5G service by the end of this May. 5G network is already present in many other countries. Where is the fastest? https://t.co/pfB4O6geWr
1030,2021-05-23 09:45:27 SE Asia Standard Time,1059223440773660672,kudaponipink_,@Telkomsel ini kenapa jaringan lemot banget sejak lebaran???,This @Telkomsel why very slow network since Eid ???
1031,2021-05-23 09:42:09 SE Asia Standard Time,1175412917354631169,yhndylvly,telkomsel &amp; firstmedia nolep bgt ..  rusak barengan... apaan dah.. jaringan lemot bener,Telkomsel & amp; Firstmedia nolep bgt .. broken unison ... fuck slow network bener dah ..
1032,2021-05-23 09:37:07 SE Asia Standard Time,233158855,vhyandaan,"@Telkomsel ini kerja apa eew,,sampai saat ini jaringan di jayapura kok blum ada perkembangan sdh 22 hari lho","This @Telkomsel what eew ,, work to date in Jayapura why Blum network developments 22 days SDH know"
1033,2021-05-23 09:10:12 SE Asia Standard Time,1323090359581200385,alva47831808,Pertanian didukung jaringan data internet... Penguatan jaringan 4G di pelosok Indonesia ? 🤔 CC @budimandjatmiko @VeritasArdentur @Telkomsel @TelkomIndonesia @kemkominfo @brin_indonesia @Kemdikbud_RI @kemenkomarves @jokowi,Internet data network supported agriculture ... Strengthening the 4G network in parts of Indonesia? CC 🤔 @budimandjatmiko @VeritasArdentur @Telkomsel @TelkomIndonesia @kemkominfo @brin_indonesia @Kemdikbud_RI @kemenkomarves @jokowi
1034,2021-05-23 09:00:13 SE Asia Standard Time,1318758263907786752,notreal_dispet,@wonpillc Beli voucher telkomsel nih 2 gk bisa ke pake jaringan sibuk,@wonpillc Buy voucher telkomsel ya 2 gk be to use the network is busy
1035,2021-05-23 08:44:11 SE Asia Standard Time,561738238,bestalk_,Kenapa ya @Telkomsel jaringan jadi lemot banget 😪😪😪,Why is it so slow buildup network @Telkomsel 😪😪😪
1036,2021-05-23 07:53:38 SE Asia Standard Time,266482871,edo_aja,"Fyi @Telkomsel Sepeti nya signal.dan jaringan belum begitu baik. Ada 4G nya tapi tdk begitu kuat. Hanyabdi beberapa titik di daerah tertentu. Zoom tdk bisa, googling tidak bisa begitu juga youtube. Wa hanya text saja.","Fyi its @Telkomsel Crate signal.dan network has not been so good. There 4G but not very strong. Hanyabdi some point in a given area. Zoom can not, can not be so well googling youtube. Wa just text alone."
1037,2021-05-23 07:53:37 SE Asia Standard Time,266482871,edo_aja,Fyi @Telkomsel jaringan terganggu dr Sentani sampai Jayapura.,Fyi @Telkomsel uninterrupted network dr Sentani to Jayapura.
1038,2021-05-23 07:40:57 SE Asia Standard Time,267531063,aimpaimin,"@Telkomsel Sudah satu tahun lebih jaringan tidak stabil, disekitar daerah sini desa Deles, Sidorejo, Kemalang , Klaten yg Deket dengan tower tp tidak bisa digunakan jaringannya walaupun ada tulisan 4g, admin bisa konfirmasi Sama masyarakat sini","It's been more than a year @Telkomsel network is not stable, Deles village in the area around here, Sidorejo, Kemalang, Klaten who Deket with tower tp can not use the network even though no writing 4g, admin can confirm here Same community"
1039,2021-05-23 07:40:38 SE Asia Standard Time,1318758263907786752,notreal_dispet,"@Telkomsel  Hallo kak aku beli voucher 2 dan baru di buka kemaren pas hari raya gk bisa masuk ya bilangnya maaf sedang sibuk, kupikir krn hari raya makanya jaringan jelek. Akhirnya ku simpen trus mau di gunakan ini ttp maaf,  jaringan sedang sibuk trus ini gimana yakkk. Rugi donk","Hallo @Telkomsel kak i bought 2 and a new voucher in open fitting yesterday feast could get ya gk bilangnya sorry was busy, I think krn feast network so ugly. Simpen then finally I want to use this in ttp sorry, this network is busy then how yakkk. loss donk"
1040,2021-05-23 05:30:18 SE Asia Standard Time,335095813,beni230,Sepertinya @Telkomsel tidak butuh pelanggan lagi sudah call 188  Masalah sinya hilang total di semua jaringan sudah 3 hari tidak di benerin,It seems @Telkomsel not need more customers already call 188 sinya problem disappeared completely in all 3 days the network is not in benerin
1041,2021-05-23 00:04:25 SE Asia Standard Time,2988989652,potongxx,"Jaringan xl ilang2an. Iseng data seluler ke sim 1, eh ternyata telkomsel ada kuota 15gb wkwkwk","Ilang2an xl network. Fraudulent sim mobile data into one, eh telkomsel 15GB quota wkwkwk"
1042,2021-05-22 23:28:26 SE Asia Standard Time,435731188,bctceria,"Emang semua jaringan provider lagi down ya? Rek make kartu nanaon ge angger we tolol loading na teh~ Atau gara² telkomsel bakal nge resmiin 5G di tgl 27 mei... Jadi si 4G nya di asem in, paham nga? Biar kerasa 5Gnya~","Weve all network providers further down huh? RECs makeup nanaon card loading ge na Angger we fool tea ~ Or gara² telkomsel resmiin 5G will be jamming on 27th May ... So the 4G in tamarind in, understand nga? Let kerasa 5Gnya ~"
1043,2021-05-22 23:18:53 SE Asia Standard Time,433155402,shifaaa26,"@radenrauf jaringan 5G dapat menghubungkan miliaran perangkat dengan trade-off (pertukaran) yang tepat antara kecepatan, latensi, dan juga perasaan :) #telkomsel","@radenrauf 5G network can connect billions of devices with the trade-off (exchange) right between speed, latency, and also feeling :) #telkomsel"
1044,2021-05-22 23:00:03 SE Asia Standard Time,2820042608,simiss_20,@detikcom tolong telkomsel.. jaringan ke desa2 dulu diratain dooong WKWK,@detikcom .. please Telkomsel network to the first desa2 diratain dooong wkwk
1045,2021-05-22 22:42:58 SE Asia Standard Time,952141330494365696,butterrcatp,Pantes telkomsel lagi jelek ya jaringan nya,Pantes telkomsel more ugly yes its network
1046,2021-05-22 22:42:38 SE Asia Standard Time,2483400374,buah_getah,@Telkomsel Telkomsel bgst..jaringan kau hancur !!!!,Telkomsel @Telkomsel bgst..jaringan you ruined !!!!
1047,2021-05-22 22:29:09 SE Asia Standard Time,1256215424968122368,angga93263727,"@Telkomsel Udah berkali2 refresh mode jaringan sampe direstart mode sama hpnya, tiap menit berubah mulu LTE EDGE LTE EDGE, solusi secepatnya","Already @Telkomsel berkali2 refresh mode until the restart mode network at hpnya, every minute change mulu LTE LTE EDGE EDGE, a solution as soon as possible"
1048,2021-05-22 21:04:00 SE Asia Standard Time,1200733860767531008,blackonvalley,"@Alberto06Fans @secgron @BiLLYKHAERUDIN dari zaman si tifatul rezim sby yg ga setuju ada internet cepat, terus alhamdlullah 2014-2019 dapet menkominfo yg kompeten pernah nyebur di indosat sama telkomsel, terus skarang dapet bapak2 sarjana ekonomi yang ngurusin jaringan komputer, komunikasi alias ga sesuai jobdesk nya🤣","@ Alberto06Fans @secgron @BiLLYKHAERUDIN from the time the regime Tifatul sby ga agree that there is a fast internet, continue alhamdlullah 2014-2019 dapet competent Minister of Communication who never nyebur in the same Indosat Telkomsel, continue skarang dapet bapak2 economic ngurusin undergraduate computer networks, communications appropriate alias ga jobdesk nya🤣"
1049,2021-05-22 21:03:36 SE Asia Standard Time,79103930,kthsweetlove,@Telkomsel lagi ada gangguan jaringan ya? dari siang sampe sekarang sinyal 2 bar terus kadang cuman 3G bukan LTE meskipun lg di luar☺️,@Telkomsel again there are network interruptions huh? from noon until now signal 2 bar continues sometimes cuman 3G is not LTE though lg in luar☺️
1050,2021-05-22 20:56:36 SE Asia Standard Time,2261531773,anas_unyil,"Ini kenapa dengan jaringan #telkomsel @Telkomsel  Luemooot banget udah 5 hari ini Sangat amat lemot Sampe² Chat WA 15mnt yg lalu baru masuk sekarang, Buka #mytelkomsel aja Luuaaamaaaa bahkan lebih cepet pakai Operator xl bukanya  Ada apakah gerangan dirimu @Telkomsel","This is why the buildup Luemooot @Telkomsel #telkomsel network already 5 days Very very slow Sampe² Chat WA incoming 15mnt ago now, Open #mytelkomsel wrote Luuaaamaaaa even much faster wear xl been opened it There is whatsoever you @Telkomsel"
1051,2021-05-22 20:52:07 SE Asia Standard Time,1261149214001655809,futureyoga,@Telkomsel jaringan di Bengkulu Utara ada apa ya? Kok 4G tetapi lambat sekali 🙉 disappointing issue terutama for Halo member nih 🙈,@Telkomsel network in North Bengkulu there are what? Kok 4G but slow 🙉 disappointing issue especially for Halo member nih 🙈
1052,2021-05-22 20:48:04 SE Asia Standard Time,1153324980,lalachandra,Aneh jaringan sinyal lemot. Mau ke kantor telkomsel syarat banyak. Males. Orangnya yg kerja di telkomsel ganteng dan cantik tapi oneng,Strange slow signaling network. Want to office telkomsel terms lot. Lazy. His distinguished work in telkomsel cute and pretty but Oneng
1053,2021-05-22 20:39:04 SE Asia Standard Time,1943980316,ardiansyahhh_id,@tyaraga @shitlicious Mba-mba telkomsel jaringan saya gangguan nih...,@tyaraga @shitlicious-mba MBA network telkomsel I disorder ya ...
1054,2021-05-22 19:56:05 SE Asia Standard Time,452030144,bondaannn,"@Telkomsel tsel akhir akhir ini kenapa menurun kualitas jaringannya untuk daerah landasan ulin, banjarbaru. Tiap main game tiba2 ilang jaringan. Lagi video call juga tiba tiba ilang jaringan. Mohon info atau saya ngambek :(","TSEL @Telkomsel lately why declining quality of the network to the runway area ironwood, Banjarbaru. Each tiba2 ilang gaming network. Again the video call suddenly ilang network. Please info or my cranky :("
1055,2021-05-22 19:47:54 SE Asia Standard Time,1110203671793426432,hlmtssdh04,"Gila dari siang jaringan telkomsel gue down, jadi males main hp :)","Telkomsel network during the crazy of me down, so lazy play hp :)"
1056,2021-05-22 19:46:52 SE Asia Standard Time,714110153675550720,rahajeng52,@Telkomsel Selamat malam. Saya mau bertanya. Apakah telkomsel lagi ada gangguan jaringan? Kok di daerah rumah saya ngga ada sinyal ya untuk kartu tsel? Dirumah saya ada 3 orang yg pake tsel dan jaringan internetnya gabisa semua. Mohon info. Terima kasih,@Telkomsel Good evening. I want to ask. Is there another Telkomsel network disruption? Kok in my home area there are guns signal TSEL yes to the card? In my house there are 3 people who use TSEL and its Internet network gabisa all. Please info. thank you
1057,2021-05-22 19:39:15 SE Asia Standard Time,1098216318,homongkhoshong,Jaringan telkomsel gangguan ya??,Telkomsel network disruption ya ??
1058,2021-05-22 19:35:29 SE Asia Standard Time,1029203879940915200,gabriel74482683,@Telkomsel  apakah ini benar? jaringan 3G telkomsel akan dimatikan?  https://t.co/1weHw4mIiG,@Telkomsel is this true? Telkomsel's 3G network will be switched off? https://t.co/1weHw4mIiG
1059,2021-05-22 19:23:16 SE Asia Standard Time,166786123,gti_tm,Icon jaringan 4G+ tp lemotnya ky jaringan 3G ini gmn maksudnya @telkomsel ???,Icon 4G + tp lemotnya 3G network ky gmn @telkomsel mean ???
1060,2021-05-22 19:07:15 SE Asia Standard Time,837892904882335745,laksamkara,"Bro @kemkominfo , jangan buru2 bangun jaringan 5G ya, kasian @Telkomsel aja 4G nya belum bisa diandalin.. Para pelanggan ntar jd korban karna provider kewalahan fokusny kebagi antara 5G dan peningkatan 4G.. stabilisasi secara nasional aja dulu, yg di Papua juga komplain loh. Thx","@Kemkominfo bro, do not buru2 wake 5G network yes, kasian @Telkomsel wrote its 4G can not diandalin .. Customers ntar jd victims overwhelmed because fokusny provider kebagi between 5C and increased national 4G .. first wrote stabilization, which in Papua also complains loh. thx"
1061,2021-05-22 18:48:55 SE Asia Standard Time,163934892,jerry_roy,"Min @Telkomsel , jaringan 4G di wilayah kaltara, khususnya Malinau apakah ada kerusakan? Kualitasnya payah nih","Min @Telkomsel, kaltara 4G network in the region, particularly Malinau for damage? The quality is lousy nih"
1062,2021-05-22 18:31:09 SE Asia Standard Time,1177705561611071489,egiperdanaa7,@Telkomsel @Lukitaryan Buat saya kalah aja maen game beli kuota mahal tapi jaringan sangat jelek,@Telkomsel @Lukitaryan Make me lose just play games quota buy expensive but the network is very ugly
1063,2021-05-22 17:30:07 SE Asia Standard Time,76571715,andhikasatrya,"Paketan combo sakti unlimited skrg berubah ya ketentuannya? Kuota utama habis bukan dapat jaringan internet unlimited (wa, youtube, ig) malah dapat kuota pemakaian wajar yg begitu habis, internetnya lgsg lemot. Menurut saya bukan unlimited sih kalo sitstemnya kygini @Telkomsel","Unlimited magic combo packaged skrg change yes its provisions? The main quota runs out instead be unlimited internet network (wa, youtube, ig) could instead quota which is so depleted of fair use, internet lgsg slow. I think not unlimited heck if sitstemnya kygini @Telkomsel"
1064,2021-05-22 16:21:17 SE Asia Standard Time,101794755,pelasup,@Telkomsel Jika kendala sinyal @kartuhalo yang tidak lebih stabil daripada @simPATI bagaimana ya? Seringkali drop ke jaringan H+,@Telkomsel If constraints @kartuhalo signal that no more stable than @simPATI how ya? Often drop to network H +
1065,2021-05-22 16:10:29 SE Asia Standard Time,2780244378,oda_nobunaga07,@Askrlfess Dan telkomsel lagi nyoba jaringan 5G di indonesia,@Askrlfess And Telkomsel again tried 5G networks in Indonesia
1066,2021-05-22 16:00:11 SE Asia Standard Time,828503372969832448,borobudurnews_,"HORE !! Telkomsel Lulus ULO, Siap Pasarkan Jaringan 5G Di Indonesia  https://t.co/XgzRr28KmP","HOORAY !! Telkomsel Pass ULO, Ready to Give 5G networks in Indonesia https://t.co/XgzRr28KmP"
1067,2021-05-22 15:34:21 SE Asia Standard Time,1152928529190809603,kunfayaaakun,Tampilan baru jaringan telkomsel  https://t.co/SkDLD4qVUH,The new look Telkomsel network https://t.co/SkDLD4qVUH
1068,2021-05-22 15:05:35 SE Asia Standard Time,82268269,andinayu,Punya masalah hidup apasih Telkomsel ini si daerah Puncak? Jaringan mu sungguh sungguh~,Telkomsel has the problem of life's apasih the Puncak area? Mu Network earnest ~
1069,2021-05-22 15:03:03 SE Asia Standard Time,66158518,inno_wn,"@didikw @gadtorade Maaf, tepatnya Oppo A74 5G, karena ada juga Oppo A74 4G, yg ga support 5G. Dan semoga @OPPOIndonesia segera membuka kunci 5G-nya, sehingga bisa untuk mengakses jaringan 5G Telkomsel 🙏","@didikw @gadtorade Sorry, precisely Oppo A74 5G, because there is also Oppo A74 4G, 5G support yg ga. And hopefully @OPPOIndonesia 5G immediately unlock it, so they can access 5G Telkomsel network 🙏"
1070,2021-05-22 14:53:47 SE Asia Standard Time,811897280563290112,koranbumn,Telkomsel Selangkah Lagi Hadirkan Jaringan 5G  https://t.co/UIpBueHf7D @Telkomsel @TelkomIndonesia @kemkominfo,Telkomsel Step Again Presents 5G Network https://t.co/UIpBueHf7D @Telkomsel @TelkomIndonesia @kemkominfo
1071,2021-05-22 14:44:29 SE Asia Standard Time,141167520,llleakkk,"@Telkomsel min ini kenapa tiba² gak bisa akses disney+, cuma layar hitam &amp; icon loading. clear cache/data &amp; reinstall tetep gak bisa. coba pakai wifi/ operator lain di HP yg sama atau berbeda lancar. jaringan juga jelek bikin HP cepet panas","@Telkomsel min is why tiba² can not access disney +, just a black screen & amp; loading icon. clear cache / data & amp; tetep reinstall can not. try using wifi / other operators in the same or different HP smoothly. the network also makes HP cepet heat ugly"
1072,2021-05-22 14:40:34 SE Asia Standard Time,1256095974751039488,davinalorita,"Telkomsel lagi kenapa yak, aku udh beberapa kali dri kemaren tiba tiba anjlok jaringan ke H+. Tumben bgt min lemot. Ealah pas buka Twitter sama juga kendala nya sama yg lain. @Telkomsel","Telkomsel again why yak, I udh dri several times yesterday suddenly plunged into H + network. Tumben bgt min slow. Ealah fitting open his Twitter the same constraints at another. @Telkomsel"
1073,2021-05-22 14:14:53 SE Asia Standard Time,1668014683,cebiindrianto16,"@TetehMumu08 @Telkomsel Kadang sinyal full tapi jaringan internet lelet, mau lihat story wasap aja gabisa","@ TetehMumu08 @Telkomsel sometimes signal a full but slow internet network, want to see the story WASAP wrote gabisa"
1074,2021-05-22 14:12:31 SE Asia Standard Time,1200953714913071104,slthnn1,@Telkomsel jaringan ampas,@Telkomsel pulp tissue
1075,2021-05-22 13:09:19 SE Asia Standard Time,154102750,beritasatu,"Telkomsel Segera Layani Jaringan 5G, Ini Semua yang Perlu Anda Tahu   Klik  https://t.co/mkJIJ8Pz7F #5G","Telkomsel Serve immediately 5G Network, It's All You Need To Know Click https://t.co/mkJIJ8Pz7F # 5G"
1076,2021-05-22 12:51:27 SE Asia Standard Time,944653712332439552,jurnalpatrolin1,"Telkomsel Segera Layani Jaringan 5G, Ini Semua yang Perlu Anda Tahu  https://t.co/fNWcy0dgu5","Telkomsel Serve immediately 5G Network, It's All You Need to Know https://t.co/fNWcy0dgu5"
1077,2021-05-22 12:48:11 SE Asia Standard Time,1393551496831148036,fedlooff,"@s00gyuzr pls gw lagi dikampoeng, disini cuma ada jaringan telkomsel jdi gw hotspot dri papa 😩💔","@ S00gyuzr pls i again dikampoeng, here there is only Telkomsel network jdi hotspot gw dri papa 😩💔"
1078,2021-05-22 12:38:49 SE Asia Standard Time,2270388379,nagankri,"@detikcom Halahhh... jaringan 3G dan 4G @Telkomsel aja gak beres di daerah daerah ( kecamatan ) terutama di daerah kalimantan timur, konon mau 5G 🤣🤣. Benerin dulu kwalitas yg di daerah, hari hari gangguan macam da jadi kebiasaan aja 😂","@detikcom Halahhh ... 3G and 4G networks @Telkomsel wrote not settled in the region (sub-districts), especially in the area of ​​East Kalimantan, is said to want to 5G 🤣🤣. Benerin first distinguished quality in the area, the day a wide disruptions da habit wrote 😂"
1079,2021-05-22 12:28:52 SE Asia Standard Time,1126539036191932416,dannynasution,"@Telkomsel @Telkomsel bukan beberapa saat, tapi selama mati lampu Jaringan tetap down, Telkomsel punya generator atau tidak?","@Telkomsel @Telkomsel not a moment, but over the fixed network lights die down, Telkomsel had a generator or not?"
1080,2021-05-22 12:18:10 SE Asia Standard Time,76581610,gadtorade,"Kabarnya minggu depan tgl 27 Mei, Telkomsel sudah akan menggelar 5G nya secara komersial di BSD, PIK, Pondok Indah, Kelapa Gading, Widya Chandra, dan SCBD. Untuk mencoba jaringan 5G Telkomsel 2.3GHz ini tidak diperlukan ganti kartu SIM, cukup smartphone 5G dengan band n40  https://t.co/SVfJPtxmR1","Reportedly next week 27th of May, Telkomsel already will hold its 5G commercially in BSD, PIK, Pondok Indah, Kelapa Gading, Widya Chandra, and SCBD. To try Telkomsel 2.3GHz 5G network is not necessary change the SIM card, please smartphone N40 5G band https://t.co/SVfJPtxmR1"
1081,2021-05-22 12:13:37 SE Asia Standard Time,1292637997523853314,hilmannasir5,"Kenapa jaringan @Telkomsel semakin hari semakin buruk, nggak kaya dulu😤","Why @Telkomsel network is increasingly poor, not rich dulu😤"
1082,2021-05-22 12:12:37 SE Asia Standard Time,1126539036191932416,dannynasution,Kartu sultan @Telkomsel gk punya generator ya? Kok bisa setiap mati lampu jaringan langsung down.,@Telkomsel sultan card gk had a generator huh? How could any direct network lights die down.
1083,2021-05-22 11:00:52 SE Asia Standard Time,608834903,irvandevgan,Jaringan @Telkomsel lemot anjir,@Telkomsel slow network Anjir
1084,2021-05-22 10:49:05 SE Asia Standard Time,7.42079E+17,abdrhmd,"@Telkomsel Permasalhannya bukan di perangkat saya min, jaringan di sini emang susah, mungkin bisa ditindak lanjut.","@Telkomsel Permasalhannya not on my device min, here weve hard tissue, may be dealt with further."
1085,2021-05-22 10:33:32 SE Asia Standard Time,811897280563290112,koranbumn,Telkomsel Selangkah Lagi Hadirkan Jaringan 5G  https://t.co/2Cad0B7lsU,Telkomsel Step Again Presents 5G Network https://t.co/2Cad0B7lsU
1086,2021-05-22 10:12:51 SE Asia Standard Time,256005504,fakhrun07,Anyirrrr nih jaringan telkomsel nggak ada yang beres semuaa!!!!  MAHAL doang tapi JARINGAN LEMOT sekali dimana kepuasan pelanggannya ??? @Telkomsel @indihome,Anyirrrr ya Telkomsel network semuaa there's nothing wrong !!!! EXPENSIVE NETWORK slow doang but once where customer satisfaction ??? @Telkomsel @indihome
1087,2021-05-22 08:59:22 SE Asia Standard Time,636124873,ellatheresiia,"Indihome telkomsel bikin emosi, jaringan nya paraahh😡 @Telkomsel","Indihome telkomsel make emotion, his network paraahh😡 @Telkomsel"
1088,2021-05-22 07:27:25 SE Asia Standard Time,273768084,damarjuniarto,"Eh kelupaan, tadi mengapa saya bilang ""belum""?   Tentu saja ada dasar:  1. Kami rutin melakukan pemindaian internet di lapangan  2. Kami menerima hasil scan @netblocks tentang kondisi internet di jaringan Telkom dan Telkomsel di Jayapura dan Sentani sejak 30 April - 21 Mei 2021.  https://t.co/muCWruePOU","Eh forgetfulness, was why I say ""yet""? Of course there are basic: 1. We regularly scan the Internet in the field 2. We received the results of the scan @netblocks about internet network conditions Telkom and Telkomsel in Jayapura and Sentani since April 30 - 21 May 2021. https://t.co/ muCWruePOU"
