,created_at,user_id,username,tweet,english
491,2021-05-27 16:22:33 SE Asia Standard Time,174111079,naqiyyah_syam,Tahu enggak kalau hari ini Telkomsel launching perdana!  Telkomsel Resmi Jadi Operator Seluler Pertama yang Menggelar Jaringan 5G di Indonesia  #Telkomsel5G,You know what if today Telkomsel prime launching! Telkomsel Official So the First Mobile Operator Networks Deploying 5G in Indonesia # Telkomsel5G
492,2021-05-27 16:22:15 SE Asia Standard Time,4788045836,sekarerp,"@nadiafiishafira @Telkomsel Sekarang tuh apa2 dituntut serba cepat, pake jaringan 5G memudahkan segala urusan baik pekerjaan maupun urusan cinta aw #Telkomsel5G","@nadiafiishafira @Telkomsel Now tuh apa2 sued fast-paced, use 5G networks facilitate all matters of love affairs of both work and aw # Telkomsel5G"
493,2021-05-27 16:16:34 SE Asia Standard Time,101135460,dillahfara,"Jaringan 5G Telkomsel juga akan hadir di Solo, Medan, Balikpapan, Denpasar, Batam, Surabaya, Makassar Dan Bandung #Telkomsel5G  https://t.co/HHauqjmCwt","Telkomsel 5G network will also be present in Solo, Medan, Balikpapan, Denpasar, Batam, Surabaya, Makassar and Bandung # Telkomsel5G https://t.co/HHauqjmCwt"
494,2021-05-27 16:12:29 SE Asia Standard Time,1229673156597571585,dewiqqqqqd,"Yeyeyeye, seneng banget dengan hadirnya 5G. Selamat ya buat Telkomsel karena hari ini udah launching jaringan 5G-nya. #Telkomsel5G","Yeyeyeye, very happy with the presence of 5G. Congratulation for Telkomsel because today is already launching its 5G network. # Telkomsel5G"
495,2021-05-27 16:09:43 SE Asia Standard Time,989755568100294656,humanituorangg,eh ternyata 5G udah masuk ke Indonesia!?? wih keren banget @Telkomsel  bisa hadirin teknologi #Telkomsel5G ke indo. mantap deh udah bisa streaming tanpa takut gangguan jaringan ini mah &lt;3,eh 5G already entered into Indonesia! ?? wih cool can @Telkomsel technology # Telkomsel5G audience to indo. steady deh can already stream without fear of network disruption is mah & lt; 3
496,2021-05-27 16:06:56 SE Asia Standard Time,869212592,_aaasiiiyaa,"@dayatpiliang Jaringan #Telkomsel5G chat grup kelas, meet up lewat zoom sekelas, enggk kebayang ramenya bernostalgia , ceg cengin dan ghibah lancar, maksudnya internetnya lancar. Enggk takut loading dan terputus tiba². Pokoknya ditunggu @Telkomsel #Telkomsel5G nya 👍. Silaturahmi tambah lancar","Network # Telkomsel5G @dayatpiliang class group chat, meet up through the zoom class, enggk imagine ramenya nostalgic, CEG cengin and backbiting smoothly, meaning internet smoothly. Enggk afraid loading and disconnected tiba². Anyway awaited his @Telkomsel # Telkomsel5G 👍. Gathering more smoothly"
497,2021-05-27 16:06:43 SE Asia Standard Time,1229673156597571585,dewiqqqqqd,"Buat Telkomsel, aku ucapin selamat ya. Selamat udah launching jaringan 5G-nya. Bakal lancar nih kalo streamingan apapun. #Telkomsel5G  https://t.co/kttHKLJFUi","Create Telkomsel, I ucapin congratulations. Congratulations already launching its 5G network. Streamingan going smoothly ya if any. # Telkomsel5G https://t.co/kttHKLJFUi"
498,2021-05-27 16:05:42 SE Asia Standard Time,486255446,fuadadamgandhi,@dayatpiliang Jaringan 4G aja udah joss gandoss. Apalagi jaringan 5G. Udah pasti semangat main media sosial karena jaringan ngebut banget pastinya. Joss gandoss emang telkomsel. Gak percuma 2 sim dua duanya  provider @Telkomsel yang joss gandoss. 👊👊👊👊👊 #Telkomsel5G,"The 4G network @dayatpiliang aja joss gandoss. Moreover, the 5G network. It's already certain spirit of social media play for speeding network really sure. Joss gandoss weve Telkomsel. Not useless 2 sim two @Telkomsel both the joss gandoss provider. 👊👊👊👊👊 # Telkomsel5G"
499,2021-05-27 16:04:54 SE Asia Standard Time,1229673156597571585,dewiqqqqqd,"Telkomsel dengan jaringan 5G makin nambah kelancaran jaringannya. Pakek 4G aja lancar, apalagi 5G nih. Asyik #Telkomsel5G  https://t.co/g7l2YL1xpi","Telkomsel with 5G networks increasingly add smoothness network. 4G pakek wrote smoothly, especially 5G ya. Fun # Telkomsel5G https://t.co/g7l2YL1xpi"
500,2021-05-27 16:04:43 SE Asia Standard Time,848830279,mildainibkl,"Dengan diterimanya surat ini, Telkomsel resmi menjadi operator seluler pertama yang menggelar jaringan 5G di Indonesia. #Telkomsel5G","With the receipt of this letter, the official Telkomsel became the first cellular operator to hold a 5G networks in Indonesia. # Telkomsel5G"
501,2021-05-27 16:03:36 SE Asia Standard Time,1377134338249134080,yoongie17,"Gokill kan! Jaringan 5G pertama lho ini di Indonesia, bangga banget sebagai pengguna setia Telkomsel dong pastinya! We're happy for you #Telkomsel5G ngebuutttttt banget dah","Gokill right! You know this first 5G network in Indonesia, very proud as loyal users of Telkomsel dong indeed! We're happy for you # Telkomsel5G ngebuutttttt really dah"
502,2021-05-27 16:02:52 SE Asia Standard Time,1376154712878157830,epras00,Wah sebagai anak kuliah yg daring terus aku bahagia sekali dengan pencapaian Telkomsel yang punya jaringan 5G pertama!! Berasa ngebut banget dah pasti ntar kalo ngedrakor wkwkw #Telkomsel5G,Wah as an online college kid who keeps me happy at all with the achievement of Telkomsel has first 5G network !! Speeding taste really dah definitely ntar if ngedrakor wkwkw # Telkomsel5G
503,2021-05-27 16:02:44 SE Asia Standard Time,1375786781602312194,soleh_soul,"Hari ini akhirnya Telkomsel launching jaringan 5G. Waaa makin girang aku, jaringan makin lancar. #Telkomsel5G  https://t.co/LlrdIQUDCk","Today finally Telkomsel launch 5G network. Waaa the more excited I am, the easier the network. # Telkomsel5G https://t.co/LlrdIQUDCk"
504,2021-05-27 16:02:35 SE Asia Standard Time,68358088,krosmala_,FYI masyarakatku. Hari ini Telkomsel launching jaringan 5G. Provider pertama yang bawa tuh jaringan ke Indonesia ceunah. Met yaw kita selangkah makin deket ngejar Tony Stark   #Telkomsel5G #Telkomsel5G #Telkomsel5G #Telkomsel5G,FYI my community. Today Telkomsel launch 5G network. Provider network tuh first brought to Indonesia ceunah. Met us a step further yaw deket chasing Tony Stark # Telkomsel5G # Telkomsel5G # Telkomsel5G # Telkomsel5G
505,2021-05-27 16:02:21 SE Asia Standard Time,262026799,msnindonesia,3 Ponsel Vivo yang Bisa Terhubung Jaringan 5G Telkomsel  https://t.co/gWzT7Nmfj1,3 Mobile Vivo Can Be Connected Network 5G Telkomsel https://t.co/gWzT7Nmfj1
506,2021-05-27 16:01:56 SE Asia Standard Time,1364556212994338818,vidyararizky,"Yuhuuu!! Jaringan #telkomsel5G launching dong, selamat ya @telkomsel buat launching 5G nya beneran sekeren itu dong! Jdi makin cinta sebagai penggunanya gak pernah mengecewakan pokoknya dah! No lelet lemot club!  https://t.co/fj7MkEw9Zn","Yuhuuu !! Network # telkomsel5G launching dong, congratulations @telkomsel create 5G launching its real cool as it was then! Jdi more in love as users do not ever disappoint anyway dah! No slow slow club! https://t.co/fj7MkEw9Zn"
507,2021-05-27 16:01:33 SE Asia Standard Time,49890114,reyhansagevtii,Hari gini masih takut jaringan lemot? Eitss jangan takut kan sekarang sudah ada #Telkomsel5G terimakasih @Telkomsel,Hari gini still afraid of the network slow? Eitss do not be scared right now there # Telkomsel5G thanks @Telkomsel
508,2021-05-27 16:01:18 SE Asia Standard Time,505743048,andibachruddin,"Mati lampu sekota Samarinda , jaringan jelek , mau pakai Telkomsel juga ancur - ancuran jaringan 🙃","Samarinda's city lights off, bad network, would use Telkomsel also ancur - network ancuran 🙃"
509,2021-05-27 16:01:14 SE Asia Standard Time,1337333041958555651,rizkyayustin,"Pada heboh banget sih 5G, iyaa gua tau kog Telkomsel lagi launching #Telkomsel5G kan? Aku kan selalu up to date kalo tentang jaringan wkwkw sebagai hantu online aku turut berbahagia atas pencapaian mu!!","At the scene really does 5G, Iyaa cave tau KoG Telkomsel again launching # Telkomsel5G right? I'm always up to date on the network if the online ghost I wkwkw as sympathetic joy on your achievement !!"
510,2021-05-27 16:00:33 SE Asia Standard Time,312763658,madesuardani3d8,Sinyal jaringan Telkomsel emang bagus banget  #Telkomsel5G,Telkomsel network signal weve really good # Telkomsel5G
511,2021-05-27 16:00:16 SE Asia Standard Time,312763658,madesuardani3d8,Nah ini penting neh Sinyal jaringan Telkomsel emang bagus banget kan  #Telkomsel5G,Well this is important neh Telkomsel network signal weve really good right # Telkomsel5G
512,2021-05-27 16:00:16 SE Asia Standard Time,3246614034,siscapuspaa,Congrats telkomsel jaringan nya makin canggih ke 5G. Makin lancar makin ngebut streaming nya apalagi saat di kampung hehe  #Telkomsel5G,Congrats telkomsel its network of increasingly sophisticated to 5G. The more smoothly increasing its streaming speeding in the village especially during hehe # Telkomsel5G
513,2021-05-27 16:00:08 SE Asia Standard Time,159051057,herrysw,"4. Contohnya, Telkomsel lebih condong mempertahankan jaringan 2G karena mereka tak mau tiba-tiba kehilangan jutaan pelanggan.","4. For example, Telkomsel more inclined to maintain the 2G network because they do not want to suddenly lose millions of customers."
514,2021-05-27 15:59:01 SE Asia Standard Time,1246233962189471745,watimur1,Terbaik emnag ya nih jaringan Telkomsel #Telkomsel5G,Emnag best ya ya Telkomsel network # Telkomsel5G
515,2021-05-27 15:58:34 SE Asia Standard Time,2609201216,nandanasrulm,"@radenrauf Dengan meratanya jaringan internet khususnya 5G Telkomsel, komunikasi antar daerah di Indonesia bisa lebih baik, tranformasi digital pada masyarakat akan semakin cepat. Pastinya lebih lancar dan mudah untuk stalking si doi.😂  #Telkomsel5G","@radenrauf With the prevalence of the internet, especially 5G Telkomsel network, communication between regions in Indonesia could be better, the digital transformation of the society will be more rapid. Certainly more smoothly and easily for stalking the doi.😂 # Telkomsel5G"
516,2021-05-27 15:58:21 SE Asia Standard Time,49890114,reyhansagevtii,Selamat untuk @Telkomsel jadi yang pertama bawa 5G. Gue sekarang jadi ga khawatir jaringan lelet lagi xixi #Telkomsel5G,Welcome to @Telkomsel be the first to bring 5G. I'm now so no worry about the network slow again Xixi # Telkomsel5G
517,2021-05-27 15:57:04 SE Asia Standard Time,312763658,madesuardani3d8,Yuks kita  coba siinyal jaringan Telkomsel emang bagus banget  #Telkomsel5G,Yuks we try siinyal weve really good Telkomsel network # Telkomsel5G
518,2021-05-27 15:56:43 SE Asia Standard Time,2955763320,jadilaboran2023,kl udah pake telkomsel 4G ga perlu ganti kartu SIM lg krn udah kompatibel buat jaringan 5G👍 #Telkomsel5G,kl already use Telkomsel 4G no need to replace the SIM card is already compatible for lg krn 5G👍 # Telkomsel5G network
519,2021-05-27 15:55:13 SE Asia Standard Time,1391285228124073984,jiayuaninto1,BANGSTTT MATI LAGI BATRE AKU TINGGAL 4% NI JARINGAN ILANG-ILANG MULU YA ALLAH TELKOMSEL LU KENAPA,BANGSTTT Batre OFF AGAIN I LIVED 4% NI NETWORK Ilang-Ilang Mulu TELKOMSEL LU WHY GOD YES
520,2021-05-27 15:54:55 SE Asia Standard Time,1256546846677204992,nott_yours,gak kebayang gue kalo telkomsel udah launchingin jaringan 5g stream live musik berasa dateng langsung liat konsernya kali ya hahaha #Telkomsel5G,if telkomsel not imagine I've launchingin 5g network stream music live concert clay tasteless direct dateng times yes hahaha # Telkomsel5G
521,2021-05-27 15:54:36 SE Asia Standard Time,1256546846677204992,nott_yours,gue seneng banget denger kabar telkomsel mau launching jaringan 5g lagi daring gini ngirim tugas pasti jadi makin lancar🤩 #Telkomsel5G,I am very happy to hear the news telkomsel want to launch online network gini 5g again sent me a definite task becomes more lancar🤩 # Telkomsel5G
522,2021-05-27 15:54:13 SE Asia Standard Time,1307803755249676288,raffasyaaditya5,Makin canggih dan modern pakai jaringan 5G Telkomsel dan pertama kali di Indonesia #Telkomsel5G  https://t.co/UBiEOwbLrS,Increasingly sophisticated and modern life 5G network and first Telkomsel in Indonesia # Telkomsel5G https://t.co/UBiEOwbLrS
523,2021-05-27 15:53:36 SE Asia Standard Time,47044256,oktaviantinsdh,"@byu_id kenapa kalau open app kamu pakai jaringan kamu sendiri ga bisa, tapi pakai jaringan kakak kamu Telkomsel Halo bisa 😠 (di android di ios juga sama aja)","@byu_id why if you open the app your own network you can not, but wear your sister network can 😠 Halo Telkomsel (in android ios also just wrote)"
524,2021-05-27 15:53:17 SE Asia Standard Time,1374555240058384385,yandaaura,ga sabar gue pengen cepet cepet nyoba jaringan 5g dari telkomsel😭😭 #Telkomsel5G,I want to wait ga cepet cepet network nyoba 5g of telkomsel😭😭 # Telkomsel5G
525,2021-05-27 15:52:50 SE Asia Standard Time,1307803755249676288,raffasyaaditya5,Jaringan Telkomsel 5G pelopor pertama kali di Indonesia biar makin canggih #Telkomsel5G,Telkomsel network 5G first pioneers in Indonesia even though more sophisticated # Telkomsel5G
526,2021-05-27 15:52:23 SE Asia Standard Time,2955763320,jadilaboran2023,"Katanya nih kita bisa nonton konser tanpa dateng ke tempat tapi rasanya kek ada di sana loh kl pake telkomsel jaringan 5G ini, jadi penasaran.. #Telkomsel5G","Ya he said we could go to a concert without dateng place but it feels kek there loh kl telkomsel use 5G network, so curious .. # Telkomsel5G"
527,2021-05-27 15:50:58 SE Asia Standard Time,1321414138036301826,apriliaa_riri,Wowwww hari ini Telkomsel launcing jaringan 5G . Kereeeen bangeeet deeeeh!! #Telkomsel5G,Wowwww today Telkomsel launcing 5G network. Kereeeen bangeeet deeeeh !! # Telkomsel5G
528,2021-05-27 15:50:53 SE Asia Standard Time,2955763320,jadilaboran2023,dan kalo udah pake telkomsel 4G ga perlu ganti kartu SIM lg krn udah kompatibel buat jaringan 5G👍👍 #Telkomsel5G,and if already use Telkomsel 4G no need to replace the SIM card is already compatible for lg krn 5G👍👍 # Telkomsel5G network
529,2021-05-27 15:50:13 SE Asia Standard Time,1123168108573675521,rdliingga,"@dayatpiliang Dari dulu pake jaringan telkomsel dan sekarang jadi provider pertama Indonesia yg pakai 5g, sekarang makin lancar jaya video call keluarga pakai #Telkomsel5G semoga yang kangen keluarga bisa terobati dan bisa vidcall tanpa terjeda. Terima kasih #Telkomsel5G","@dayatpiliang From the first use Telkomsel network and now become the first provider Indonesia who wear 5g, now more smooth video call jaya wear # Telkomsel5G families who miss family may be treated and can vidcall without paused. Thanks # Telkomsel5G"
530,2021-05-27 15:49:05 SE Asia Standard Time,1374556156371234819,ur_cutegirl,"asikk nanti bisa stream yutub sepuasnya, marathon marvel yang belum pernah gue tonton sebelumnya pake jaringan 5g dari telkomsel😭❤️ #Telkomsel5G","asikk yutub later can stream as much, marathon I marvel that has never been seen before network use 5g of telkomsel😭❤️ # Telkomsel5G"
531,2021-05-27 15:49:04 SE Asia Standard Time,1300925704691875845,ibasraffasya,Telkomsel mau ada jaringan 5G dan pertama kali di Indonesia #Telkomsel5G  https://t.co/aC1sdz33qG,Telkomsel want a 5G network and the first time in Indonesia # Telkomsel5G https://t.co/aC1sdz33qG
532,2021-05-27 15:48:51 SE Asia Standard Time,1019924338835767298,kakariki_,"Kalian tau ga sih, sebenernya hari ini @Telkomsel launchingg jaringan 5G. Dan  #Telkomsel5G adalah yang pertama hadir di Indonesia..","You know ga hell, actually today @Telkomsel launchingg 5G network. And # Telkomsel5G was first present in Indonesia .."
533,2021-05-27 15:48:46 SE Asia Standard Time,1374556156371234819,ur_cutegirl,cuma telkomsel satu satunya kartu di indonesia yang mau launching jaringan 5g sneneg banget gue😍😍 #Telkomsel5G,Telkomsel's just the only card in Indonesia which would launch 5g tissue buildup sneneg gue😍😍 # Telkomsel5G
534,2021-05-27 15:47:49 SE Asia Standard Time,1324679331646328838,cewemilenial,Jadi ceritanya @telkomsel udah ngeluarin jaringan 5g cuy #Telkomsel5G,So the story is already ngeluarin @telkomsel 5g network cuy # Telkomsel5G
535,2021-05-27 15:47:35 SE Asia Standard Time,618907430,kvveputu,"@dayatpiliang Keren sih telkomsel ini Selalu jadi yg terdepan kalo soal sinyal, kebayang gimana cepet nya tuh jaringan 5G, informasi jadi makin cepat, semoga dengan ada nya jaringan 5G ini gak ada alesan males daring lagi karena sinyal lemot alias cucian mak lu noh angkatin!!! #Telkomsel5G","Cool @dayatpiliang telkomsel heck is always so that if problems leading signal, imagine how his cepet tuh 5G network, so information more quickly, hopefully with his existing 5G network is not a lazy alesan online again because of slow signal laundry alias angkatin mak lu noh! !! # Telkomsel5G"
536,2021-05-27 15:46:28 SE Asia Standard Time,88541395,ungguul,"Yg pasti, thanks @telkomsel udah bawa #Telkomsel5G ke Indonesia. Gw harap bisa bikin perubahan besar, terutama di sektor2 yang selama ini mundur karena terkait jaringan lemah.","Cinch, thanks @telkomsel already take # Telkomsel5G to Indonesia. I hope to make major changes, especially in sektor2 which during the retreat because it is related to weak network."
537,2021-05-27 15:46:16 SE Asia Standard Time,1289974713532338176,checha_aja,"Selamat buat @Telkomsel sebagai pelopor #Telkomsel5G di Indonesia, pokoknya aku udah ga sabar nungguin nyoba jaringan terbaru ini :D","Congratulations for @Telkomsel as pioneers # Telkomsel5G in Indonesia, just I've been waiting patiently ga tried this new network: D"
538,2021-05-27 15:46:01 SE Asia Standard Time,1246233962189471745,watimur1,"Btw selamat buat @Telkomsel sebagai pelopor #Telkomsel5G di Indonesia, pokoknya aku udah ga sabar nungguin nyoba jaringan terbaru ini :D","Btw congratulations for @Telkomsel as pioneers # Telkomsel5G in Indonesia, just I've been waiting patiently ga tried this new network: D"
539,2021-05-27 15:45:40 SE Asia Standard Time,1037173172485816320,ellananugroho,"Iya, kita harus berbahagia karena hari ini @Telkomsel mempersembahkan jaringan #Telkomsel5G pertama di indonesia. Kereennn.. Bisa puas akses internet dengan kecepatan penuhh...","Yes, we should be happy because today @Telkomsel network # Telkomsel5G presented first in Indonesia. Kereennn .. Can be satisfied with the speed internet access penuhh ..."
540,2021-05-27 15:45:35 SE Asia Standard Time,3763432814,rizkydevi96,Seriusan nih @Telkomsel udah punya jaringan 5G wuhuuu asik banget dah ah ntar kalo gua streaming berasa ngebutnya ngalahin si Rosi! Wkwkwkwk selamat Telkomsel buat #Telkomsel5G nya kami para pengguna mu turut berbahagia!  https://t.co/xQaFs7BW7D,Nih seriousness @Telkomsel 5G network wuhuuu've got really cool ah dah ntar streaming cave if the taste ngebutnya ngalahin Rosi! Wkwkwkwk survived his Telkomsel5G # Telkomsel make our users happy you participate! https://t.co/xQaFs7BW7D
541,2021-05-27 15:45:30 SE Asia Standard Time,963848037914177537,sanasclaw,"Jaringan 5G Telkomsel Bisa Digunakan Mulai Hari Ini, Begini Cara Pakainya  Ekonomi dan bisnis  | 27 Mei 2021 |  10:10 WIB    https://t.co/YXfUVQ9u8M","Telkomsel 5G Networks Can Be Used Start Today, Look Way of Life Economy and business | May 27, 2021 | 10:10 pm https://t.co/YXfUVQ9u8M"
542,2021-05-27 15:45:22 SE Asia Standard Time,1349144204501417984,sitiharisah73,Alhamdulillah akhirnya @Telkomsel launching jaringan 5g #Telkomsel5G,Alhamdulillah finally @Telkomsel network launching 5g # Telkomsel5G
543,2021-05-27 15:45:08 SE Asia Standard Time,3184673953,risayang__,@ohmydull @Telkomsel Aku mau ngerasain gimana rasanya make jaringan 5G :v #Telkomsel5G,@ohmydull @Telkomsel I want ngerasain how it feels makeup 5G network: v # Telkomsel5G
544,2021-05-27 15:44:40 SE Asia Standard Time,74900151,tsaqifalfatan,"Asem Cipayung mati lampu, malah jaringan Telkomsel pada lemot pula kalo mati.","Asem Cipayung lights off, even on slow network Telkomsel also if dead."
545,2021-05-27 15:44:21 SE Asia Standard Time,174111079,naqiyyah_syam,Kalau kamu kerja perlu pakai drone jaringan Telkomsel 5G ini akan sangat membantu loh! Apalagi drone canggih untuk pertanian dan militer  #Telkomsel5G  https://t.co/JX3BrBLE8J,"If you need to use drones working 5G Telkomsel's network will greatly help loh! Moreover, the advanced drone for agricultural and military # Telkomsel5G https://t.co/JX3BrBLE8J"
546,2021-05-27 15:44:07 SE Asia Standard Time,1395549434411294723,h00manb3ing,"Teknologi VR sekarang bukan sekadar angan-angan dong ya. Soalnya mulai hari ini kita udah bisa menikmati 5G di Indonesia, yang dilaunching oleh @telkomsel. Nggak sabaran akutu pengin segera nyobain ngebutnya jaringan 5G. #Telkomsel5G  https://t.co/KOeFCNWuhD","VR technology is now not just a chimera dong ya. Because starting today we can already enjoy 5G in Indonesia, which was launched by @telkomsel. Akutu impatient pengin not immediately nyobain ngebutnya 5G network. # Telkomsel5G https://t.co/KOeFCNWuhD"
547,2021-05-27 15:43:44 SE Asia Standard Time,947653149635915776,hanbinbinnn,"Pernah ngebayangin bisa nonton konser tanpa harus datang ke lokasinya langsung, tapi tetap bisa ngerasa seperti hadir di lokasi konsernya nggak? Pake teknologi VR, yang bisa terjadi di Indonesia dengan jaringan 5G yang udah dilaunching oleh Telkomsel hari ini, gaes! #Telkomsel5G","Never ngebayangin can watch the concert without having to come into direct location, but still can feel like present at the concert did not? Pake VR technology, which could happen in Indonesia with 5G networks were already launched by Telkomsel today, gaes! # Telkomsel5G"
548,2021-05-27 15:43:41 SE Asia Standard Time,1374559058376622083,kvindio,eh udah pada tau belum kalo telkomsel tuh bakal launchingin jaringan 5g loh mantap banget kan #Telkomsel5G,eh already know yet if telkomsel tuh loh 5g network will launchingin steady buildup kan # Telkomsel5G
549,2021-05-27 15:43:09 SE Asia Standard Time,1385049910907588613,membuatpondasi,"@dayatpiliang Mantap @Telkomsel  operator pertama di indonesia yang menyeleggarakan 5G ,semoga bisa menjangkau seluruh lapisan masyarakat di Indonesia karena kecepatan jaringan memberikan kemudahan ekonomi ditigal dan dunia hiburan dan bersaing dengan negara lain  #Telkomsel5G","Steady @dayatpiliang @Telkomsel first operator in Indonesia that menyeleggarakan 5G, hopefully you can reach the whole community in Indonesia because of the speed of the network provides convenience ditigal economy and the world of entertainment and compete with other countries # Telkomsel5G"
550,2021-05-27 15:42:58 SE Asia Standard Time,1374559058376622083,kvindio,mantapp ga nyesel gua jadi pelanggan setianya telkomsel sinyal lancar terus apalagi sekarang telkomsel mau launching jaringan 5g nya #Telkomsel5G,mantapp ga nyesel cave so smoothly signal loyal customers Telkomsel Telkomsel would continue especially now launching its network 5g # Telkomsel5G
551,2021-05-27 15:42:21 SE Asia Standard Time,220221517,adiddholic,"Makin betah pake Telkomsel, dengan jaringan 5G yang super kenceng #Telkomsel5G","Telkomsel wear more comfortable, with a super 5G network kenceng # Telkomsel5G"
552,2021-05-27 15:41:35 SE Asia Standard Time,174111079,naqiyyah_syam,Bakal makin membantu kerja dan belajar sering! Tidak lemot dan jaringan lancar. Siapa yang makin happy dengan berita ini? Telkomsel loh pertama di Indonesia membawa 5G.  #Telkomsel5G  https://t.co/zzO6awpv2b,Will probably help the working and learning often! Not slow and smooth network. Who is more happy with this news? Telkomsel in Indonesia loh first brought 5G. # Telkomsel5G https://t.co/zzO6awpv2b
553,2021-05-27 15:41:20 SE Asia Standard Time,1017749970626023424,penadantinta,Hari ini @Telkomsel launching jaringan 5G. Keren banget donk di Indonesia udah ada #Telkomsel5G.  https://t.co/8ZwTZ9zF7l,Today @Telkomsel launching 5G network. Cool donk in Indonesia already exists # Telkomsel5G. https://t.co/8ZwTZ9zF7l
554,2021-05-27 15:40:59 SE Asia Standard Time,220221517,adiddholic,"wah mantap banget skrg Telkomsel sudah bisa jaringan 5G di Indonesia, dgn jaringan yang kuad sampai pelosok Indonesia, jd makin nyaman pke Telkomsel deh #Telkomsel5G","Telkomsel skrg wah steady buildup can already 5G networks in Indonesia, with the quad network to remote Indonesia, Telkomsel pke more comfortable jd deh # Telkomsel5G"
555,2021-05-27 15:40:54 SE Asia Standard Time,757914977286041600,tigagelas,"emg masyarakat emg butuh yg lebih canggih nihh, makasih telkomsel udh rilis jaringan 5G #Telkomsel5G  https://t.co/t5CldXObjA","EMG EMG communities need more sophisticated nihh, thanks telkomsel UDH network release 5G # Telkomsel5G https://t.co/t5CldXObjA"
556,2021-05-27 15:40:37 SE Asia Standard Time,1266114165698998272,fifiharry13,"Siapa yang sedari dulu udah nungguin datangnya 5G di Indonesia? Kabar baik, gengs. Hari ini Telkomsel resmi launching 5G loh. Nantinya kita bisa menikmati jaringan ngebut bin lancar, nih. Yes, asyik banget kan? #Telkomsel5G  https://t.co/OMNWNzGK8A","Who had always already waiting for the arrival of 5G in Indonesia? Good news, gengs. Telkomsel today officially launching 5G tablets. Later we can enjoy speeding bin current network, here. Yes, really fun right? # Telkomsel5G https://t.co/OMNWNzGK8A"
557,2021-05-27 15:39:48 SE Asia Standard Time,1321531627831398400,pitexu,"@Bimaadii_ @Telkomsel Keren banget , makin asik push bareng @RdLiingga  pro player Indonesia pakai jaringan #Telkomsel5G pastinyaa","@Bimaadii_ @Telkomsel the Cool, cool to push more pro player @RdLiingga Indonesia with disposable tissues # Telkomsel5G pastinyaa"
558,2021-05-27 15:39:47 SE Asia Standard Time,1320750697181106176,byyivon,"masyarakat emang butuh yang lebih canggih nih, makasih telkomsel udah rilis jaringan 5G. Kalian bakal ngelakuin apa nih kalo 5G uda bisa dinikamati oleh masyarakat luas? #Telkomsel5G","communities need more sophisticated emang ya, thanks telkomsel already 5G network release. You will ngelakuin what 5G kalo uda ya can dinikamati by the wider community? # Telkomsel5G"
